Date,Title,Link
2018-03-09,5 Talents Needed for a Successful Enterprise Architecture Team,www.gartner.com/smarterwithgartner/5-talents-needed-for-a-successful-enterprise-architecture-team
2018-03-08,How to Create a Powerful Organizational Change Management Storyline,www.gartner.com/smarterwithgartner/how-to-create-a-powerful-organizational-change-management-storyline
2018-01-03,Top 5 Lessons From Marketing Leaders in 2018,www.gartner.com/en/marketing/insights/articles/top-5-lessons-from-marketing-leaders-in-2018
2018-01-18,How to Stop Data Quality Undermining Your Business,www.gartner.com/smarterwithgartner/how-to-stop-data-quality-undermining-your-business
2018-01-17,Why Some Leaders Succeed,www.gartner.com/smarterwithgartner/why-some-leaders-succeed
2018-01-31,It's Time for Infrastructure and Operations to Get Versatile,www.gartner.com/smarterwithgartner/its-time-for-infrastructure-and-operations-to-get-versatile
2018-01-30,Mobile World Congress 2018: AI Should Steal the Show,www.gartner.com/smarterwithgartner/mobile-world-congress-2018-ai-should-steal-the-show
2018-02-12,Lean Into Difficult CX Decisions,www.gartner.com/en/marketing/insights/articles/lean-into-difficult-cx-decisions
2018-02-22,Pay Attention to These 6 Marketing Technologies in 2018,www.gartner.com/en/marketing/insights/articles/pay-attention-to-these-6-marketing-technologies-in-2018
2018-03-02,Build an Agile Marketing Team,www.gartner.com/en/marketing/insights/articles/build-an-agile-marketing-team
2018-03-08,Wearables Hold the Key to Connected Health Monitoring,www.gartner.com/smarterwithgartner/wearables-hold-the-key-to-connected-health-monitoring
2018-01-15,How to Appoint a Data Protection Officer,www.gartner.com/smarterwithgartner/how-to-appoint-a-data-protection-officer
2018-01-12,Build the Case for an Identity and Access Management Program,www.gartner.com/smarterwithgartner/build-the-case-for-an-identity-and-access-management-program
2018-01-29,AI Commands Spotlight at 2018 World Economic Forum,www.gartner.com/smarterwithgartner/ai-commands-spotlight-at-2018-world-economic-forum
2018-02-08,Align Sales Enablement With Buyer Expectations,www.gartner.com/smarterwithgartner/align-sales-enablement-with-buyer-expectations
2018-02-07,Recognize and Respond to Digital Disruption,www.gartner.com/smarterwithgartner/recognize-and-respond-to-digital-disruption
2018-02-21,The Irrational Exuberance That is Blockchain,www.gartner.com/smarterwithgartner/the-irrational-exuberance-that-is-blockchain
2018-02-19,The Chief Data Officer’s Guide to an AI Strategy,www.gartner.com/smarterwithgartner/the-chief-data-officers-guide-to-an-ai-strategy
2018-03-01,How to Convince the Board to Invest in Data and Analytics,www.gartner.com/smarterwithgartner/how-to-convince-the-board-to-invest-in-data-and-analytics
2018-03-01,Plan Your Journey to GDPR Compliance,www.gartner.com/smarterwithgartner/plan-your-journey-to-gdpr-compliance
2018-03-07,How IoT Impacts Data and Analytics,www.gartner.com/smarterwithgartner/how-iot-impacts-data-and-analytics
2018-03-07,6 Ways to Earn New Digital Revenue,www.gartner.com/smarterwithgartner/6-ways-to-earn-new-digital-revenue
2018-03-06,Digital Disruption Q&A: How Enterprises Can Manage The Impact,www.gartner.com/smarterwithgartner/digital-disruption-qa-how-enterprises-can-manage-the-impact
2018-01-29,3 Top Take-Aways From the Gartner Chief Data Officer Survey,www.gartner.com/smarterwithgartner/3-top-take-aways-from-the-gartner-chief-data-officer-survey
2018-01-26,Turn Data into Dollars,www.gartner.com/smarterwithgartner/turn-data-into-dollars
2018-01-25,3 Characteristics of the New Digital Leader Mindset,www.gartner.com/smarterwithgartner/3-characteristics-of-the-new-digital-leader-mindset
2018-02-06,5 Ways Data Science and Machine Learning Impact Business,www.gartner.com/smarterwithgartner/5-ways-data-science-and-machine-learning-impact-business
2018-02-05,Overcome Employee Resistance to Change,www.gartner.com/smarterwithgartner/overcome-employee-resistance-to-change
2018-02-19,Will 5G Boost the Adoption of Smart Living?,www.gartner.com/smarterwithgartner/will-5g-boost-the-adoption-of-smart-living
2018-02-15,5 Robots You’ll Use in 5 Years [Infographic],www.gartner.com/smarterwithgartner/5-robots-youll-use-in-5-years-infographic
2018-02-14,Know the Difference Between Customer Experience and Customer Service,www.gartner.com/smarterwithgartner/know-difference-customer-experience-customer-service
2018-02-28,5 Questions to Answer When Building a Cloud Strategy,www.gartner.com/smarterwithgartner/5-questions-to-answer-when-building-a-cloud-strategy
2018-02-28,How a Test and Learn Culture Improves Customer Experience,www.gartner.com/en/marketing/insights/articles/how-a-test-and-learn-culture-improves-customer-experience
2018-02-27,2018 Top Priorities for Customer Service and Support,www.gartner.com/smarterwithgartner/2018-top-priorities-for-customer-service-and-support
2018-03-06,Is Digital a Priority for Your Industry?,www.gartner.com/smarterwithgartner/is-digital-a-priority-for-your-industry
2018-03-06,Prioritize Omnichannel Investments to Ensure Seamless Customer Experience,www.gartner.com/smarterwithgartner/prioritize-omnichannel-investments-ensure-seamless-customer-experience
2018-02-05,How to Properly Measure Multichannel Marketing Campaigns,www.gartner.com/en/marketing/insights/articles/how-to-properly-measure-multichannel-marketing-campaigns
2018-03-20,Build Supply Chain Excellence From the Ground Up,www.gartner.com/smarterwithgartner/build-supply-chain-excellence-from-the-ground-up
2018-03-16,Key Findings From the Gartner Customer Experience Survey,www.gartner.com/en/marketing/insights/articles/key-findings-from-the-gartner-customer-experience-survey
2018-03-15,5 Ways to Prevent a Spectre or Meltdown Attack,www.gartner.com/smarterwithgartner/5-ways-to-prevent-a-spectre-or-meltdown-attack
2018-03-15,8 Steps to Get DevOps Right,www.gartner.com/smarterwithgartner/8-steps-to-get-devops-right
2018-03-14,Select the Right Digital Commerce Platform,www.gartner.com/en/marketing/insights/articles/select-the-right-digital-commerce-platform
2018-03-13,Confront Key Challenges to Boost Digital Twin Success,www.gartner.com/smarterwithgartner/confront-key-challenges-to-boost-digital-twin-success
2018-04-02,The First 100 Days of an Enterprise Architect,www.gartner.com/smarterwithgartner/the-first-100-days-of-an-enterprise-architect
2018-04-06,12 Steps to Excellence in Artificial Intelligence for IT Operations,www.gartner.com/smarterwithgartner/12-steps-to-excellence-in-artificial-intelligence-for-it-operations-infographic
2018-04-06,Prepare for the Next Wave of Social Media Marketing,www.gartner.com/en/marketing/insights/articles/prepare-for-the-next-wave-of-social-media-marketing
2018-03-13,Top Risks for Legal and Compliance Leaders in 2018,www.gartner.com/smarterwithgartner/top-risks-for-legal-and-compliance-leaders-in-2018
2018-03-12,2 Ways to Promote the Value of Service,www.gartner.com/smarterwithgartner/2-ways-to-promote-the-value-of-service
2018-04-16,3 Ways CFOs Can Promote Job Mobility,www.gartner.com/smarterwithgartner/3-ways-cfos-can-promote-job-mobility
2018-03-30,5 (re)Negotiation Tactics to Get More Value From Your Existing External Auditor [Infographic],www.gartner.com/smarterwithgartner/5-renegotiation-tactics-to-get-more-value-from-your-existing-external-auditor-infographic
2018-03-29,6 Ways to Shape Your CX for Gen Z,www.gartner.com/smarterwithgartner/6-ways-to-shape-your-cx-for-gen-z
2018-04-05,The Most Critical Account Planning Mistakes,www.gartner.com/smarterwithgartner/the-most-critical-account-planning-mistakes
2018-04-05,5 GDPR Questions Keeping CISOs Awake at Night,www.gartner.com/smarterwithgartner/5-gdpr-questions-keeping-cisos-awake-at-night
2018-04-24,10 Common Security Awareness Mistakes and How to Avoid Them [Infographic],www.gartner.com/smarterwithgartner/10-common-security-awareness-mistakes-and-how-to-avoid-them-infographic
2018-04-16,Make Culture a Priority for an Agile Organization,www.gartner.com/smarterwithgartner/make-culture-a-priority-for-an-agile-organization
2018-05-01,Learn the Art of Culture Hacking,www.gartner.com/smarterwithgartner/learn-the-art-of-culture-hacking-for-culture-change
2018-03-28,Cybersecurity Q&A: The New World of Cyber,www.gartner.com/smarterwithgartner/cybersecurity-qa-the-new-world-of-cyber
2018-05-11,Peer Feedback Boosts Employee Performance,www.gartner.com/smarterwithgartner/peer-feedback-boosts-employee-performance
2018-04-04,3 Steps to Turn Legal Data Into Insights,www.gartner.com/smarterwithgartner/3-steps-to-turn-legal-data-into-insights
2018-05-18,Learn to Conduct Effective Gate Reviews,www.gartner.com/smarterwithgartner/learn-to-conduct-effective-gate-reviews
2018-04-23,High-Potential Employees Want Chances to Grow and Learn,www.gartner.com/smarterwithgartner/high-potential-employees-want-chances-to-grow-and-learn
2018-04-13,Gartner Top 5 Marketing Predictions for 2018,www.gartner.com/en/marketing/insights/articles/gartner-top-5-marketing-predictions-for-2018
2018-05-01,Make it Easier for Customers to Buy,www.gartner.com/smarterwithgartner/make-easier-customers-buy
2018-03-27,4 Challenges Facing IT Sourcing and Vendor Management Leaders,www.gartner.com/smarterwithgartner/4-challenges-facing-it-sourcing-and-vendor-management-leaders
2018-05-10,How Artificial Intelligence Will Drive Transformative Change in Marketing,www.gartner.com/en/marketing/insights/articles/how-artificial-intelligence-will-drive-transformative-change-in-marketing
2018-04-04,Why Sustainability Matters to Supply Chain Sourcing,www.gartner.com/smarterwithgartner/why-sustainability-matters-to-supply-chain-sourcing
2018-05-30,The Vicious Cycle Of Business Misconduct [Infographic],www.gartner.com/smarterwithgartner/the-vicious-cycle-of-business-misconduct-infographic
2018-05-17,Top 3 Blockchain and Data Management Myths,www.gartner.com/smarterwithgartner/top-3-blockchain-and-data-management-myths
2018-06-11,4 Factors Shape the Future of Hyperconverged Infrastructure,www.gartner.com/smarterwithgartner/4-factors-shape-the-future-of-hyperconverged-infrastructure
2018-06-06,Gartner Top 10 Security Projects for 2018,www.gartner.com/smarterwithgartner/gartner-top-10-security-projects-for-2018
2018-04-23,The Realities of the Net Neutrality Rollback,www.gartner.com/smarterwithgartner/the-realities-of-the-net-neutrality-rollback
2018-04-11,Better Equip Leaders for Turbulent Times,www.gartner.com/smarterwithgartner/better-equip-leaders-for-turbulent-times
2018-04-30,5 Ways to Make Legal More Agile,www.gartner.com/smarterwithgartner/5-ways-to-make-legal-more-agile
2018-06-21,CEOs Look for Serious Growth in Gartner 2018 CEO Survey,www.gartner.com/smarterwithgartner/ceos-look-for-serious-growth-in-gartner-2018-ceo-survey
2018-03-27,Digitalizing For The Future: The Infrastructure and Operations Roadmap,www.gartner.com/smarterwithgartner/digitalizing-for-the-future-the-infrastructure-and-operations-roadmap
2018-03-23,A Roadmap to Discover Digital Talent [Infographic],www.gartner.com/smarterwithgartner/a-roadmap-to-discover-digital-talent-infographic
2018-05-09,How to Secure the Blockchain Ecosystem,www.gartner.com/smarterwithgartner/how-to-secure-the-blockchain-ecosystem
2018-04-04,How To Build A Business Case For Artificial Intelligence,www.gartner.com/smarterwithgartner/how-to-build-a-business-case-for-artificial-intelligence
2018-05-25,How to Brief the Board on Sexual Harassment,www.gartner.com/smarterwithgartner/how-to-brief-the-board-on-sexual-harassment
2018-07-05,Build Value Into AR and VR Products,www.gartner.com/en/marketing/insights/articles/build-value-into-ar-and-vr-products
2018-05-17,Is Your Marketing Plan Realistic?,www.gartner.com/en/marketing/insights/articles/is-your-marketing-plan-realistic
2018-06-11,How CIOs Can Get the Right Seat at the Table,www.gartner.com/smarterwithgartner/how-cios-can-get-the-right-seat-at-the-table-cio-leadership
2018-06-05,5 Security Roles to Plan for in the Digital Era,www.gartner.com/smarterwithgartner/5-security-roles-to-plan-for-in-the-digital-era
2018-07-12,Lead Culture Change,www.gartner.com/smarterwithgartner/lead-culture-change
2018-07-12,Enter the Age of Analytics,www.gartner.com/smarterwithgartner/enter-the-age-of-analytics
2018-04-20,Take Your Social Marketing Measurement to the Next Level,www.gartner.com/en/marketing/insights/articles/take-your-social-marketing-measurement-to-the-next-level
2018-04-19,Prepare for Automation’s Impact on Application Development,www.gartner.com/smarterwithgartner/prepare-for-automations-impact-on-application-development
2018-08-30,What Marketing Needs to Know to Hire Top Talent,www.gartner.com/en/marketing/insights/articles/what-marketing-needs-to-know-to-hire-top-talent
2018-08-29,Gartner Experts Discuss Top B2B Sales Trends,www.gartner.com/smarterwithgartner/gartner-experts-discuss-top-b2b-sales-trends
2018-04-11,Understanding Cloud Adoption in Government,www.gartner.com/smarterwithgartner/understanding-cloud-adoption-in-government
2018-04-11,Build Stronger Marketing Analytics With Cross-Training,www.gartner.com/en/marketing/insights/articles/build-stronger-marketing-analytics-with-cross-training
2018-09-06,Take Programmatic Advertising In-house,www.gartner.com/en/marketing/insights/articles/take-programmatic-advertising-in-house
2018-09-05,4 Ways CIOs Can Foster Digital Dexterity,www.gartner.com/smarterwithgartner/4-ways-cios-can-foster-digital-dexterity-infographic
2018-04-27,Recruiting is a Team Sport in the Digital Age,www.gartner.com/smarterwithgartner/recruiting-is-a-team-sport-in-the-digital-age
2018-04-27,7 Customer Service Personality Types,www.gartner.com/smarterwithgartner/take-action-problem-solvers-key-painless-customer-service
2018-06-20,Hidden Cloud Growth Opportunities for Technology Service Providers,www.gartner.com/smarterwithgartner/7-hidden-cloud-growth-opportunities-for-technology-service-providers
2018-06-19,How to Create a Business Case for Data Quality Improvement,www.gartner.com/smarterwithgartner/how-to-create-a-business-case-for-data-quality-improvement
2018-03-20,Improve Your Technology Product Differentiation,www.gartner.com/smarterwithgartner/improve-your-technology-product-differentiation
2018-05-08,Prepare Your Organization for Disruption,www.gartner.com/smarterwithgartner/prepare-your-organization-for-disruption
2018-04-02,3 Priorities For CEO-CHRO Collaboration in the Digital Age,www.gartner.com/smarterwithgartner/3-priorities-for-ceo-chro-collaboration-in-the-digital-age
2018-05-25,Shared Services Poised for Next-Level Robotics,www.gartner.com/smarterwithgartner/shared-services-poised-for-next-level-robotics
2018-07-03,Should You Build or Buy a Customer Data Platform?,www.gartner.com/en/marketing/insights/articles/should-you-build-or-buy-a-customer-data-platform
2018-06-29,Make the Case for a Customer Data Platform,www.gartner.com/en/marketing/insights/articles/make-the-case-for-a-customer-data-platform
2018-05-16,Are You Ready for GDPR?,www.gartner.com/smarterwithgartner/ready-guide-to-gdpr
2018-06-08,Make Life Easier for Service Reps and Customers Win,www.gartner.com/smarterwithgartner/make-life-easier-service-reps-customers-win
2018-06-05,Why CISOs Must Evolve Alongside CIOs,www.gartner.com/smarterwithgartner/why-cisos-must-evolve-alongside-cios
2018-10-09,How to Market to Customers via Mobile Marketing,www.gartner.com/en/marketing/insights/articles/how-to-market-to-customers-via-mobile-marketing
2018-10-08,Canadian CIOs: Find Money in Creative Ways,www.gartner.com/smarterwithgartner/canadian-cios-find-money-in-creative-ways
2018-09-14,Improve Multichannel Marketing With Customer Data Platforms,www.gartner.com/en/marketing/insights/articles/improve-multichannel-marketing-with-customer-data-platforms
2018-04-19,Top 4 Challenges Facing IT Infrastructure Leaders,www.gartner.com/smarterwithgartner/top-4-challenges-facing-it-infrastructure-leaders
2018-08-28,"What's Ahead For AI, Smart Speakers and Smartphones?",www.gartner.com/smarterwithgartner/whats-ahead-for-ai-smart-speakers-and-smartphones
2018-04-10,"Human Beings, AI and Robots to Represent the new Workforce in 2028",www.gartner.com/smarterwithgartner/human-beings-ai-and-robots-to-represent-the-new-workforce-in-2028
2018-09-05,Are Your Employees Quitting in Their Seats?,www.gartner.com/smarterwithgartner/are-your-employees-quitting-in-their-seats
2018-09-24,The Emergence of the IoT Architect,www.gartner.com/smarterwithgartner/the-emergence-of-the-iot-architect
2018-09-21,5 Must-Haves in Your Job Description,www.gartner.com/smarterwithgartner/5-must-haves-in-your-job-description
2018-04-26,Use a Hybrid Integration Approach to Empower Digital Transformation,www.gartner.com/smarterwithgartner/use-a-hybrid-integration-approach-to-empower-digital-transformation
2018-04-25,Gartner Top 6 Future Work Trends,www.gartner.com/smarterwithgartner/anticipate-and-exploit-future-work-trends
2018-06-18,Sales Must Trusted Resource B2B Buyers,www.gartner.com/smarterwithgartner/sales-must-trusted-resource-b2b-buyers
2018-06-15,Simple Steps Internal Audit Can Take Toward Real-Time Assurance,www.gartner.com/smarterwithgartner/simple-steps-internal-audit-can-take-toward-real-time-assurance
2018-05-07,4 Steps to Close Skill Gaps in Legal,www.gartner.com/smarterwithgartner/4-steps-to-close-skill-gaps-in-legal
2018-05-04,3 Steps to Implement Rolling Forecasts,www.gartner.com/smarterwithgartner/3-steps-to-implement-rolling-forecasts
2018-09-28,Be Bold Yet Purposeful in M&A Strategy,www.gartner.com/smarterwithgartner/be-bold-yet-purposeful-in-ma
2018-09-27,"5 Strategic Technologies on the Gartner Hype Cycle for Midsize Enterprises, 2018",www.gartner.com/smarterwithgartner/5-strategic-technologies-on-the-gartner-hype-cycle-for-midsize-enterprises-2018
2018-05-23,Drive Deal Success Better Coaching and Support,www.gartner.com/smarterwithgartner/drive-deal-success-better-coaching-support
2018-05-22,The Marketer’s Guide to Customer Data Platforms,www.gartner.com/en/marketing/insights/articles/marketers-to-guide-customer-data-platforms
2018-06-28,The Beginner’s Guide to Decentralized Identity,www.gartner.com/smarterwithgartner/the-beginners-guide-to-decentralized-identity
2018-06-27,Assess Blockchain for GDPR Compliance,www.gartner.com/smarterwithgartner/assess-blockchain-for-gdpr-compliance
2018-05-16,Key Findings from Gartner Marketing Analytics Survey 2018,www.gartner.com/en/marketing/insights/articles/key-findings-from-gartner-marketing-analytics-survey-2018
2018-05-16,5 Ways to Optimize Your Marketing Agency Mix,www.gartner.com/en/marketing/insights/articles/5-ways-to-optimize-your-marketing-agency-mix
2018-06-08,How to Get Customers to Use Mobile App,www.gartner.com/smarterwithgartner/how-to-get-customers-to-use-mobile-app
2018-06-07,5 Types of Workers That Can Revitalize Your Digital Workplace,www.gartner.com/smarterwithgartner/5-types-of-workers-to-drive-the-digital-workplace
2018-06-04,Gartner Keynote: Scale IT Security to Build Trust and Resilience,www.gartner.com/smarterwithgartner/gartner-keynote-scale-it-security-to-build-trust-and-resilience
2018-06-04,7 Key Takeaways From Gartner Digital Marketing Conference 2018,www.gartner.com/en/marketing/insights/articles/7-key-takeaways-from-gartner-digital-marketing-conference-2018
2018-05-31,Build Your Digital Workforce for Success,www.gartner.com/smarterwithgartner/build-your-digital-workforce-for-success
2018-10-05,Rethink Screening of Job Applicants to Identify Serious Candidates,www.gartner.com/smarterwithgartner/rethink-screening-of-job-applicants-to-identify-serious-candidates
2018-10-04,Reduce Your Cloud Data Management Costs,www.gartner.com/smarterwithgartner/reduce-your-cloud-data-management-costs
2018-07-11,Grow Your Content Marketing Budget,www.gartner.com/en/marketing/insights/articles/grow-your-content-marketing-budget
2018-07-10,5 Strategies for Successful CIO Leadership Transition,www.gartner.com/smarterwithgartner/5-strategies-for-successful-cio-leadership-transition
2018-09-13,Empower the Business to Own Compliance Risk,www.gartner.com/smarterwithgartner/empower-the-business-to-own-compliance-risk
2018-09-12,Embrace Instability for the Digital World,www.gartner.com/smarterwithgartner/embrace-instability-for-the-digital-world
2018-04-18,How Your Supply Chain Can Improve the Customer Experience,www.gartner.com/smarterwithgartner/how-your-supply-chain-can-improve-the-customer-experience
2018-04-17,How to Get Artificial Intelligence 'Right',www.gartner.com/smarterwithgartner/how-to-get-artificial-intelligence-right
2018-08-24,CISOs Must Master Data Governance for GDPR Compliance,www.gartner.com/smarterwithgartner/cisos-must-master-data-governance-for-gdpr-compliance
2018-08-23,Improve B2B Lead Generation With Enterprise Personas,www.gartner.com/en/marketing/insights/articles/improve-b2b-lead-generation-with-enterprise-personas
2018-04-09,The CIO’s Approach to Business Strategy,www.gartner.com/smarterwithgartner/the-cios-approach-to-business-strategy
2018-09-04,Make Strategic Planning Count,www.gartner.com/smarterwithgartner/make-strategic-planning-count
2018-09-04,Shift to Digital-Grade Decision Making,www.gartner.com/smarterwithgartner/shift-to-digital-grade-decision-making
2018-09-21,Blockchain For Supply Chain Requires These 5 Lessons,www.gartner.com/smarterwithgartner/blockchain-for-supply-chain-requires-these-5-lessons
2018-09-20,Build a Data-Driven Organization,www.gartner.com/smarterwithgartner/build-a-data-driven-organization
2018-04-25,How to Shift to a Business Agile Mindset,www.gartner.com/smarterwithgartner/how-to-shift-to-a-business-agile-mindset
2018-06-14,Help Clients Find Value in AI,www.gartner.com/smarterwithgartner/help-clients-find-value-in-ai
2018-06-12,"Motivate Employees With Ongoing, Forward-Looking Feedback",www.gartner.com/smarterwithgartner/motivate-employees-with-ongoing-forward-looking-feedback
2018-05-03,Why Canadian CIOs Need to Invest in Digital,www.gartner.com/smarterwithgartner/why-canadian-cios-need-to-invest-in-digital
2018-05-02,How to Rescue a Major Project or Program in 10 Steps,www.gartner.com/smarterwithgartner/how-to-rescue-a-project-in-10-steps
2018-09-26,7 Steps to Implement Single Sign-On,www.gartner.com/smarterwithgartner/7-steps-to-implement-single-sign-on
2018-09-26,Take a New Approach to IT Cost Management,www.gartner.com/smarterwithgartner/take-a-new-approach-to-it-cost-management
2018-05-21,Digital Demands CFOs Rethink How to Deliver Value,www.gartner.com/smarterwithgartner/digital-demands-cfos-rethink-how-to-deliver-value
2018-05-21,How Legal Stays Ahead of Data Privacy Risk,www.gartner.com/smarterwithgartner/how-legal-stays-ahead-of-data-privacy-risk
2018-06-27,Why Not Work With a Bot?,www.gartner.com/smarterwithgartner/why-not-work-with-a-bot
2018-06-25,Prepare Your IT Asset Management for 2020,www.gartner.com/smarterwithgartner/prepare-your-it-asset-management-for-2020
2018-05-15,The Growing Importance Of The Enterprise PMO,www.gartner.com/smarterwithgartner/the-growing-importance-of-the-enterprise-pmo
2018-06-07,Create a CX-First Culture for Executives,www.gartner.com/smarterwithgartner/create-a-cx-first-culture-for-executives
2018-05-31,7 Habits of Highly Effective Marketing Leaders,www.gartner.com/en/marketing/insights/articles/7-habits-of-highly-effective-marketing-leaders
2018-05-30,Moving to a Software Subscription Model,www.gartner.com/smarterwithgartner/moving-to-a-software-subscription-model
2018-10-03,What Edge Computing Means for Infrastructure and Operations Leaders,www.gartner.com/smarterwithgartner/what-edge-computing-means-for-infrastructure-and-operations-leaders
2018-10-16,Gartner Top Strategic Predictions for 2019 and Beyond,www.gartner.com/smarterwithgartner/gartner-top-strategic-predictions-for-2019-and-beyond
2018-07-10,3 Ways to Show How Valuable Shared Services Can Be,www.gartner.com/smarterwithgartner/three-ways-to-show-how-valuable-shared-services-can-be
2018-07-09,Why Blockchain Matters to Supply Chain Executives,www.gartner.com/smarterwithgartner/why-blockchain-matters-to-supply-chain-executives
2018-09-11,13 Surprising Uses For Emotion AI Technology,www.gartner.com/smarterwithgartner/13-surprising-uses-for-emotion-ai-technology
2018-09-10,4 Trends in Gartner Hype Cycle for Customer Service and Customer Engagement,www.gartner.com/smarterwithgartner/4-trends-gartner-hype-cycle-customer-service-customer-engagement
2018-08-22,Analysts Answer: The Key to a Successful Digital Transformation,www.gartner.com/smarterwithgartner/analysts-answer-the-key-to-a-successful-digital-transformation
2018-09-03,"Top Trends from Gartner Hype Cycle for Digital Government Technology, 2018",www.gartner.com/smarterwithgartner/top-trends-from-gartner-hype-cycle-for-digital-government-technology-2018
2018-09-03,Modernize Procurement with Sourcing Optimization,www.gartner.com/smarterwithgartner/modernize-procurement-with-sourcing-optimization
2018-06-12,Why We Need a Digital Social Contract,www.gartner.com/smarterwithgartner/why-we-need-a-digital-social-contract
2018-09-25,FOMO Drives the Next Generation of Mobile Customers,www.gartner.com/smarterwithgartner/fomo-drives-the-next-generation-of-mobile-customers
2018-05-18,Fine-Tune Development Spend to Make Managers More Effective,www.gartner.com/smarterwithgartner/fine-tune-development-spend-to-make-managers-more-effective
2018-06-21,6 Ways Compliance Can Build Data Analytics Skills,www.gartner.com/smarterwithgartner/6-ways-compliance-can-build-data-analytics-skills
2018-05-15,Gartner Keynote: Marketing in the Wilderness of Disruption,www.gartner.com/en/marketing/insights/articles/gartner-keynote-marketing-in-the-wilderness-of-disruption
2018-06-07,How to Hunt For Security Threats,www.gartner.com/smarterwithgartner/how-to-hunt-for-security-threats
2018-06-06,Develop Your Technology Risk Appetite,www.gartner.com/smarterwithgartner/develop-your-technology-risk-appetite
