Date,Title,Link
2021-10-25,3 Supply Chain Strategies to Drive Purpose-Driven Outcomes for a Fractured World,www.gartner.com/en/articles/3-supply-chain-strategies-to-drive-purpose-driven-outcomes-for-a-fractured-world
2021-10-22,How to Deliver Relevant Content Across the Technology Buyer Journey,www.gartner.com/en/articles/how-to-deliver-relevant-content-across-the-technology-buyer-journey
2021-10-21,6 Key Takeaways from the Gartner Board of Directors Survey,www.gartner.com/en/articles/6-key-takeaways-from-the-gartner-board-of-directors-survey
2021-10-21, IT Budgets Are Growing. Here's Where the Money's Going,www.gartner.com/en/articles/it-budgets-are-growing-here-s-where-the-money-s-going
2021-10-20,The Top 8 Cybersecurity Predictions for 2021-2022,www.gartner.com/en/articles/the-top-8-cybersecurity-predictions-for-2021-2022
2021-10-20,How to Make Better Business Decisions,www.gartner.com/smarterwithgartner/how-to-make-better-business-decisions
2021-10-19,Calling All Women in IT: Are You Driving a More Inclusive Workplace?,www.gartner.com/en/articles/calling-all-women-in-it-are-you-driving-a-more-inclusive-workplace-
2021-10-19,You’ll Be Breaking Up With Bad Customers — and 9 Other Predictions for 2022 and Beyond,www.gartner.com/en/articles/you-ll-be-breaking-up-with-bad-customers-and-9-other-predictions-for-2022-and-beyond
2021-09-22,"The 4 Trends That Prevail on the Gartner Hype Cycle for AI, 2021",www.gartner.com/en/articles/the-4-trends-that-prevail-on-the-gartner-hype-cycle-for-ai-2021
2021-09-21,Why You Need Neurodiverse Talent,www.gartner.com/en/articles/why-you-need-neurodiverse-talent
2021-09-20,How to Run an IT Service Desk in a Hybrid or Remote World,www.gartner.com/en/articles/how-to-run-an-it-service-desk-in-a-hybrid-or-remote-world
2021-09-15,4 Metrics That Prove Your Cybersecurity Program Works,www.gartner.com/en/articles/4-metrics-that-prove-your-cybersecurity-program-works
2021-09-13,The CFO’s Guide to Digital Investment,www.gartner.com/smarterwithgartner/the-cfos-guide-to-digital-investment
2021-09-09,4 Key Tech Trends in Customer Service to Watch,www.gartner.com/smarterwithgartner/4-key-tech-trends-in-customer-service-to-watch
2021-09-08,"4 Must-Have Technologies That Made the Gartner Hype Cycle for Cloud Security, 2021",www.gartner.com/smarterwithgartner/4-must-have-technologies-that-made-the-gartner-hype-cycle-for-cloud-security-2021
2021-09-02,Use This 6-Step Approach to Get Buy-In for Data and Analytics Strategies,www.gartner.com/smarterwithgartner/use-this-6-step-approach-to-get-buy-in-for-data-and-analytics-strategies
2021-10-18,Where CIOs and IT Leaders Will Go Next,www.gartner.com/en/articles/where-cios-and-it-leaders-will-go-next
2021-10-14,6 Predictions for the Future of Performance Management,www.gartner.com/en/articles/6-predictions-for-the-future-of-performance-management
2021-09-01,How to Build a Digital Business Technology Platform,www.gartner.com/smarterwithgartner/how-to-build-a-digital-business-technology-platform
2021-08-31,"Gartner Keynote: Why Marketers Are Vital for Connected, Successful Organizations ",www.gartner.com/en/marketing/insights/articles/gartner-keynote-why-marketers-are-vital-for-connected-successful-organizations
2021-10-10,"When it Comes to Ransomware, Should Your Company Pay?",www.gartner.com/en/articles/when-it-comes-to-ransomware-should-your-company-pay-
2021-10-08,How to Reduce Outside Counsel Spend — in Just Two Steps,www.gartner.com/en/articles/reduce-outside-counsel-spend-in-just-two-steps
2021-08-09,Dear CEOs: Here Are the Do's and Don'ts for Announcing Return-to-Work Plans,www.gartner.com/smarterwithgartner/dos-and-donts-for-announcing-return-to-work-plans
2021-08-06,Global HR Leaders Reveal Where Their Companies Are At When It Comes To COVID-19 — And It’s Not Pretty,www.gartner.com/smarterwithgartner/global-hr-leaders-reveal-where-their-companies-are-at-when-it-comes-to-covid
2021-08-30,The Top 10 Oil and Gas Trends to Watch,www.gartner.com/smarterwithgartner/10-oil-and-gas-trends-to-watch-in-2021
2021-08-30,Knowledge Workers Aren’t the Only Ones Who Want Flexibility; Here’s How to Offer It to Others,www.gartner.com/smarterwithgartner/knowledge-workers-arent-the-only-ones-who-want-flexibility-heres-how-to-offer-it-to-others
2021-08-25,How to Successfully Shift to Consumption-Based Subscription Models,www.gartner.com/smarterwithgartner/how-to-successfully-shift-to-consumption-based-subscription-models
2021-08-23,3 Themes Surface in the 2021 Hype Cycle for Emerging Technologies,www.gartner.com/smarterwithgartner/3-themes-surface-in-the-2021-hype-cycle-for-emerging-technologies
2021-10-05,Your Primer on AI for Sales,www.gartner.com/en/articles/your-primer-on-ai-for-sales
2021-09-30,4 Data & Analytics Trends CFOs Can’t Afford to Ignore,www.gartner.com/en/articles/4-data-analytics-trends-cfos-can-t-afford-to-ignore
2021-08-05,7 Key Shifts in Marketing Channel Spend in 2021,www.gartner.com/en/marketing/insights/articles/7-key-shifts-in-marketing-channel-spend-in-2021
2021-08-04,3 Ways to Monetize Data and Analytics,www.gartner.com/smarterwithgartner/3-ways-to-monetize-data-and-analytics
2021-07-28,How Remote and Hybrid Work Models Affect Costs: 5 Data Insights for CFOs,www.gartner.com/smarterwithgartner/how-remote-and-hybrid-work-models-affect-costs-5-data-insights-for-cfos
2021-07-28,3 Actions Help You Train More Cybersecurity Savvy Employees,www.gartner.com/smarterwithgartner/3-actions-help-you-train-more-cybersecurity-savvy-employees
2021-08-27,Building Your Annual Corporate Comms Budget? Know Where to Focus Resources,www.gartner.com/en/marketing/insights/articles/building-your-annual-corporate-comms-budget-know-where-to-focus-resources
2021-08-27,3 Ways to Make Your Software Engineering Team 50% More Effective,www.gartner.com/smarterwithgartner/3-ways-to-make-your-software-engineering-team-50-more-effective
2021-07-16,6 Key Actions for a Successful Smart Manufacturing Strategy,www.gartner.com/smarterwithgartner/6-key-actions-for-a-successful-smart-manufacturing-strategy
2021-07-14,How to Improve Your Data Quality,www.gartner.com/smarterwithgartner/how-to-improve-your-data-quality
2021-08-20,Should Your Team Be Using Microservice Architectures?,www.gartner.com/smarterwithgartner/should-your-team-be-using-microservice-architectures
2021-08-19,How Digital Immunity Will Improve Your Software Quality,www.gartner.com/smarterwithgartner/how-digital-immunity-will-improve-your-software-quality
2021-09-28,5 Key Trends from 2021’s Hype Cycle for Customer Service and Support Technologies,www.gartner.com/en/articles/5-key-trends-from-2021-s-hype-cycle-for-customer-service-and-support-technologies
2021-09-27,3 Key Takeaways About Digital Marketing From Top Brands,www.gartner.com/en/marketing/insights/articles/3-key-takeaways-about-digital-marketing-from-top-brands
2021-07-30,Software Engineers Need Design Systems to Build Products With Good UX,www.gartner.com/smarterwithgartner/software-engineers-need-design-systems-to-build-products-with-good-ux
2021-07-29,"All Industries Saw Marketing Budgets Cut in 2021, But Some More Than Others",www.gartner.com/en/marketing/insights/articles/all-industries-saw-marketing-budgets-cut-in-2021
2021-07-23,Top 5 API Lessons for Software Engineering Leaders,www.gartner.com/smarterwithgartner/top-5-api-lessons-for-software-engineering-leaders
2021-07-22,Tap Mentors and Sponsors to Drive Legal Department Diversity,www.gartner.com/smarterwithgartner/tap-mentors-and-sponsors-to-drive-legal-department-diversity
2021-08-26,Want Your Marketing Innovations to Pay Off? First Define Innovation.,www.gartner.com/en/marketing/insights/articles/want-your-marketing-innovations-to-pay-off-define-innovation
2021-07-13,The Art of the One-Page Strategy,www.gartner.com/smarterwithgartner/the-art-of-the-one-page-strategy
2021-07-13,Hybrid and Remote Workers Change How They Use IT Equipment,www.gartner.com/smarterwithgartner/hybrid-and-remote-workers-change-how-they-use-it-equipment
2021-08-17,3 Cloud Disciplines to Fuel Digital Innovation,www.gartner.com/smarterwithgartner/3-cloud-disciplines-to-fuel-digital-innovation
2021-08-12,The CFO’s Guide to Digital Strategy,www.gartner.com/smarterwithgartner/the-cfos-guide-to-digital-strategy
2021-07-29,Use Flow Analytics to Improve Visibility and Drive Agile Improvement,www.gartner.com/smarterwithgartner/use-flow-analytics-to-improve-visbility-and-drive-agile-improvement
2021-07-29,How to Mix Your Talent Strategies to Bridge Skills Gaps,www.gartner.com/smarterwithgartner/how-to-mix-your-talent-strategies-to-bridge-skills-gaps
2021-06-23,How to Set Practical Time Frames to Remedy Security Vulnerabilities,www.gartner.com/smarterwithgartner/how-to-set-practical-time-frames-to-remedy-security-vulnerabilities
2021-06-21,High-Performance Culture,www.gartner.com/en/human-resources/trends/chro-quarterly/culture-that-performs
2021-06-18,Adhaar Test This New Article,www.gartner.com/en/articles/the-esg-imperative-7-factors-for-finance-leaders-to-consider
2021-07-21,3 Steps for Marketers to Prepare for a Cookieless World,www.gartner.com/en/marketing/insights/articles/three-steps-for-marketers-to-prepare-for-a-cookieless-world
2021-07-20,Marketing Budgets Drop to Lowest Levels in Recent History,www.gartner.com/en/marketing/insights/articles/marketing-budgets-drop-to-lowest-levels-in-recent-history
2021-07-07,6 Ways Cloud Migration Costs Go Off the Rails,www.gartner.com/smarterwithgartner/6-ways-cloud-migration-costs-go-off-the-rails
2021-07-02,5 Steps to Validate New High Tech Product Planning,www.gartner.com/smarterwithgartner/5-steps-to-validate-new-hi-tech-product-planning
2021-08-26,A Data and Analytics Leader's Guide to Data Literacy,www.gartner.com/smarterwithgartner/a-data-and-analytics-leaders-guide-to-data-literacy
2021-05-25,The CFO at a Crossroads: How to Be a Catalyst for Transformation,www.gartner.com/smarterwithgartner/the-cfo-at-a-crossroads-how-to-be-a-catalyst-for-transformation
2021-05-24,3 Ways to Gain Support for Your Security Awareness Training Program,www.gartner.com/smarterwithgartner/3-ways-to-gain-support-for-your-security-awareness-training-program
2021-07-12,Preparing Boards for Talent Conversations with Investors,www.gartner.com/en/human-resources/trends/preparing-boards-for-conversations
2021-07-12,7 Key Foundations for Modern Data and Analytics Governance,www.gartner.com/smarterwithgartner/7-key-foundations-for-modern-data-and-analytics-governance
2021-06-14,4 Modes of Collaboration Are Key to Success in Hybrid Work,www.gartner.com/smarterwithgartner/4-modes-of-collaboration-are-key-to-success-in-hybrid-work
2021-06-12,How to Make AI Trustworthy,www.gartner.com/smarterwithgartner/how-to-make-ai-trustworthy
2021-06-11,Can Your IT Team Culture Drive Your Digital Ambitions?,www.gartner.com/smarterwithgartner/can-your-it-team-culture-drive-your-digital-ambitions
2021-08-12,3 Steps to Build a Strong Post-Merger Culture,www.gartner.com/smarterwithgartner/3-steps-to-build-a-strong-post-merger-culture
2021-08-11,What Is Work Really Like Today? Leaders and Employees See Things Differently,www.gartner.com/smarterwithgartner/what-is-work-really-like-today-leaders-and-employees-see-things-differently
2021-06-03,New to Zero Trust Security? Start Here,www.gartner.com/smarterwithgartner/new-to-zero-trust-security-start-here
2021-07-20,The CSCO’s Guide to Supply Chain Technology Innovations,www.gartner.com/smarterwithgartner/the-cscos-guide-to-supply-chain-technology-innovations
2021-07-19,Execute Your Cloud Strategy With a Cloud Center of Excellence,www.gartner.com/smarterwithgartner/execute-your-cloud-strategy-with-a-cloud-center-of-excellence
2021-07-02,Leadership Diversity Stalled? Here Are 3 Actions to Take,www.gartner.com/smarterwithgartner/leadership-diversity-stalled-here-are-3-actions-to-take
2021-05-24,Gartner Top 9 Security and Risk Trends for 2020,www.gartner.com/smarterwithgartner/gartner-top-9-security-and-risk-trends-for-2020
2021-05-21,Making Hybrid Work More Permanent? Set Some Ground Rules,www.gartner.com/smarterwithgartner/making-hybrid-work-more-permanent-set-some-ground-rules
2021-07-09,Building Strategic Assumptions? Don't Ignore These 7 Drivers of Change,www.gartner.com/smarterwithgartner/building-strategic-assumptions-dont-ignore-these-7-drivers-of-change
2021-07-07,A Key Pandemic Lesson Learned: Invest in Your Talent,www.gartner.com/smarterwithgartner/a-key-pandemic-lesson-learned-invest-in-your-talent
2021-06-10,The ESG Imperative: 7 Factors for Finance Leaders to Consider,www.gartner.com/smarterwithgartner/the-esg-imperative-7-factors-for-finance-leaders-to-consider
2021-06-09,Digital Workers Say Flexibility Is Key to Their Productivity,www.gartner.com/smarterwithgartner/digital-workers-say-flexibility-is-key-to-their-productivity
2021-06-03,Returning Employees to an Office? Consider the Talent Risks,www.gartner.com/smarterwithgartner/returning-employees-to-an-office-consider-the-talent-risks
2021-06-02,Would You Let Artificial Intelligence Make Your Pay Decisions?,www.gartner.com/smarterwithgartner/would-you-let-artificial-intelligence-make-your-pay-decisions
2021-06-17,How to Use Citizen Data Scientists to Maximize Your D&A Strategy,www.gartner.com/smarterwithgartner/how-to-use-citizen-data-scientists-to-maximize-your-da-strategy
2021-06-17,Act Now to Assess the Impact of the Global Minimum Tax,www.gartner.com/smarterwithgartner/act-now-to-assess-the-impact-of-the-global-minimum-tax
2021-06-16,5 Must-Read Ransomware and Cybersecurity Articles,www.gartner.com/smarterwithgartner/5-must-read-ransomware-and-cybersecurity-articles
2021-07-01,Marketers Are Under a Digital Ad Siege and Must Now Convince Customers to Share Data,www.gartner.com/en/marketing/insights/articles/marketers-are-under-a-digital-ad-siege-and-must-now-convince-customers-to-share-data
2021-06-30,How Can Governments Scale Up Cloud Adoption?,www.gartner.com/smarterwithgartner/how-can-governments-scale-up-cloud-adoption
2021-05-20,Data Sharing Is a Business Necessity to Accelerate Digital Business,www.gartner.com/smarterwithgartner/data-sharing-is-a-business-necessity-to-accelerate-digital-business
2021-05-20,The Gartner Supply Chain Top 25 for 2021,www.gartner.com/smarterwithgartner/the-gartner-supply-chain-top-25-for-2021
2021-04-07,Don’t Overlook Critical Talent Intelligence in Your Postpandemic Location Strategy,www.gartner.com/smarterwithgartner/dont-overlook-critical-talent-intelligence-in-your-postpandemic-location-strategy
2021-04-06,DONT PUBLISH: TEST B,www.gartner.com/en/articles/9-ways-to-make-your-mark-in-a-new-chro-role
2021-04-14,Where to Locate Your Shared Services Center,www.gartner.com/smarterwithgartner/where-to-locate-your-shared-services-center
2021-04-14,"6 Trends on the Gartner Hype Cycle for the Digital Workplace, 2020",www.gartner.com/en/articles/6-trends-on-the-gartner-hype-cycle-for-the-digital-workplace-2020
2021-04-14,6 Key Forces Shaping Technology and Service Providers Through 2025,www.gartner.com/en/articles/6-key-forces-shaping-technology-and-service-providers-through-2025
2021-06-08,4 HR Talent Strategies for the Postpandemic Labor Market,www.gartner.com/smarterwithgartner/4-hr-talent-strategies-for-the-postpandemic-labor-market
2021-06-07,Healthcare Data Storage and Other Innovations Head to the Cloud,www.gartner.com/smarterwithgartner/healthcare-data-storage-and-other-innovations-head-to-the-cloud
2021-06-04,Make the Future of Work a Win-Win for People and Organizations,www.gartner.com/smarterwithgartner/make-the-future-of-work-a-win-win-for-people-and-organizations
2021-03-30,The IAM Leader’s Guide to Biometric Authentication,www.gartner.com/smarterwithgartner/the-iam-leaders-guide-to-biometric-authentication
2021-03-25,4 Steps to Ensure Robotic Process Automation Security,www.gartner.com/smarterwithgartner/4-steps-to-ensure-robotic-process-automation-security
2021-03-25,10 IT Cost Optimization Techniques for Private and Public Sector Organizations,www.gartner.com/smarterwithgartner/10-it-cost-optimization-techniques-for-private-and-public-sector-organizations
2021-06-01,Lead Through Volatility With Adaptive Strategy,www.gartner.com/smarterwithgartner/lead-through-volatility-with-adaptive-strategy
2021-05-28,Enterprise Architecture’s Role in Building a Data-Driven Organization,www.gartner.com/smarterwithgartner/enterprise-architectures-role-in-building-a-data-driven-organization
2021-05-27,Strategic Digital Marketing Breaks Out of the Specialist Silo,www.gartner.com/en/marketing/insights/articles/strategic-digital-marketing-breaks-out-specialist-silo
2021-04-15,A Blueprint for a Successful First 100 Days as a CSO,www.gartner.com/smarterwithgartner/a-blueprint-for-a-successful-first-100-days-as-a-cso
2021-04-14,4 Ways for CIOs to Implement Hybrid Working in 2021,www.gartner.com/en/articles/4-ways-for-cios-to-implement-hybrid-working-in-2021
2021-04-26,The 5 Pillars of Strategy Execution,www.gartner.com/smarterwithgartner/the-five-pillars-of-strategy-execution
2021-04-26,Watch Out for 3 Challenges Driving Remote Work Fatigue,www.gartner.com/smarterwithgartner/hr-should-watch-out-for-3-challenges-driving-remote-work-fatigue
2021-05-07,6 Step Action Plan for Effective Portfolio Management,www.gartner.com/smarterwithgartner/6-step-action-plan-for-effective-portfolio-management
2021-06-15,You Can Find Digital Skills in Non-IT Functions,www.gartner.com/smarterwithgartner/you-can-find-digital-skills-in-non-it-functions
2021-05-18,Do You Need a Chief Data Officer?,www.gartner.com/smarterwithgartner/do-you-need-a-chief-data-officer
2021-06-29,Use a Digital Talent Management Framework to Future-Proof the IT Workforce,www.gartner.com/smarterwithgartner/use-a-digital-talent-management-framework-to-future-proof-the-it-workforce
2021-06-25,Use Customer Service Experience Metrics That Are Better Than NPS,www.gartner.com/smarterwithgartner/use-customer-service-experience-metrics-that-are-better-than-nps
2021-05-19,"CEOs See Growth in 2021, Marked by 3 Shifts",www.gartner.com/smarterwithgartner/ceos-see-growth-in-2021-marked-by-3-shifts
2021-05-18,3 Pillars of a Successful Account-Based Strategy,www.gartner.com/smarterwithgartner/3-pillars-of-a-successful-account-based-strategy
2021-04-06,The Cloud Strategy Cookbook,www.gartner.com/smarterwithgartner/the-cloud-strategy-cookbook
2021-01-08,Key Strategies for Cost Optimization in Application Design and Development,www.gartner.com/smarterwithgartner/key-strategies-for-cost-optimization-in-application-design-and-development
2021-01-08,Future-Proof Your Application Strategy,www.gartner.com/smarterwithgartner/smarterwithgartner
2021-01-08,IT-Business Collaboration Fuels the Future of Applications,www.gartner.com/smarterwithgartner/it-business-collaboration-fuels-the-future-of-applications
2021-04-14,Dear CEOs: Here Are the Do’s and Don’ts for Announcing Return-to-Work Plans,www.gartner.com/en/articles/dos-and-donts-for-announcing-return-to-work-plans
2021-04-14,How to Organize Your Finance Function,www.gartner.com/en/articles/how-to-organize-your-finance-function
2021-04-13,Develop a Security Strategy for Cyber-Physical Systems,www.gartner.com/smarterwithgartner/develop-a-security-strategy-for-cyber-physical-systems
2021-03-23,6 Best Practices for Remote Work by Agile Software Development Teams,www.gartner.com/smarterwithgartner/6-best-practices-for-remote-work-by-agile-software-development-teams
2021-03-18,Focus on Effectiveness to Drive Competitive Value,www.gartner.com/smarterwithgartner/focus-on-effectiveness-to-drive-competitive-value
2021-05-27,The Customer Experience Marketing Leader’s First 100 Days,www.gartner.com/en/marketing/insights/articles/the-customer-experience-marketing-leaders-first-100-days
2021-05-26,How Leading Finance Teams Are Training Their Way to Digital Expertise,www.gartner.com/smarterwithgartner/how-leading-finance-teams-are-training-their-way-to-digital-expertise
2021-04-14,Priorities in HR Function Budgets Are Likely to Keep Shifting in 2021,www.gartner.com/en/articles/priorities-in-hr-function-budgets-are-likely-to-keep-shifting-in-2021
2021-04-14,You Can Create Employee Connections Without More Meetings,www.gartner.com/en/articles/you-can-create-employee-connections-without-more-meetings
2021-04-14,Do You Need a Virtual CISO?,www.gartner.com/en/articles/do-you-need-a-virtual-ciso
2021-04-26,9 Work Trends That HR Leaders Can’t Ignore in 2021,www.gartner.com/smarterwithgartner/9-work-trends-that-hr-leaders-cant-ignore-in-2021
2021-04-22,Legal and Compliance Function Needs Data Scientists,www.gartner.com/smarterwithgartner/legal-and-compliance-function-needs-data-scientists
2021-05-06,Tune Your Finance Dashboard Using Metrics to Drive Performance,www.gartner.com/smarterwithgartner/tune-your-finance-dashboard-using-metrics-to-drive-performance
2021-05-03,Your Data Center is Old. Now What?,www.gartner.com/smarterwithgartner/your-data-center-is-old-now-what
2021-06-14,Upskill Software Developers With a Six-Step Talent Development Program,www.gartner.com/smarterwithgartner/upskill-software-developers-with-a-six-step-talent-development-program
2021-05-18,Focus on Enablement and Critical Skills to Lead Sales Through Disruption,www.gartner.com/smarterwithgartner/focus-on-enablement-and-critical-skills-to-lead-sales-through-disruption
2021-05-17,Evolve Sales Enablement to Support Revenue Operations,www.gartner.com/smarterwithgartner/evolve-sales-enablement-to-support-revenue-operations
2021-05-17,Gartner Keynote: B2B Sales Must Focus on Seller-Assisted Digital Experiences,www.gartner.com/smarterwithgartner/b2b-sales-must-focus-on-seller-assisted-digital-experiences
2021-04-05,Gartner Top Security and Risk Trends for 2021,www.gartner.com/smarterwithgartner/gartner-top-security-and-risk-trends-for-2021
2021-04-02,5 Shared Services Pricing Approaches,www.gartner.com/smarterwithgartner/5-shared-services-pricing-approaches
2021-04-02,3 Digital Priorities for Software Engineering Leaders,www.gartner.com/smarterwithgartner/3-digital-priorities-for-software-engineering-leaders
2021-01-08,It’s Time to Disrupt the Application Organization,www.gartner.com/smarterwithgartner/its-time-to-disrupt-the-application-organization
2021-01-07,"No, Hybrid Workforce Models Won’t Dilute Your Culture",www.gartner.com/smarterwithgartner/no-hybrid-workforce-models-wont-dilute-your-culture
2021-01-05,4 Ways to Compete Against Nontraditional Supply Chains,www.gartner.com/smarterwithgartner/4-ways-to-compete-against-nontraditional-supply-chains
2021-01-04,9 Tips for Managing Remote Employees,www.gartner.com/smarterwithgartner/9-tips-for-managing-remote-employees
2021-04-12,5 Ways to Mature Sales and Operations Planning (S&OP) in Supply Chain,www.gartner.com/smarterwithgartner/5-ways-to-mature-sales-and-operations-planning-sop-in-supply-chain
2021-04-08,3 Advantages of Shared Services Over Centralized Services,www.gartner.com/smarterwithgartner/3-advantages-of-shared-services-over-centralized-services
2021-03-16,How Marketing Can Better Sense and Respond to Customer Needs,www.gartner.com/en/marketing/insights/articles/how-marketing-can-better-sense-respond-to-customer-needs
2021-03-16,The Ratio Between Sales Development and Sales: The Secret to High Growth,www.gartner.com/en/articles/the-ratio-between-sales-development-and-sales-the-secret-to-high-growth
2021-03-16,Key Priorities for IAM Leaders in 2021,www.gartner.com/smarterwithgartner/key-priorities-for-iam-leaders-in-2021
2021-04-14,How CFOs Build a More Digital Finance Function,www.gartner.com/en/articles/how-cfos-build-a-more-digital-finance-function
2021-04-14,How to Sustain the Accelerated Pace of Digital Business Transformation,www.gartner.com/en/articles/how-to-sustain-the-accelerated-pace-of-digital-business-transformation
2021-04-14,Gartner Predicts the Future of Supply Chain Technology,www.gartner.com/en/articles/gartner-predicts-the-future-of-supply-chain-technology
2021-04-21,Are Tech Product Marketers Creating Effective Thought Leadership Marketing Programs?,www.gartner.com/smarterwithgartner/are-tech-product-marketers-creating-effective-thought-leadership-marketing-programs
2021-04-20,"3 Learnings for More Supply Chain Diversity, Equity & Inclusion",www.gartner.com/smarterwithgartner/3-learnings-for-more-supply-chain-diversity-equity-inclusion
2021-04-16,Use Zero-Based Prioritization to Reevaluate Your Project Portfolio,www.gartner.com/smarterwithgartner/use-zero-based-prioritization-to-reevaluate-your-project-portfolio
2021-04-30,Optimize Supply Chain Cash Flow and Costs Using 3 Performance Lenses,www.gartner.com/smarterwithgartner/optimize-supply-chain-cash-flow-and-costs-using-three-performance-lenses
2021-04-29,9 Future of Work Trends Post-COVID-19,www.gartner.com/smarterwithgartner/9-future-of-work-trends-post-covid-19
2021-04-28,Improving Diversity in Finance Through Effective Hiring and Advancement,www.gartner.com/smarterwithgartner/improving-diversity-in-finance-through-effective-hiring-and-advancement
2021-01-25,10 Must-Read Business Books for 2020,www.gartner.com/smarterwithgartner/10-must-read-business-books-for-2020
2021-01-25,10 CIO Resolutions for 2021,www.gartner.com/smarterwithgartner/10-cio-resolutions-for-2021
2021-01-22,4 Impactful Technologies From the Gartner Emerging Technologies and Trends Impact Radar for 2021,www.gartner.com/smarterwithgartner/4-impactful-technologies-from-the-gartner-emerging-technologies-and-trends-impact-radar-for-2021
2021-02-03,"How 2020 Accelerated Conversations on Diversity, Equity and Inclusion",www.gartner.com/smarterwithgartner/how-2020-accelerated-conversations-on-diversity-equity-and-inclusion
2021-02-03,Build 3 Operations Management Skills for AI Success,www.gartner.com/smarterwithgartner/build-3-operations-management-skills-for-ai-success
