Date,Title,Link
2019-03-20,Innovate With Edge AI,www.gartner.com/smarterwithgartner/innovate-with-edge-ai
2019-06-04,How to Architect Your Software Career,www.gartner.com/smarterwithgartner/architect-software-career
2019-06-04,Gartner Keynote: 5 Significant Imperatives for Digital Success,www.gartner.com/smarterwithgartner/gartner-keynote-5-significant-imperatives-for-digital-success
2019-03-29,Rebalance B2B Content Marketing for Buyer Enablement,www.gartner.com/en/marketing/insights/articles/rebalance-b2b-content-marketing-for-buyer-enablement
2019-04-05,The Marketer’s Checklist to Get Buyer Enablement Content Right,www.gartner.com/en/marketing/insights/articles/the-marketers-checklist-to-get-buyer-enablement-content-right
2019-05-08,10 Culture Hacks for Digital Transformation,www.gartner.com/smarterwithgartner/10-culture-hacks-for-digital-transformation
2019-05-17,How to Appeal to Generation Z Candidates,www.gartner.com/smarterwithgartner/how-to-appeal-to-generation-z-candidates
2019-05-16,5 Pitfalls to Avoid as the New CIO,www.gartner.com/smarterwithgartner/5-pitfalls-to-avoid-as-the-new-cio
2019-05-23,Leverage Artificial Intelligence in HR Processes Where it Matters Most,www.gartner.com/smarterwithgartner/leverage-artificial-intelligence-in-hr-processes-where-it-matters-most
2019-05-23,4 New Roles That I&O Plays in IoT,www.gartner.com/smarterwithgartner/4-new-roles-that-io-plays-in-iot
2019-03-19,3 Actions for the New CIO,www.gartner.com/smarterwithgartner/3-actions-for-the-new-cio
2019-06-03,Master the Art of Trendspotting in 4 Steps,www.gartner.com/smarterwithgartner/master-the-art-of-trendspotting-in-4-steps
2019-03-28,4 Types of Project Management Offices That Deliver Value,www.gartner.com/smarterwithgartner/4-types-of-project-management-offices-that-deliver-value
2019-04-04,Create a Culture of Integrity to Improve Corporate Compliance,www.gartner.com/smarterwithgartner/create-a-culture-of-integrity-to-improve-corporate-compliance
2019-04-03,How CIOs Can Ensure a Seat at the  Strategy Table,www.gartner.com/smarterwithgartner/how-cios-can-ensure-a-seat-at-the-enterprise-strategy-table
2019-04-12,8 Steps for a High-Impact Enterprise Architecture Program,www.gartner.com/smarterwithgartner/8-steps-for-a-high-impact-enterprise-architecture-program
2019-04-11,The Secret to DevOps Success,www.gartner.com/smarterwithgartner/the-secret-to-devops-success
2019-05-08,CEOs Look for Growth Opportunities in 2019 CEO Survey,www.gartner.com/smarterwithgartner/ceos-look-for-growth-opportunities-in-2019-ceo-survey
2019-05-16,How to Evaluate an Application Integration Platform [Infographic],www.gartner.com/smarterwithgartner/how-to-evaluate-an-application-integration-platform-infographic
2019-05-22,CIO Power Politics: The Key to Correcting in Public,www.gartner.com/smarterwithgartner/the-key-to-correcting-in-public-video
2019-05-31,Use Data to Yield Process and Revenue Improvements,www.gartner.com/smarterwithgartner/use-data-to-yield-process-and-revenue-improvements
2019-03-27,A Supply Chain Analytics Leader's First 100 Days,www.gartner.com/smarterwithgartner/a-supply-chain-analytics-leaders-first-100-days
2019-04-02,Financial Forecasters Should Beware 3 Machine Learning Myths,www.gartner.com/smarterwithgartner/financial-forecasters-should-beware-3-machine-learning-myths
2019-04-10,"Demand for Talent Converges on Critical Roles in the U.S., U.K.",www.gartner.com/smarterwithgartner/demand-for-talent-converges-on-critical-roles-in-the-u-s-u-k
2019-06-14,7 Steps to a Better Service Rep and Customer Experience,www.gartner.com/smarterwithgartner/7-steps-to-a-better-service-rep-and-customer-experience
2019-06-13,Strengthen the Supply Chain Talent Pool With Internships,www.gartner.com/smarterwithgartner/strengthen-the-supply-chain-talent-pool-with-internships
2019-06-12,Gartner Quarterly Update on Global Workforce Trends,www.gartner.com/smarterwithgartner/gartner-quarterly-update-on-global-workforce-trends
2019-06-11,How Leading CFOs Use Cost Management as a Catalyst For Growth,www.gartner.com/smarterwithgartner/how-leading-cfos-use-cost-management-as-a-catalyst-for-growth
2019-06-24,Top 4 Actions For A New CFO,www.gartner.com/smarterwithgartner/top-4-actions-for-a-new-cfo
2019-06-20,10 Ways to Optimize HR Costs,www.gartner.com/smarterwithgartner/10-ways-to-optimize-hr-costs
2019-06-20,3 Must-Haves in the CEO-CHRO Culture Conversation,www.gartner.com/smarterwithgartner/3-must-haves-in-the-ceo-chro-culture-conversation
2019-06-28,Creating Connections for Development,www.gartner.com/en/human-resources/trends/creating-connections-for-development
2019-06-28,Personalizing Employee Development,www.gartner.com/en/human-resources/trends/personalizing-employee-development
2019-06-11,How to Get Started With Information Asset Management,www.gartner.com/smarterwithgartner/how-to-get-started-with-information-asset-management
2019-06-10,Gartner Keynote: 3 Mental Shifts for CFOs to Accelerate Growth,www.gartner.com/smarterwithgartner/gartner-keynote-3-mental-shifts-for-cfos-to-accelerate-growth
2019-07-09,Building a Recruiting Technology Roadmap,www.gartner.com/en/human-resources/trends/building-a-recruiting-technology-roadmap
2019-07-09,What Government CIOs Should Know About Digital IDs,www.gartner.com/smarterwithgartner/what-government-cios-should-know-about-digital-ids
2019-06-19,3 Key Take-Aways from Gartner CFO & Finance Executive Conference 2019,www.gartner.com/smarterwithgartner/3-key-take-aways-from-gartner-cfo-finance-executive-conference-2019
2019-06-19,Gartner Top 7 Security and Risk Trends for 2019,www.gartner.com/smarterwithgartner/gartner-top-7-security-and-risk-trends-for-2019
2019-06-28,What Employment Indicators Can Signal About the Economy,www.gartner.com/smarterwithgartner/what-employment-indicators-can-signal-about-the-economy
2019-07-19,Define Your Risk Appetite to Create a Resilient Supply Chain,www.gartner.com/smarterwithgartner/define-your-risk-appetite-to-create-a-resilient-supply-chain
2019-07-17,Know Your Digital Leadership Style and When to Adapt It,www.gartner.com/smarterwithgartner/know-your-digital-leadership-style-and-when-to-adapt-it
2019-06-10,How to Create an Effective Customer Journey Map,www.gartner.com/en/marketing/insights/articles/how-to-create-an-effective-customer-Journey-map
2019-06-07,"What's in, What's Out For HR Business Partners in 2025?",www.gartner.com/smarterwithgartner/whats-in-whats-out-for-hr-business-partners-in-2025
2019-07-29,Gartner Experts Share How Sales Can Address Complexity,www.gartner.com/smarterwithgartner/gartner-experts-share-how-sales-can-address-complexity
2019-07-29,Keep Business Strategy Current as Conditions Change,www.gartner.com/smarterwithgartner/keep-business-strategy-current-as-conditions-change
2019-07-27,Use Multichannel Marketing To Generate More Demand,www.gartner.com/smarterwithgartner/use-multichannel-marketing-to-generate-more-demand
2019-08-02,A Roadmap for Technology Adoption in Legal,www.gartner.com/smarterwithgartner/a-roadmap-for-technology-adoption-in-legal
2019-08-01,11 Tactics to Drive Your Account-Based Marketing Process,www.gartner.com/en/articles/11-tactics-to-drive-your-account-based-marketing-process
2019-07-08,Building an Influential Employment Brand,www.gartner.com/en/human-resources/trends/recruiting-innovators
2019-08-08,What Drives Inside Sales Retention,www.gartner.com/smarterwithgartner/drives-inside-sales-retention
2019-06-18,Develop a CIO/CHRO Partnership to Drive Talent Management,www.gartner.com/smarterwithgartner/develop-a-ciochro-partnership-to-drive-talent-management
2019-06-18,Gartner Top 10 Security Projects for 2019,www.gartner.com/smarterwithgartner/gartner-top-10-security-projects-for-2019
2019-08-15,A Better Way to Manage Third-Party Risk,www.gartner.com/smarterwithgartner/a-better-way-to-manage-third-party-risk
2019-08-15,The Real Impact on Employees of Removing Performance Ratings,www.gartner.com/smarterwithgartner/corporate-hr-removing-performance-ratings-is-unlikely-to-improve-performance
2019-06-27,Manage Sales Costs Despite Uncertainty,www.gartner.com/smarterwithgartner/manage-sales-costs-despite-uncertainty
2019-06-26,The Call for Legal and Compliance to Minimize Data Privacy Risk,www.gartner.com/smarterwithgartner/call-legal-compliance-minimize-data-privacy-risk
2019-07-16,Set Sales Strategic Planning Success,www.gartner.com/smarterwithgartner/set-sales-strategic-planning-success
2019-07-26,Use Technology to Personalize HR Services,www.gartner.com/smarterwithgartner/use-technology-personalize-hr-services
2019-08-01,The Impact of High-Quality Information on B2B Sales,www.gartner.com/smarterwithgartner/the-reality-informations-impact-b2b-sales
2019-07-31,The Account-Based Everything Framework,www.gartner.com/en/articles/the-account-based-everything-framework
2019-07-08,Keep Your Job After a Cyberattack,www.gartner.com/smarterwithgartner/keep-your-job-after-a-cyberattack
2019-07-05,How to Avoid Overloading Your IT Project Team,www.gartner.com/smarterwithgartner/avoid-overloading-project-team
2019-08-08,How Connector Managers Create Star Performers,www.gartner.com/smarterwithgartner/how-connector-managers-create-star-performers
2019-08-07,8 Reasons Sales Development Teams Fail,www.gartner.com/en/articles/8-reasons-sales-development-teams-fail
2019-06-17,Gartner Keynote: Leverage Automation for Modern Security,www.gartner.com/smarterwithgartner/gartner-keynote-leverage-automation-for-modern-security
2019-08-14,The SaaS Buying Experience: Mapping How Businesses Buy Software,www.gartner.com/en/articles/the-saas-buying-experience-mapping-how-businesses-buy-software
2019-06-26,How Governments Can Unlock Blockchain’s Potential,www.gartner.com/smarterwithgartner/how-governments-can-unlock-blockchains-potential
2019-07-15,Top 3 Benefits of AI Projects,www.gartner.com/smarterwithgartner/top-3-benefits-of-ai-projects
2019-07-25,Think Employees Thrive With Constant Coaching? Think Again,www.gartner.com/smarterwithgartner/think-employees-thrive-with-constant-coaching-think-again
2019-07-31,The Service Leader's Guide to Virtual Customers,www.gartner.com/smarterwithgartner/the-service-leaders-guide-to-virtual-customers
2019-07-02,5 Questions to Get AI-Edge Products Right,www.gartner.com/smarterwithgartner/5-questions-to-get-ai-edge-products-right
2019-08-14,3 Hallmarks of Standout CFOs,www.gartner.com/smarterwithgartner/3-hallmarks-of-standout-cfos
2019-08-13,3 Ways to Keep Cost Optimization on Track During HR Transformation,www.gartner.com/smarterwithgartner/3-ways-keep-cost-optimization-track-hr-transformation
2019-08-29,"6 Technologies on the Gartner Hype Cycle for Digital marketing and Advertising, 2019",www.gartner.com/en/marketing/insights/articles/6-technologies-on-gartner-hype-cycle-for-digital-marketing-and-advertising-2019
2019-08-28,"The Who, What, How and Why of Sales Enablement",www.gartner.com/en/articles/the-who-what-how-and-why-of-sales-enablement
2019-06-25,5 Steps to Master Continuous Delivery,www.gartner.com/smarterwithgartner/5-steps-to-master-continuous-delivery
2019-09-04,How CFOs Translate Growth Into Sustained Profitability,www.gartner.com/smarterwithgartner/how-cfos-translate-growth-into-sustained-profitability
2019-09-03,Emerging Technologies in Gartner Sales Technologies Bullseye,www.gartner.com/smarterwithgartner/emerging-technologies-in-gartner-sales-technologies-bullseye
2019-09-10,9 Ways for CHROs to Attract Top Tech Talent,www.gartner.com/smarterwithgartner/9-ways-for-chros-to-attract-top-tech-talent
2019-09-10,Analyst Answers: How IT Leaders Should Invest In Data And Analytics,www.gartner.com/smarterwithgartner/analyst-answers-how-it-leaders-should-invest-in-data-and-analytics
2019-09-09,Time Management for Sales Development Reps,www.gartner.com/en/articles/time-management-for-sales-development-reps
2019-07-12,The Need for AI Governance in Healthcare,www.gartner.com/smarterwithgartner/the-need-for-ai-governance-in-healthcare
2019-07-11,Ride the 4 Waves of Digital Disruption,www.gartner.com/smarterwithgartner/ride-the-4-waves-of-digital-disruption
2019-09-16,Sales Development Metrics: Assessing Low Conversion Rates,www.gartner.com/en/articles/sales-development-metrics-assessing-low-conversion-rates
2019-09-16,How to Revitalize a Stalled Digital Transformation,www.gartner.com/smarterwithgartner/how-to-revitalize-a-stalled-digital-transformation
2019-09-19,The Evolution of Sales Training and Coaching Technology,www.gartner.com/smarterwithgartner/the-evolution-of-sales-training-and-coaching-technology
2019-09-18,Sales Enablement Best Practices: Leveraging Examples from Top-Performing Reps,www.gartner.com/en/articles/sales-enablement-best-practices-leveraging-examples-from-top-per
2019-07-25,What Type of Sales Manager Are You?,www.gartner.com/smarterwithgartner/type-sales-manager
2019-07-31,Chatbots Will Appeal to Modern Workers,www.gartner.com/smarterwithgartner/chatbots-will-appeal-to-modern-workers
2019-08-22,What Type of Manager Are You?,www.gartner.com/smarterwithgartner/what-type-of-manager-are-you
2019-08-21,Build a Website Customers Will Actually Like ,www.gartner.com/en/marketing/insights/articles/build-a-website-customers-will-actually-like
2019-07-01,7 Common Mistakes in Enterprise Blockchain Projects,www.gartner.com/smarterwithgartner/top-10-mistakes-in-enterprise-blockchain-projects
2019-09-23,15 Sales Standards Your Sales Organization Needs,www.gartner.com/en/articles/15-sales-standards-your-sales-organization-needs
2019-09-23,How Effective CFOs Prioritize Their Time,www.gartner.com/smarterwithgartner/how-effective-cfos-spend-their-time
2019-08-06,Do's and Don'ts of Using Employee Data,www.gartner.com/smarterwithgartner/dos-and-donts-of-using-employee-data
2019-08-06,Focus on Moments That Really Matter to Employees,www.gartner.com/smarterwithgartner/focus-on-moments-that-really-matter-to-employees
2019-09-27,5 Shifts for Legal to Better Support M&A,www.gartner.com/smarterwithgartner/5-shifts-for-legal-to-better-support-ma
2019-08-12,18 Skills Every Salesperson Should Master,www.gartner.com/en/articles/18-skills-every-salesperson-should-master
2019-08-28,Why Audit Leaders Need To Implement RPA,www.gartner.com/smarterwithgartner/why-audit-leaders-need-to-adopt-rpa
2019-06-24,How to Manage Marketing Costs,www.gartner.com/en/marketing/insights/articles/how-to-manage-marketing-costs
2019-09-02,13 Sales Plays for Account-Based Everything,www.gartner.com/en/articles/13-sales-plays-for-account-based-everything
2019-09-02,3 Steps to Improve Strategic Vendor Management,www.gartner.com/smarterwithgartner/3-steps-to-improve-strategic-vendor-management
2019-09-09,How Innovation Labs Can Drive Digital Business,www.gartner.com/smarterwithgartner/how-digital-labs-can-drive-digital-business
2019-09-06,11 Sales Development Strategies for High-Growth Companies,www.gartner.com/en/articles/11-sales-development-strategies-for-high-growth-companies
2019-07-10,The Framework for Ideal Customer Profile Development,www.gartner.com/en/articles/the-framework-for-ideal-customer-profile-development
2019-07-10,Don't Compromise on Talent Even in Uncertain Times,www.gartner.com/smarterwithgartner/dont-compromise-talent-even-uncertain-times
2019-09-14,Comms Leaders' Role in Digital Business Transformation,www.gartner.com/smarterwithgartner/comms-leaders-role-digital-business-transformation
2019-09-13,4 Best Practices for Sales Demonstration Success,www.gartner.com/en/articles/4-best-practices-for-sales-demonstration-success
2019-09-13,3 Techniques to Maximize Advertising ROI,www.gartner.com/en/marketing/insights/articles/3-techniques-to-maximize-advertising-roi
2019-09-18,3 Barriers to AI Adoption,www.gartner.com/smarterwithgartner/3-barriers-to-ai-adoption
2019-09-18,Gartner Top CSO Priorities for 2020,www.gartner.com/smarterwithgartner/gartner-top-cso-priorities-2020
2019-07-24,Key Questions to Evaluate and Plan for Enterprise 5G,www.gartner.com/smarterwithgartner/key-questions-to-evaluate-and-plan-for-enterprise-5g
2019-07-22,Make IT Cost Optimization a Key Component of Successful M&A,www.gartner.com/smarterwithgartner/make-it-cost-optimization-a-key-component-of-successful-ma
2019-07-30,5 Places You Didn't Think to Look for Digital Talent,www.gartner.com/smarterwithgartner/5-places-you-didnt-think-to-look-for-digital-talent
2019-08-21,The Buying Experience: The Most Important Thing in Sales and Marketing,www.gartner.com/en/articles/the-buying-experience-the-most-important-thing-in-sales-and-mark
2019-08-21,"3 Major Trends Drive the Gartner Hype Cycle for Midsize Enterprises, 2019",www.gartner.com/smarterwithgartner/3-major-trends-drive-gartner-hype-cycle-midsize-enterprises-2019
2019-06-28,Fostering Team Development,www.gartner.com/en/human-resources/trends/fostering-team-development
2019-09-23,The CIO’s Guide to Blockchain,www.gartner.com/smarterwithgartner/the-cios-guide-to-blockchain
2019-09-20,Using High-Value Offers to Drive Virtual Selling Success,www.gartner.com/en/articles/using-high-value-offers-to-drive-virtual-selling-success
2019-08-05,How to Inject Extreme Value Messaging Into Buyer Personas,www.gartner.com/en/articles/how-to-inject-extreme-value-messaging-into-buyer-personas
2019-08-05,The Data Center Is (Almost) Dead,www.gartner.com/smarterwithgartner/the-data-center-is-almost-dead
2019-09-26,Build A Resilient Supply Chain Amid U.S.-China Trade War,www.gartner.com/smarterwithgartner/build-a-resilient-supply-chain-amid-u-s-china-trade-war
2019-09-26,Far Fewer U.S. Employees Are Job Hunting,www.gartner.com/smarterwithgartner/far-fewer-u-s-employees-are-job-hunting
2019-08-12,CIOs Can't Ignore These 5 Realities of Blockchain,www.gartner.com/smarterwithgartner/cios-cant-ignore-these-5-realities-of-blockchain
2019-08-09,RevOps: The Modern Operating Model for Fast-Forward Organizations,www.gartner.com/en/articles/revops-the-modern-operating-model-for-fast-forward-organizations
2019-08-28,Why Marketers Should Audit Their Technology Portfolio,www.gartner.com/en/marketing/insights/articles/why-marketers-should-audit-their-technology-portfolio
2019-08-27,5 Ways Blockchain Will Affect HR,www.gartner.com/smarterwithgartner/5-ways-blockchain-will-affect-hr
2019-08-26,3 Ways to Stop Insider Threats,www.gartner.com/smarterwithgartner/3-ways-to-stop-insider-threats
2019-08-30,Sales Development Technology: The Stack Emerges,www.gartner.com/en/articles/sales-development-technology-the-stack-emerges
2019-08-30,How to Set Up S&OE in Supply Chain Planning,www.gartner.com/smarterwithgartner/how-to-set-up-soe-in-supply-chain-planning
2019-10-02,4 Key Findings in the Annual Gartner CMO Spend Survey 2019-2020,www.gartner.com/en/marketing/insights/articles/4-key-findings-in-the-annual-gartner-cmo-spend-survey-2019-2020
2019-10-01,Coronavirus: Immediate Recommendations for Pipeline Generation,www.gartner.com/en/articles/coronavirus-immediate-recommendations-for-pipeline-generation
2019-10-01,The 7 Dimensions of Digital Supply Chain Planning,www.gartner.com/smarterwithgartner/the-7-dimensions-of-digital-supply-chain-planning
2019-09-06,What Assurance Leaders Need to Know About Blockchain,www.gartner.com/smarterwithgartner/what-assurance-leaders-need-to-know-about-blockchain
2019-09-05,Do You Have the Connector Manager Gene?,www.gartner.com/smarterwithgartner/do-you-have-the-connector-manager-gene
2019-09-12,"Top Trends on the Gartner Hype Cycle for Artificial Intelligence, 2019",www.gartner.com/smarterwithgartner/top-trends-on-the-gartner-hype-cycle-for-artificial-intelligence-2019
2019-09-11,Best Practices in ICP Development: Qualitative Analysis,www.gartner.com/en/articles/best-practices-in-icp-development-qualitative-analysis
2019-10-11,Accelerate the Time to Market for Your Products,www.gartner.com/smarterwithgartner/accelerate-the-time-to-market-for-your-products
2019-10-10,Is the Cloud Secure?,www.gartner.com/smarterwithgartner/is-the-cloud-secure
2019-10-09,A CMO's Guide to Winning in the Turns ,www.gartner.com/en/marketing/insights/articles/a-cmos-guide-to-winning-in-the-turns
2019-10-17,"Top Trends From Gartner Hype Cycle for Digital Government Technology, 2019",www.gartner.com/smarterwithgartner/top-trends-from-gartner-hype-cycle-for-digital-government-technology-2019
2019-10-16,2 Ways for Procurement to Uncover What's Driving Costs Up,www.gartner.com/smarterwithgartner/2-ways-for-procurement-to-uncover-whats-driving-costs-up
2019-09-18,"Quality, Not Quantity, Is Key to Employee Development",www.gartner.com/smarterwithgartner/quality-not-quantity-key-to-employee-development
2019-09-18,The Secret to B2B Account Growth,www.gartner.com/en/marketing/insights/articles/the-secret-to-b2b-account-growth
2019-10-28,5 Imperatives for HR Leaders to Tackle the Future of Work,www.gartner.com/smarterwithgartner/5-imperatives-for-hr-leaders-to-tackle-the-future-of-work
2019-10-28,Build an In-House Digital Design Team for Business Innovation,www.gartner.com/smarterwithgartner/build-house-digital-design-team-business-innovation
2019-07-30,6 Steps for Planning a Cloud Strategy,www.gartner.com/smarterwithgartner/6-steps-for-planning-a-cloud-strategy
2019-08-20,6 Ways the Workplace Will Change in the Next 10 Years,www.gartner.com/smarterwithgartner/6-ways-the-workplace-will-change-in-the-next-10-years
2019-08-19,Cloud Adoption: Where Does Your Country Rank?,www.gartner.com/smarterwithgartner/cloud-adoption-where-does-your-country-rank
2019-09-20,Analysts Answer: What Technology Should CIOs Experiment With in 2020?,www.gartner.com/smarterwithgartner/analysts-answer-what-technology-should-cios-experiment-with-in-2020
2019-09-20,Diversity and Inclusion Build High-Performance Teams,www.gartner.com/smarterwithgartner/diversity-and-inclusion-build-high-performance-teams
2019-08-02,Drive Customer Conversion With Personalized Video,www.gartner.com/en/marketing/insights/articles/drive-customer-conversion-with-personalized-video
2019-09-25,6 Tips to Turn Insights Into Extreme Value Messaging,www.gartner.com/en/articles/6-tips-to-turn-insights-into-extreme-value-messaging
2019-09-25,Rethink Your Customer Service Strategy to Drive Self-Service,www.gartner.com/smarterwithgartner/rethink-customer-service-strategy-drive-self-service
2019-08-24,Challenger Sale: It’s Time to Start Making Sense of All That Information,www.gartner.com/smarterwithgartner/challenger-sale-its-time-to-start-making-sense-of-all-that-information
2019-08-23,The Sales Pitch: 17 Ideas for Creating the Ultimate Sales Presentation,www.gartner.com/en/articles/the-sales-pitch-17-ideas-for-creating-the-ultimate-sales-present
2019-08-29,"5 Trends Appear on the Gartner Hype Cycle for Emerging Technologies, 2019",www.gartner.com/smarterwithgartner/5-trends-appear-on-the-gartner-hype-cycle-for-emerging-technologies-2019
2019-08-29,10 Must-Have Competencies for Infrastructure & Operations Leaders,www.gartner.com/smarterwithgartner/10-must-have-competencies-for-infrastructure-operations-leaders
2019-09-30,Use a Structured Process for More Effective Sales Discovery,www.gartner.com/en/articles/use-a-structured-process-for-more-effective-sales-discovery
2019-09-04,The Process and Plays Required to Scale Content Marketing,www.gartner.com/en/articles/the-process-and-plays-required-to-scale-content-marketing
2019-09-11,Mastering Leadership Politics,www.gartner.com/smarterwithgartner/are-you-predator-or-prey
2019-10-09,CDOs Must Take the Lead to Improve Data Literacy,www.gartner.com/smarterwithgartner/cdos-must-take-the-lead-to-improve-data-literacy
2019-10-07,Technology Trends for the Future of Government,www.gartner.com/smarterwithgartner/technology-trends-future-government
2019-10-16,Highlights From Gartner Hype Cycle for Customer Service and Support Technologies 2019,www.gartner.com/smarterwithgartner/highlights-from-gartner-hype-cycle-for-customer-service-and-support-technologies-2019
2019-10-16,4 Ways Blockchain Will Transform Higher Education,www.gartner.com/smarterwithgartner/4-ways-blockchain-will-transform-higher-education
2019-10-22,The Reality Of Blockchain,www.gartner.com/smarterwithgartner/the-reality-of-blockchain
2019-10-22,Gartner Top Strategic Predictions For 2020 And Beyond,www.gartner.com/smarterwithgartner/gartner-top-strategic-predictions-for-2020-and-beyond
2019-09-17,2 Ways Sales Operations Improve Sales Managers Effectiveness,www.gartner.com/smarterwithgartner/2-ways-sales-operations-improve-sales-managers-effectiveness
2019-11-04,4 Factors That Will Impact The Future Supply Chain,www.gartner.com/smarterwithgartner/4-factors-that-will-impact-the-future-supply-chain
2019-10-27,How CIOs Can Partner With Startups,www.gartner.com/smarterwithgartner/cios-can-partner-startups
2019-10-25,"4 Key Trends in the Gartner Hype Cycle for Human Capital Management Technology, 2019",www.gartner.com/smarterwithgartner/4-key-trends-gartner-hype-cycle-human-capital-management-technology-2019
2019-08-17,The Power of the Challenger Sales Model,www.gartner.com/smarterwithgartner/power-challenger-sales-model
2019-09-19,Battling for Talent? Show That Your Jobs Offer More Than Pay,www.gartner.com/smarterwithgartner/battling-talent-show-jobs-offer-pay
2019-09-25,Determine Which Tech Trends Matter,www.gartner.com/smarterwithgartner/determine-which-tech-trends-matter
2019-09-30,How to Measure Digital Transformation Progress,www.gartner.com/smarterwithgartner/how-to-measure-digital-transformation-progress
2019-09-30,How to Reassure Employees About Brexit,www.gartner.com/smarterwithgartner/reassure-employees-brexit
2019-10-04,How Infrastructure and Operations Can Enable Digital Change,www.gartner.com/smarterwithgartner/infrastructure-operations-can-enable-digital-change
2019-10-03,Top 10 Trends in Digital Commerce,www.gartner.com/smarterwithgartner/top-10-trends-in-digital-commerce
2019-10-22,The Gartner 2020 CIO Agenda: Resilience During Disruption,www.gartner.com/smarterwithgartner/the-gartner-2020-cio-agenda-winning-in-the-turns
