Date,Title,Link
2015-10-16,PayPal CRO's Three Trends for Security and Risk Management,www.gartner.com/smarterwithgartner/paypal-cros-three-trends-for-security-and-risk-management
2015-09-21,Closing the User Experience Gap,www.gartner.com/smarterwithgartner/closing-the-user-experience-gap
2015-09-17,Customer Experience Metrics Evolve Beyond Net Promoter Score,www.gartner.com/en/marketing/insights/articles/customer-experience-metrics-evolve-beyond-net-promoter-score
2015-12-08,The Internet of Things Identity Crisis - A Gartner Q&A with Earl Perkins,www.gartner.com/smarterwithgartner/the-internet-of-things-identity-crisis-a-gartner-qa-with-earl-perkins
2015-12-07,The Journey to the Enterprise-Defined Data Center,www.gartner.com/smarterwithgartner/the-journey-to-the-enterprise-defined-data-center
2015-12-16,The Sky's the Limit for Personal Drones,www.gartner.com/smarterwithgartner/the-skys-the-limit-for-personal-drones
2015-12-15,How to Deliver Enterprise Mobile Apps Faster,www.gartner.com/smarterwithgartner/how-to-deliver-enterprise-mobile-apps-faster
2015-09-10,What Supply Chain Leaders Need to Know About Industrie 4.0,www.gartner.com/smarterwithgartner/what-supply-chain-leaders-need-to-know-about-industrie-4-0
2015-09-10,Digital Humanism's Impact on Customer Experience,www.gartner.com/smarterwithgartner/digital-humanisms-impact-on-customer-experience
2016-01-20,The Algorithm Economy Will Start a Huge Wave of Innovation,www.gartner.com/smarterwithgartner/the-algorithm-economy-will-start-a-huge-wave-of-innovation
2015-08-24,The New Risks of Digital Business,www.gartner.com/smarterwithgartner/the-new-risks-of-digital-business
2015-08-20,How will CIOs Lead the Digital Enterprise? Gartner Gartner IT Symposium/Xpo™ Q&A with Chris Howard,www.gartner.com/smarterwithgartner/how-will-cios-lead-the-digital-enterprise-gartner-symposiumitxpo-qa-with-chris-howard-2
2016-02-04,How to Adopt the Disciplines of Market Challengers,www.gartner.com/smarterwithgartner/disciplines-of-market-challengers
2016-02-03,Build the Right Team for Data-Driven Marketing,www.gartner.com/en/marketing/insights/articles/build-the-right-team-for-data-driven-marketing
2015-12-29,Jump-Start Your Cloud Strategy in Three Steps,www.gartner.com/smarterwithgartner/jump-start-your-cloud-strategy-in-three-steps
2015-12-23,Five Principles for Leading an Agile Culture,www.gartner.com/smarterwithgartner/five-principles-for-leading-an-agile-culture
2015-10-01,Four Steps to a More Personalized Digital Workplace,www.gartner.com/smarterwithgartner/four-steps-to-a-more-personalized-digital-workplace
2015-10-07,Why CIOs and Companies Should Disrupt Themselves,www.gartner.com/smarterwithgartner/why-cios-and-companies-should-disrupt-themselves
2015-10-15,Are Wearables Fit for Clinical Trials?,www.gartner.com/smarterwithgartner/are-wearables-fit-for-clinical-trials
2015-10-14,Psychoanalyzing Your Data Center,www.gartner.com/smarterwithgartner/psychoanalyzing-your-data-center
2015-12-03,Three Ways Content Marketing Can Fuel Digital Commerce,www.gartner.com/en/marketing/insights/articles/three-ways-content-marketing-can-fuel-digital-commerce
2015-12-02,COP21: Can The Internet of Things Improve Organizations’ Sustainability Performance?,www.gartner.com/smarterwithgartner/cop21-can-the-internet-of-things-improve-organizations-sustainability-performance
2015-12-15,Secrets of Building a Data-Driven Marketing Organization,www.gartner.com/en/marketing/insights/articles/secrets-of-building-a-data-driven-marketing-organization
2015-12-13,Predict Equipment Failure With Advanced Analytics,www.gartner.com/smarterwithgartner/predict-equipment-failure-with-advanced-analytics-2
2016-02-18,What's Next For Smartphones?,www.gartner.com/smarterwithgartner/whats-next-for-smartphones
2016-02-18,Three Power Shifts Forcing Re- Evaluation of Logistics Strategies,www.gartner.com/smarterwithgartner/three-power-shifts-forcing-re-evaluation-of-logistics-strategies
2016-01-19,Shift to Customer-Centric Marketing Briefs,www.gartner.com/en/marketing/insights/articles/shift-to-customer-centric-marketing-briefs
2016-02-29,Inside Gartner CIO Leadership Forum,www.gartner.com/smarterwithgartner/inside-gartner-cio-leadership-forum
2016-02-02,Why a No-Cloud Policy Will Become Extinct,www.gartner.com/smarterwithgartner/cloud-computing-predicts
2016-03-02,Government Gets Smart to the Digital Era,www.gartner.com/smarterwithgartner/government-gets-smart-to-the-digital-era
2016-03-02,Enterprise Business Intelligence and Analytics Strategies for the Digital Age,www.gartner.com/smarterwithgartner/enterprise-business-intelligence-and-analytics-strategies-for-the-digital-age
2015-12-22,Holiday Season Best Sellers: Q&A with Annette Zimmermann,www.gartner.com/smarterwithgartner/holiday-season-best-sellers-qa-with-annette-zimmermann
2015-10-01,Mitigate Risk with an Effective Security Policy,www.gartner.com/smarterwithgartner/mitigate-risk-with-an-effective-security-policy
2015-10-06,IBM Bets on the Cognitive Era,www.gartner.com/smarterwithgartner/ibm-bets-on-the-cognitive-era
2015-10-14,5 Key Trends in Gartner’s 2015 Digital Marketing Hype Cycle,www.gartner.com/en/marketing/insights/articles/five-key-trends-in-gartners-2015-digital-marketing-hype-cycle
2015-12-01,5 Solutions to Performance Management Challenges for Midsize Firms,www.gartner.com/smarterwithgartner/5-reasons-your-performance-management-is-a-failure
2015-11-30,The Key to Establishing a Data-Driven Culture,www.gartner.com/smarterwithgartner/the-key-to-establishing-a-data-driven-culture
2015-12-10,How to Monetize Your Customer Data,www.gartner.com/smarterwithgartner/how-to-monetize-your-customer-data
2016-02-17,How to Fund Bimodal Innovation,www.gartner.com/smarterwithgartner/fund-bimodal-innovation
2016-02-16,Why You Need Social Advertising,www.gartner.com/en/marketing/insights/articles/why-you-need-social-advertising
2016-01-18,How CIOs Conquer the Talent Crisis,www.gartner.com/smarterwithgartner/howciosconquertalentgap
2016-02-26,Strategies for the Bring Your Own App Surge,www.gartner.com/smarterwithgartner/bring-your-own-app-strategies
2016-02-25,Build a Team to Deliver Agile Analytics,www.gartner.com/smarterwithgartner/agile-analytics-team
2016-02-01,Getting Business Leader Buy-In for BPM,www.gartner.com/smarterwithgartner/getting-business-leader-buy-in-for-bpm
2016-03-02,Can the Chief Data Officer Ease the CIO's Burden?,www.gartner.com/smarterwithgartner/can-the-chief-data-officer-ease-the-cios-burden
2015-12-22,Three Characteristics of Multichannel Marketing Leaders,www.gartner.com/en/marketing/insights/articles/three-characteristics-of-multichannel-marketing-leaders
2015-10-01,"Move Over Big Data, Here Comes Big Content",www.gartner.com/en/marketing/insights/articles/move-over-big-data-here-comes-big-content
2015-10-06,The New CIO Influencer,www.gartner.com/smarterwithgartner/the-new-cio-influencer
2015-10-08,The Digital Humanist Approach to Security,www.gartner.com/smarterwithgartner/the-digital-humanist-approach-to-security
2015-12-09,Securing The Next-Generation Data Center With Software-Defined Security,www.gartner.com/smarterwithgartner/securing-the-next-generation-data-center-with-software-defined-security
2016-02-12,What Meaningful Events Matter to Your Customers?,www.gartner.com/en/marketing/insights/articles/meaningful-events-for-customers
2016-02-11,Staffing Strategies for the Chief Data Officer,www.gartner.com/smarterwithgartner/chief-data-officer-staffing
2016-01-15,CIOs Gain C-Suite Influence,www.gartner.com/smarterwithgartner/cios-gain-c-suite-influence
2016-01-14,Solutions to Build Content Marketing Agility,www.gartner.com/en/marketing/insights/articles/build-content-marketing-agility
2016-02-25,Be a Leader in Data-Driven Marketing,www.gartner.com/en/marketing/insights/articles/leader-in-data-driven-marketing
2016-02-24,Breaking Down the Barriers to Bimodal,www.gartner.com/smarterwithgartner/breaking-down-the-barriers-to-bimodal
2016-02-23,Three Steps to Telling a Good Information Yield Story,www.gartner.com/smarterwithgartner/three-steps-to-telling-a-good-information-yield-story
2016-02-19,Three Questions Leaders Should Ask About Innovation,www.gartner.com/smarterwithgartner/three-questions-leaders-should-ask-about-innovation
2016-01-27,6 CIO Responsibilities for Digital Business,www.gartner.com/smarterwithgartner/six-cio-responsibilities-for-digital-business-leadership
2016-01-26,Are You Ready to Own Customer Profitability?,www.gartner.com/smarterwithgartner/own-customer-profitability
2016-01-22,"When to Trust Your Gut, and When to Follow the Analytics",www.gartner.com/smarterwithgartner/when-to-trust-your-gut-and-when-to-follow-the-analytics
2016-03-01,Industrial Scale 3D Printing on the Rise,www.gartner.com/smarterwithgartner/industrial-scale-3d-printing-on-the-rise
2016-03-01,Getting Ready for Industrie 4.0,www.gartner.com/smarterwithgartner/getting-ready-for-industrie-4-0
2015-12-18,How to Prevent Big Data Analytics Failures,www.gartner.com/smarterwithgartner/how-to-prevent-big-data-analytics-failures
2015-12-17,Managing the Data Chaos of Self-Service Analytics,www.gartner.com/smarterwithgartner/managing-the-data-chaos-of-self-service-analytics
2015-09-30,Windows 10 Does Not Change The PC’s Fate,www.gartner.com/smarterwithgartner/windows-10-does-not-change-the-pcs-fate
2015-09-30,Business Leaders Need a Long-Term Digital and Technology Plan,www.gartner.com/smarterwithgartner/business-leaders-need-a-long-term-digital-and-technology-plan
2015-10-06,Gartner Predicts Our Digital Future,www.gartner.com/smarterwithgartner/gartner-predicts-our-digital-future
2016-02-10,Tame the Mobile Web vs. Native App Debate,www.gartner.com/en/marketing/insights/articles/mobile-web-or-native-app
2016-02-09,Remake Yourself With Six Digital Leadership Personas,www.gartner.com/smarterwithgartner/digital-leadership-personas
2016-01-13,What CIOs Can Learn From CES,www.gartner.com/smarterwithgartner/what-cios-can-learn-from-ces
2016-02-18,What Type of Chief Data Officer Are You?,www.gartner.com/smarterwithgartner/what-type-of-chief-data-officer-are-you
2016-03-01,PC Sales Bottoming Out,www.gartner.com/smarterwithgartner/pc-sales-bottoming-out
2016-03-01,Maximize Conversions With Predictive Analytics,www.gartner.com/en/marketing/insights/articles/maximize-conversions-with-predictive-analytics
2015-10-05,Digital Business Means Platform Business,www.gartner.com/smarterwithgartner/digital-business-means-platform-business
2016-02-29,Staying on Track With Connected Car Security,www.gartner.com/smarterwithgartner/staying-on-track-with-connected-car-security
2016-03-17,"A Four-Prong, Bimodal Approach for Chief Supply Chain Officers",www.gartner.com/smarterwithgartner/a-four-prong-bimodal-approach-for-chief-supply-chain-officers
2016-03-17,Introducing Marketing-Led Digital Commerce,www.gartner.com/en/marketing/insights/articles/marketing-led-commerce
2016-03-16,Create a Cloud Decision Framework,www.gartner.com/smarterwithgartner/cloud-decision-framework
2016-03-16,Transform Your Business With IoT Analytics,www.gartner.com/smarterwithgartner/transform-your-business-with-iot-analytics
2016-03-09,BPM is Critical to Business Transformation Success,www.gartner.com/smarterwithgartner/bpm-is-critical-to-business-transformation-success
2016-03-09,Why Integration is Critical to IoT Success,www.gartner.com/smarterwithgartner/iot-integration-questions
2016-03-15,6 Best Practices for Real-Time Analytics,www.gartner.com/smarterwithgartner/six-best-practices-for-real-time-analytics
2016-03-14,Identity and Access Management Isn't Immune to Digital Business Challenges,www.gartner.com/smarterwithgartner/identity-and-access-management-isnt-immune-to-digital-business-challenges
2016-03-11,The Internet of Things is Shifting Hackers' Targets,www.gartner.com/smarterwithgartner/the-internet-of-things-is-shifting-hackers-targets
2016-03-30,Canadian CIOs Focus on Technology and Delivery Platforms in 2016,www.gartner.com/smarterwithgartner/canadian-cios-focus-on-technology-and-delivery-platforms-in-2016
2016-03-30,Is It Time For a Digital Detox?,www.gartner.com/smarterwithgartner/is-it-time-for-a-digital-detox
2016-03-24,Electronic Logging Device Technology Can Improve The Supply Chain,www.gartner.com/smarterwithgartner/electronic-logging-device-technology-can-improve-the-supply-chain
2016-03-08,Preparing for Algorithms and Autonomous Business,www.gartner.com/smarterwithgartner/algorithms-autonomous-business
2016-03-08,Gartner Keynote: The CIO's Changing Role,www.gartner.com/smarterwithgartner/gartner-keynote-the-cios-changing-role
2016-03-11,Take the Next Step in Customer Experience,www.gartner.com/en/marketing/insights/articles/next-step-in-customer-experience
2016-03-23,Riding the Deception Wave,www.gartner.com/smarterwithgartner/deception-wave
2016-03-22,Innovation Center Best Practices,www.gartner.com/smarterwithgartner/innovation-center-get-started
2016-03-07,Five Mobile App Security Techniques Hackers Don't Want You to Use,www.gartner.com/smarterwithgartner/five-mobile-app-security-techniques-hackers-dont-want-you-to-use
2016-03-05,Rethink How You Evaluate Marketing Technology,www.gartner.com/en/marketing/insights/articles/rethink-how-you-evaluate-marketing-technology
2016-05-04,Leading Supply Chains Do Three Things Well,www.gartner.com/smarterwithgartner/leading-supply-chains-do-three-things-well
2016-05-04,How to Prioritize Your IT Cost Optimization Efforts,www.gartner.com/smarterwithgartner/how-to-prioritize-your-it-cost-optimization-efforts
2016-04-21,Security at the Speed of Digital Business,www.gartner.com/smarterwithgartner/security-at-the-speed-of-digital-business
2016-04-20,APIs Are at the Heart of Digital Business,www.gartner.com/smarterwithgartner/apis-are-at-the-heart-of-digital-business
2016-03-21,Digital Leadership is a Team Sport,www.gartner.com/smarterwithgartner/digital-leadership-is-a-team-sport
2016-03-21,How to Get Customer Service Employees to Care About Customers,www.gartner.com/smarterwithgartner/how-to-get-customer-service-employees-to-care-about-customers
2016-05-16,Make Financial Transparency Your Cost Optimization Foundation,www.gartner.com/smarterwithgartner/make-financial-transparency-your-cost-optimization-foundation
2016-05-13,How to Choose Your Marketing Partners Wisely,www.gartner.com/en/marketing/insights/articles/choose-external-partners-wisely
2016-03-03,The Impact of a Celebrity Tweet on Your Supply Chain,www.gartner.com/smarterwithgartner/the-impact-of-a-celebrity-tweet-on-your-supply-chain
2016-03-03,Appoint an Undertaker to Decommission Applications,www.gartner.com/smarterwithgartner/appoint-an-undertaker-to-decommission-applications
2016-05-03,Don't Let Shadow IT Put Your Business at Risk,www.gartner.com/smarterwithgartner/dont-let-shadow-it-put-your-business-at-risk
2016-05-03,Five Infrastructure Investments to Support Digital Business,www.gartner.com/smarterwithgartner/five-infrastructure-investments-to-support-digital-business
2016-04-12,Gartner Top 10 IT Cost Optimization Ideas,www.gartner.com/smarterwithgartner/gartner-top-10-it-cost-optimization-ideas
2016-04-08,Digital Business Through Algorithms and Digital Humanism,www.gartner.com/smarterwithgartner/digital-business-through-algorithms-and-digital-humanism
2016-04-20,Free Up IT Infrastructure Costs to Fund Transformation,www.gartner.com/smarterwithgartner/free-up-it-infrastructure-costs-to-fund-transformation
2016-04-18,First 100 Days: How Digital Marketing Leaders Succeed,www.gartner.com/en/marketing/insights/articles/first-100-days-how-digital-marketing-leaders-succeed
2016-05-18,The Supply Chain Organization of the Future,www.gartner.com/smarterwithgartner/the-supply-chain-organization-of-the-future
2016-05-18,Automation: The Next Frontier for IT,www.gartner.com/smarterwithgartner/automation-the-next-frontier-for-it-2
2016-03-17,The Art of Differentiation,www.gartner.com/smarterwithgartner/the-art-of-differentiation
2016-05-12,A Cyberattack is a Street Fight,www.gartner.com/smarterwithgartner/a-cyberattack-is-a-street-fight
2016-05-10,Ten Steps to Plan a Next-Generation Customer Engagement Hub,www.gartner.com/smarterwithgartner/ten-steps-to-plan-a-next-generation-customer-engagement-hub
2016-05-02,When Things Become People,www.gartner.com/smarterwithgartner/when-things-become-people
2016-04-28,Gearing Up for the Internet of Things,www.gartner.com/smarterwithgartner/gearing-up-for-the-internet-of-things-2
2016-04-07,Re-Examine Your Mobile Marketing Strategy,www.gartner.com/en/marketing/insights/articles/re-examine-your-mobile-marketing-strategy
2016-04-05,We're All Going To Be 'Digital Natives',www.gartner.com/smarterwithgartner/were-all-going-to-be-digital-natives
2016-04-05,Five Steps to Align Business Strategy With Supply Chain Capabilities,www.gartner.com/smarterwithgartner/five-steps-to-align-business-strategy-with-supply-chain-capabilities
2016-05-25,"The 5 Most Effective, Least Used Digital Innovation Hacks",www.gartner.com/smarterwithgartner/five-digital-innovation-hacks
2016-05-25,Build a Blueprint for the Internet of Things,www.gartner.com/smarterwithgartner/build-a-blueprint-for-the-internet-of-things
2016-04-15,5 Priorities HR Can't Ignore in 2015,www.gartner.com/smarterwithgartner/5-priorities-hr-cant-ignore-in-2015
2016-04-15,Five Keys to Understanding Algorithmic Business,www.gartner.com/smarterwithgartner/five-keys-to-understanding-algorithmic-business
2016-04-14,What’s the Story With Your Digital Commerce Marketing Metrics?,www.gartner.com/en/marketing/insights/articles/digital-marketing-metrics-hierarchy
2016-05-18,How to Build Your Marketing Organization,www.gartner.com/en/marketing/insights/articles/build-your-marketing-organization
2016-05-18,The Four Traits of the Digital Commerce Marketer,www.gartner.com/en/marketing/insights/articles/digital-commerce-marketer-traits
2016-05-10,CEOs Keep Digital Business Transformation on Track,www.gartner.com/smarterwithgartner/ceos-keep-digital-business-transformation-on-track
2016-05-09,First 100 Days As a Project Management Office Leader,www.gartner.com/smarterwithgartner/first-100-days-as-a-project-management-office-leader
2016-04-25,How Procurement Steps Up Cost Optimization for Digital Business,www.gartner.com/smarterwithgartner/cost-optimization-procurement
2016-04-22,Pitch Perfect: How to Choose the Right Agency Partner,www.gartner.com/en/marketing/insights/articles/choose-the-right-agency
2016-04-04,Cost Optimization in the Age of Digital Business,www.gartner.com/smarterwithgartner/cost-optimization-digital-business
2016-05-25,Defining Moments for Your Business,www.gartner.com/smarterwithgartner/defining-moments-for-your-business
2016-05-24,Improve User Experience by Reducing Features,www.gartner.com/smarterwithgartner/improve-user-experience-by-reducing-features
2016-06-07,Three Degrees of Information Value,www.gartner.com/smarterwithgartner/three-degrees-of-information-value
2016-06-06,The Social Science of Digital Business,www.gartner.com/smarterwithgartner/the-social-science-of-digital-business
2016-06-13,Gartner Keynote: Building Trust and Resilience for Digital Business,www.gartner.com/smarterwithgartner/building-trust-and-resilience-for-digital-business
2016-06-21,Try These Three Mobile Marketing Analytics Practices,www.gartner.com/en/marketing/insights/articles/try-these-three-mobile-marketing-analytics-practices
2016-06-17,Professional Sports Going Digital by Embracing ICT,www.gartner.com/smarterwithgartner/professional-sports-going-digital-by-embracing-ict
2016-04-13,How Socially Responsible is Your Supply Chain?,www.gartner.com/smarterwithgartner/how-socially-responsible-is-your-supply-chain
2016-05-18,The Secrets to Marketing Segmentation,www.gartner.com/en/marketing/insights/articles/secrets-marketing-segmentation
2016-05-17,Innovate Under Every Condition: The Bimodal Supply Chain,www.gartner.com/smarterwithgartner/innovate-under-every-condition-the-bimodal-supply-chain
2016-05-06,Could Your Next Boss Be a Robot?,www.gartner.com/smarterwithgartner/could-your-next-boss-be-a-robot
2016-05-05,Is Your IT Team Prepared for Public Cloud?,www.gartner.com/smarterwithgartner/is-your-it-team-prepared-for-public-cloud
2016-04-04,How Leaders Prepare for IoT’s Year of the Customer,www.gartner.com/smarterwithgartner/next-gen-iot-leadership
2016-03-31,Is the End of Computer Literacy in Sight?,www.gartner.com/smarterwithgartner/is-the-end-of-computer-literacy-in-sight
2016-07-15,Why IT Leaders Should Pay Attention to Augmented Reality,www.gartner.com/smarterwithgartner/it-leaders-pay-attention-to-augmented-reality
2016-07-14,Six Trends in Cybersecurity,www.gartner.com/smarterwithgartner/six-trends-in-cybersecurity
2016-07-12,Develop an Open Innovation Framework,www.gartner.com/smarterwithgartner/develop-an-open-innovation-framework
2016-05-24,The Secrets of Cost Optimization in Outsourcing,www.gartner.com/smarterwithgartner/the-secrets-of-cost-optimization-in-outsourcing
2016-05-24,Four Companies Reveal Their Data Measurement Lessons,www.gartner.com/en/marketing/insights/articles/four-companies-reveal-their-data-measurement-lessons
2016-06-06,What We Can Do With Machine Learning,www.gartner.com/smarterwithgartner/what-we-can-do-with-machine-learning
2016-06-02,Virtual Labor Will Fuel Digital Initiatives,www.gartner.com/smarterwithgartner/virtual-labor-will-fuel-digital-initiatives
2016-09-02,The New Disruptive Mobile Behavior,www.gartner.com/en/marketing/insights/articles/the-new-disruptive-mobile-behavior
2016-09-01,Why CIOs Still Need a Cloud Strategy,www.gartner.com/smarterwithgartner/why-cios-still-need-a-cloud-strategy
2016-06-12,The 360-degree Approach to IT Cost and Value Optimization,www.gartner.com/smarterwithgartner/the-360-degree-approach-to-it-cost-and-value-optimization
2016-06-10,Leadership Practices to Foster a Growth Mindset,www.gartner.com/smarterwithgartner/leadership-practices-to-foster-a-growth-mindset-2
2016-06-16,Gartner’s Top 10 Technologies for Information Security,www.gartner.com/smarterwithgartner/gartners-top-10-technologies-for-information-security
2016-06-16,Virtual Reality Primer for Marketers,www.gartner.com/en/marketing/insights/articles/virtual-reality-primer-for-marketers
2016-06-15,Gartner’s Top 10 Security Predictions 2016,www.gartner.com/smarterwithgartner/top-10-security-predictions-2016
2016-07-05,Where to Place Your B2B Marketing Bets in 2016,www.gartner.com/en/marketing/insights/articles/b2b-marketing-bets
2016-07-01,Why Selling is More Important Than Ever for CIOs,www.gartner.com/smarterwithgartner/why-selling-is-more-important-than-ever-for-cios
2016-07-01,8 Ways CIOs Can Prepare for the Brexit Impact,www.gartner.com/smarterwithgartner/8-ways-cios-prepare-for-brexit-impact
2016-09-21,Balance Your Insource and Outsource Marketing Talent Mix,www.gartner.com/en/marketing/insights/articles/balance-your-insource-and-outsource-marketing-talent-mix
2016-09-16,Plan for the Digital Future,www.gartner.com/smarterwithgartner/plan-for-the-digital-future
2016-09-15,How to Get Your CEO to Embrace Digital Risk Management,www.gartner.com/smarterwithgartner/how-to-get-your-ceo-to-embrace-digital-risk-management
2016-05-17,Improve the Customer Experience by Knowing the (New) Customer Journey,www.gartner.com/en/marketing/insights/articles/improve-the-customer-experience-by-knowing-the-new-customer-journey
2016-05-17,Gartner Keynote: Mastering the Marketer’s Journey,www.gartner.com/en/marketing/insights/articles/gartner-keynote-mastering-the-marketers-journey
2016-07-12,How to Respond to Customers That Aren't Human,www.gartner.com/smarterwithgartner/how-to-respond-to-customers-that-arent-human
2016-07-12,How Brands Tap Into Mobile Payments,www.gartner.com/en/marketing/insights/articles/mobile-payments
2016-07-08,Four Megatrends Impacting the Data Center,www.gartner.com/smarterwithgartner/four-megatrends-impacting-the-data-center
2016-05-19,Cultivate a Data-Driven Culture,www.gartner.com/en/marketing/insights/articles/data-driven-culture
2016-05-19,What 3D Printing Means for Your Supply Chain,www.gartner.com/smarterwithgartner/what-3d-printing-means-for-your-supply-chain
2016-05-31,5 Questions to Evaluate Digital Business Plans,www.gartner.com/smarterwithgartner/5-questions-to-evaluate-digital-business-plans
2016-05-31,Security Embraces Advanced Analytics and Machine Learning,www.gartner.com/smarterwithgartner/security-embraces-advanced-analytics-and-machine-learning
2016-05-30,The Key to Business Transformation is Culture,www.gartner.com/smarterwithgartner/the-key-to-business-transformation-is-culture
2016-09-01,Your First 100 Days as a New Chief Information Security Officer,www.gartner.com/smarterwithgartner/your-first-100-days-as-a-new-chief-information-security-officer-2
2016-08-31,7 Tips for Staying Secure in the Cloud,www.gartner.com/smarterwithgartner/seven-tips-for-staying-secure-in-the-cloud
2016-08-31,6 Styles of Customer Analytics,www.gartner.com/smarterwithgartner/six-styles-of-customer-analytics
2016-09-29,Are Social Media Command Centers Worth the Investment,www.gartner.com/en/marketing/insights/articles/are-social-media-command-centers-worth-the-investment
2016-09-28,Now is the Time for Digital Transformation,www.gartner.com/smarterwithgartner/now-is-the-time-for-digital-transformation
2016-09-28,Why Big Companies Need Lean Startup Techniques,www.gartner.com/smarterwithgartner/why-big-companies-need-lean-startup-techniques
2016-06-10,Fuel Social Marketing With User Generated Content,www.gartner.com/en/marketing/insights/articles/fuel-social-marketing-user-generated-content
2016-06-09,Welcome to the API Economy,www.gartner.com/smarterwithgartner/welcome-to-the-api-economy
2016-06-08,How to Choose a Data Broker,www.gartner.com/smarterwithgartner/how-to-choose-a-data-broker
2016-06-14,Coordinate Data Security Governance with Business Requirements,www.gartner.com/smarterwithgartner/coordinate-data-security-with-business-requirements
