Contributor,Title,Date,Link
"posted by Maggie Johnson, Director of Education and University Relations",2,2,2
"by Ariel Fuxman, Research Scientist",1,1,1
"Yifeng Jiang, Research Intern and Jie Tan, Research Scientist, Robotics at Google",1,1,1
"Vincent Vanhoucke, Principal Scientist, Google Brain Team",1,1,1
"Valentin Bazarevsky and Andrei Tkachenka, Software Engineers, Google Research",1,1,1
"Sella Nevo, Senior Software Engineer, Google Research, Tel Aviv",1,1,1
Posted by Tomáš Ižo (Software Engineer) and Jay Yagnik (Head of Computer Vision Research),1,1,1
Posted by ,3,3,3
"Posted by Łukasz Kaiser, Senior Research Scientist, Google Brain Team and Aidan N. Gomez, Researcher, Department of Computer Science Machine Learning Group, University of Toronto",1,1,1
"Posted by Łukasz Kaiser, Senior Research Scientist, Google Brain Team",1,1,1
"Posted by Łukasz Kaiser and Dumitru Erhan, Research Scientists, Google AI",1,1,1
"Posted by Úlfar Erlingsson, Tech Lead Manager, Security Research",1,1,1
"Posted by Úlfar Erlingsson, Manager, Security Research",1,1,1
"Posted by Ziv Bar-Yossef and Kevin McCurley, Research Team",1,1,1
"Posted by Zirui Wang, Student Researcher and Yuan Cao, Research Scientist, Google Research, Brain Team",1,1,1
"Posted by Zhilin Yang and Quoc Le, Google AI",1,1,1
"Posted by Zarana Parekh, Software Engineer and Jason Baldridge, Staff Research Scientist, Google Research",1,1,1
"Posted by Zak Stone, Product Manager for TensorFlow, on behalf of the TensorFlow team",1,1,1
"Posted by Zak Stone, Product Manager for TensorFlow",1,1,1
"Posted by Zaid Nabulsi, Software Engineer and Po-Hsuan Cameron Chen, Software Engineer, Google Health",1,1,1
"Posted by Zachary Nado, Research Engineer and Dustin Tran, Research Scientist, Google Research, Brain Team",1,1,1
"Posted by Yuxuan Wang, Research Scientist and RJ Skerry-Ryan, Software Engineer, on behalf of the Machine Perception, Google Brain and TTS Research teams",1,1,1
"Posted by Yuxiang Yang and Deepali Jain, AI Residents, Robotics at Google",1,1,1
"Posted by Yushi Jing and Henry Rowley, Google Research",1,1,1
Posted by Yun-Ta Tsai,1,1,1
"Posted by Yun Liu, Research Scientist and Po-Hsuan Cameron Chen, Research Engineer, Google Health",1,1,1
"Posted by Yujin Tang, Research Software Engineer and David Ha, Staff Research Scientist, Google Research, Tokyo",1,1,1
"Posted by Yuan Zhang, Research Scientist and Yinfei Yang, Software Engineer, Google Research",1,1,1
"Posted by Yuan Liu, PhD, Software Engineer and Peggy Bui, MD, Technical Program Manager, Google Health",1,1,1
"Posted by Yossi Matias, Vice President and Ehud Rivlin, Research Scientist, Google Research",1,1,1
"Posted by Yossi Matias, Senior Director, Head of Israel R&D Center",1,1,1
"Posted by Yossi Matias, Niv Efron, and Yair Shimshoni, Google Labs, Israel.",1,1,1
"Posted by Yonglong Tian, Student Researcher and Chen Sun, Staff Research Scientist, Google Research",1,1,1
"Posted by Yonghui Wu, Principal Engineer, Google Brain Team",1,1,1
"Posted by Yong Cheng, Software Engineer, Google Research",1,1,1
"Posted by Yoav Goldberg, Professor at Bar Ilan University & Post-doc at Google 2011-2013",1,1,1
"Posted by Yinfei Yang, Software Engineer and Chris Tar, Engineering Manager, Google AI",1,1,1
"Posted by Yinfei Yang and Fangxiaoyu Feng, Software Engineers, Google Research",1,1,1
"Posted by Yinfei Yang and Amin Ahmad, Software Engineers, Google Research",1,1,1
"Posted by Yifeng Lu, Software Engineer, Google AI",1,1,1
"Posted by Yiding Jiang, Google AI Resident",1,1,1
"Posted by Yen-Chen Lin, Research Intern and Andy Zeng, Research Scientist, Robotics at Google",1,1,1
"Posted by Ye Jia, Software Engineer and Julie Cattiau, Product Manager, Google Research",1,1,1
"Posted by Ye Jia and Ron Weiss, Software Engineers, Google AI",1,1,1
"Posted by Ye Jia and Michelle Tadmor Ramanovich, Software Engineers, Google Research",1,1,1
"Posted by Yanping Huang, Software Engineer, Google AI",1,1,1
"Posted by Yaniv Leviathan, Principal Engineer and Yossi Matias, Vice President, Engineering, Google",1,1,1
"Posted by Yang Song, Staff Software Engineer and Serge Belongie, Visiting Faculty, Google Research",1,1,1
"Posted by Yang Li, Research Scientist, Google Research",2,2,2
"Posted by Yang Li, Research Scientist, Google AI",1,1,1
"Posted by Yang Li, Research Scientist",2,2,2
"Posted by Xue Bin (Jason) Peng, Student Researcher and Sehoon Ha, Research Scientist, Robotics at Google",1,1,1
"Posted by Xuanhui Wang and Michael Bendersky, Software Engineers, Google AI",1,1,1
"Posted by Xuan Yang, Software Engineer, Google Research",1,1,1
"Posted by Xingyou (Richard) Song, Software Engineer and Yuxiang Yang, AI Resident, Robotics at Google",1,1,1
"Posted by Xiaojun Bi, Ciprian Chelba, Tom Ouyang, Kurt Partridge and Shumin Zhai",1,1,1
"Posted by Xiaofang Wang, Intern and Yair Alon (prev. Movshovitz-Attias), Software Engineer, Google Research",1,1,1
"Posted by Xianzhi Du, Software Engineer and Jaeyoun Kim, Technical Program Manager, Google Research",1,1,1
"Posted by Weilong Yang and Min-hsuan Tsai, Video Content Analysis team and the YouTube Creator team",1,1,1
"Posted by Warren Shen, Fusion Tables team",1,1,1
"Posted by Walter Jetz, Dept. of Ecology and Evolutionary Biology, Yale University, and Dave Thau, Developer Advocate, Google Earth Engine, with support from Robert Guralnick, Dept. of Natural History, University of Florida",1,1,1
"Posted by Vivek Kwatra, Research Scientist and Christian Frueh, Avneesh Sud, Software Engineers",1,1,1
"Posted by Vittorio Ferrari, Research Scientist, Machine Perception",3,3,3
"Posted by Viren Jain, Research Scientist and Technical Lead and Michal Januszewski, Software Engineer, Connectomics at Google",1,1,1
"Posted by Vinton Cerf, Chief Internet Evangelist",1,1,1
"Posted by Vint Cerf, VP & Chief Internet Evangelist",1,1,1
"Posted by Vincent Vanhoucke, Research Scientist, Speech Team",1,1,1
"Posted by Vincent Vanhoucke, Principal Scientist, Google Brain Team and Melanie Saldaña, Program Manager, University Relations",1,1,1
"Posted by Vincent Vanhoucke, Principal Research Scientist",1,1,1
"Posted by Vincent Vanhoucke, Google Research Scientist",1,1,1
"Posted by Vincent Vanhoucke, Google Research",1,1,1
Posted by Vincent Dumoulin,1,1,1
"Posted by Vighnesh Birodkar, Research Software Engineer and Jonathan Huang, Research Scientist, Google Research",1,1,1
"Posted by Valentin Spitkovsky and Peter Norvig, Research Team",1,1,1
"Posted by Valentin Bazarevsky and Ivan Grishchenko, Research Engineers, Google Research",1,1,1
"Posted by Valentin Bazarevsky and Fan Zhang, Research Engineers, Google Research",1,1,1
"Posted by Vahab Mirrokni, Research Scientist, Google Research New York",1,1,1
"Posted by Vahab Mirrokni, Principal Scientist, Morteza Zadimoghaddam, Research Scientist, NYC Algorithms Team",1,1,1
"Posted by Vahab Mirrokni, Principal Research Scientist and Xerxes Dotiwalla, Product Manager, NYC Algorithms and Optimization Team",1,1,1
"Posted by Utku Evci and Pablo Samuel Castro, Research Engineers, Google Research, Montreal",1,1,1
"Posted by Umar Syed and Sergei Vassilvitskii, Research Scientists, Google AI, NYC",1,1,1
"Posted by Ullas Gargi and Rich Gossweiler, Research Team",1,1,1
"Posted by Tuomas Haarnoja, Student Researcher and Sergey Levine, Faculty Advisor, Robotics at Google",1,1,1
"Posted by Tulsee Doshi, Product Manager, Google AI",1,1,1
"Posted by Tony Mak, Software Engineer, Google Research and Simon Tong, Principal Engineer, Google Research, Brain Team",1,1,1
"Posted by Tom Kwiatkowski and Michael Collins, Research Scientists, Google AI Language",1,1,1
"Posted by Tom Kenter, Google Research, London",1,1,1
"Posted by Tom Dean, Google Research",1,1,1
"Posted by Tom B. Brown and Catherine Olsson, Research Engineers, Google Brain Team",1,1,1
"Posted by Tingbo Hou and Tyler Mullen, Software Engineers, Google Research",1,1,1
"Posted by Ting Chen, Research Scientist and Geoffrey Hinton, VP & Engineering Fellow, Google Research",1,1,1
"Posted by Tina Ornduff, Program Manager",1,1,1
"Posted by Timo Kohlberger and Yuan Liu, Software Engineers, Google Health",1,1,1
"Posted by Tim Blakely, Software Engineer and Michał Januszewski, Research Scientist, Connectomics at Google",1,1,1
"Posted by Tilman Reinhardt‎, Software Engineer, Google Maps",1,1,1
"Posted by Thomas Müller, Software Engineer, Google Research",1,1,1
"Posted by Thomas Fischbacher, Software Engineer, Google Research, Zürich",1,1,1
"Posted by Thomas Deselaers, Senior Staff Software Engineer and Jake Walker, Product Manager, Machine Perception",1,1,1
"Posted by Thomas Deselaers, Daniel Keysers, Henry Rowley, Li-Lun Wang, Victor Cărbune, Ashok Popat, Dhyanesh Narayanan, Handwriting Team, Google Research",1,1,1
"Posted by Thibault Sellam, Software Engineer and Ankur P. Parikh, Research Scientist, Google Research",1,1,1
Posted by The Flu Trends Team,1,1,1
"Posted by Thao Nguyen, AI Resident, Google Research",1,1,1
"Posted by Thang Luong, Staff Research Scientist, Google Research and Jingcao Hu, Senior Staff Software Engineer, Google Search",1,1,1
"Posted by Thang Luong, Research Scientist, and Eugene Brevdo, Staff Software Engineer, Google Brain Team",1,1,1
"Posted by Thad Hughes, Martin Jansche, and Pedro Moreno, Google Research",1,1,1
"Posted by Terry Ednacot, Education Program Manager",2,2,2
"Posted by Ted Baltz, Senior Staff Software Engineer, Google Research, Accelerated Science Team",1,1,1
"Posted by Ted Baltz, Senior Staff Software Engineer, Google Research",1,1,1
"Posted by Ted Baltz, Senior Staff Software Engineer, Google Accelerated Science Team",1,1,1
"Posted by Tara N. Sainath, Research Scientist, Speech Team and Yonghui Wu, Software Engineer, Google Brain Team",1,1,1
"Posted by Tali Dekel, Research Scientist and Forrester Cole, Software Engineer, Machine Perception",1,1,1
"Posted by Tali Dekel and Michael Rubinstein, Research Scientists",1,1,1
"Posted by T.V Raman, Research Scientist",1,1,1
"Posted by Suyog Gupta and Mingxing Tan, Software Engineers, Google Research",1,1,1
"Posted by Suyog Gupta and Marie White, Software Engineers, Google Research",1,1,1
"Posted by Susie Kim, Program Manager, University Relations",5,5,5
"Posted by Sumit Agarwal, Maryam Kamvar, & Michael Stoppelman",1,1,1
"Posted by Sujith Ravi, Staff Research Scientist, Google Research",2,2,2
"Posted by Sujith Ravi, Senior Staff Research Scientist, Google Expander Team",1,1,1
"Posted by Sujith Ravi, Research Scientist, Google Expander Team",1,1,1
"Posted by Sudheendra Vijayanarasimhan and Paul Natsev, Software Engineers",1,1,1
"Posted by Sudheendra Vijayanarasimhan and David Ross, Software Engineers",1,1,1
"Posted by Subhrajit Roy, Research Scientist and Diana Mincu, Research Software Engineer, Google Research",1,1,1
"Posted by Steven Hickson, Software Engineering Intern, and Nick Dufour, Avneesh Sud, Software Engineers, Machine Perception",1,1,1
"Posted by Steven Butschi, Head of Higher Education, Google",1,1,1
"Posted by Steve Vranakis and Jayme Goldstein, Executive Creative Director and Project Lead, Google Creative Lab",1,1,1
"Posted by Stephan Gouws, Research Scientist, Google Brain Team and Mostafa Dehghani, University of Amsterdam PhD student and Google Research Intern",1,1,1
"Posted by Sourish Chaudhuri, Software Engineer, Sound Understanding",1,1,1
Posted by Software Engineers George Toderici and Sudheendra Vijayanarasimhan,1,1,1
"Posted by Slaven Bilac, Software Engineer, Google Research",1,1,1
"Posted by Slav Petrov, Senior Staff Research Scientist",1,1,1
"Posted by Slav Petrov, Research Scientist",3,3,3
"Posted by Slav Petrov, Principal Scientist, Google",1,1,1
"Posted by Slav Petrov, Doug Aberdeen, and Lisa McCracken, Google Research",1,1,1
"Posted by Slav Petrov and Ryan McDonald, Research Team",1,1,1
"Posted by Slav Petrov and Dipanjan Das, Research Scientists",1,1,1
"Posted by Siyuan Qiao, Student Researcher and Liang-Chieh Chen, Research Scientist, Google Research",1,1,1
"Posted by Simon Tong, Google Research",1,1,1
"Posted by Silvio Lattanzi, Research Scientist, Google Zürich and Vahab Mirrokni, Research Scientist, Google New York",1,1,1
"Posted by Sian Gooding, Intern, Google Research",1,1,1
"Posted by Siamak Shakeri, Staff Software Engineer and Oshin Agarwal, Research Intern, Google Research",1,1,1
"Posted by Shumeet Baluja, Michele Covell, Pedro Moreno & Eugene Weinstein",1,1,1
Posted by Shumeet Baluja and Yushi Jing,1,1,1
"Posted by Shreeyak Sajjan, Research Engineer, Synthesis AI and Andy Zeng, Research Scientist, Robotics at Google",1,1,1
"Posted by Shekoofeh Azizi, AI Resident, Google Research",1,1,1
"Posted by Shaun Lysen, Statistician at Google",1,1,1
"Posted by Shankar Kumar, Google Research Scientist and Manaal Faruqui, Carnegie Mellon University PhD candidate",1,1,1
Posted by Shankar Kumar and Wolfgang Macherey,1,1,1
"Posted by Shan Yang, Software Engineer and Angjoo Kanazawa, Research Scientist, Google Research",1,1,1
"Posted by Shan Carter, Software Engineer, Google AI",1,1,1
"Posted by Shan Carter, Software Engineer and Chris Olah, Research Scientist, Google Brain Team",1,1,1
"Posted by Shakir Mohamed and Charles Blundell, Google DeepMind, London",1,1,1
"Posted by Sergio Boixo, Research Scientist and Theory Team Lead, and Charles Neill, Quantum Electronics Engineer, Quantum A.I. Lab",1,1,1
"Posted by Sergey Levine, Research Scientist",1,1,1
"Posted by Sergey Levine, Faculty Advisor and Pierre Sermanet, Research Scientist, Google Brain Team",1,1,1
"Posted by Sergey Levine (Google Brain Team), Timothy Lillicrap (DeepMind), Mrinal Kalakrishnan (X)",1,1,1
"Posted by Serge Belongie, Visiting Faculty and Hartwig Adam, Engineering Director, Google Research",1,1,1
"Posted by Sella Nevo, Senior Software Engineer, Google Research, Tel Aviv",1,1,1
"Posted by Sella Nevo, Senior Software Engineer and Rainier Aliment, Program Manager",1,1,1
"Posted by Sean Lip, Software Engineer, Open Online Education",1,1,1
"Posted by Sara Beery, Student Researcher and Jonathan Huang, Research Scientist, Google Research",1,1,1
"Posted by Sanketh Shetty, YouTube Slam Team, Google Research ",1,1,1
"Posted by Sanjiv Kumar, Research Scientist",1,1,1
"Posted by Sanjiv Kumar and Henry Rowley, Google Research",1,1,1
"Posted by Sandro Feuz and Pedro Gonnet, Senior Software Engineers, Handwriting Team",1,1,1
"Posted by Sandeep Tata, Software Engineer, Google Research",2,2,2
"Posted by Samuel Yang, Research Scientist, Google Accelerated Science Team",1,1,1
"Posted by Samuel S. Schoenholz, Senior Research Scientist and Roman Novak, Research Engineer, Google Research",1,1,1
"Posted by Samuel J. Yang, Research Scientist and Dick Lyon, Principal Scientist, Google Research",1,1,1
"Posted by Sam Hasinoff, Software Engineer, Machine Perception",1,1,1
"Posted by Sagar Savla, Product Manager, Machine Perception",1,1,1
"Posted by Ryan McDonald, Research Scientist, Google Research",1,1,1
"Posted by Ryan McDonald and Fernando Pereira, Research Team",1,1,1
"Posted by Ryan Hickman and Mamie Rheingold, 20% Robotics Task Force",1,1,1
"Posted by Ryan Babbush, Senior Research Scientist, Quantum AI Team",1,1,1
"Posted by Ryan Babbush, Quantum Software Engineer",1,1,1
"Posted by Ryan Babbush and Jarrod McClean, Quantum Software Engineers, Quantum AI Team",1,1,1
"Posted by Ross Koningstein, Engineering Director Emeritus, Google Research",1,1,1
"Posted by Ross Koningstein, Engineer, Google RE<C team",1,1,1
"Posted by Rose E. Wang, Student Researcher and Aleksandra Faust, Staff Research Scientist, Google Research",1,1,1
"Posted by Rory Sayres PhD and Jonathan Krause PhD, Google AI, Healthcare",1,1,1
"Posted by Romina Stella, Product Manager, Google Translate",1,1,1
"Posted by Robert Obryk and Jyrki Alakuijala, Software Engineers, Google Research Europe",1,1,1
"Posted by Robert Dadashi, Research Software Engineer and Léonard Hussenot, Student Researcher, Google Research",1,1,1
"Posted by Rishabh Singh, Research Scientist and Max Lin, Software Engineer, Google Research",1,1,1
"Posted by Rishabh Agarwal, Research Scientist and Pablo Samuel Castro, Staff Software Engineer, Google Research, Brain Team",1,1,1
"Posted by Rishabh Agarwal, Research Associate, Google Research, Brain Team",1,1,1
"Posted by Rishabh Agarwal, Google AI Resident and Mohammad Norouzi, Research Scientist",1,1,1
"Posted by Rishabh Agarwal, AI Resident and Mohammad Norouzi, Research Scientist, Google Research",1,1,1
"Posted by Rick Boardman, User Experience Researcher",1,1,1
"Posted by Rich Gossweiler, Maryam Kamvar, Shumeet Baluja",1,1,1
"Posted by Reena Jana, Creative Lead, Business Inclusion, and Josh Lovejoy, UX Designer, Google Research",1,1,1
"Posted by Rebecca Shapley, Jayant Madhavan, Rod McChesney, and Kathryn Hurley, Fusion Tables team",1,1,1
"Posted by Rebecca Shapley, Fusion Tables Team",1,1,1
"Posted by Ray Kurzweil, Director of Engineering and Rachel Bernstein, Product Manager, Google Research",1,1,1
"Posted by Randy Sargent, Google/Carnegie Mellon University; Matt Hancher and Eric Nguyen, Google; and Illah Nourbakhsh, Carnegie Mellon University",1,1,1
"Posted by Rami Barends and Julian Kelly, Quantum Electronics Engineers and John Martinis, Research Scientist",1,1,1
"Posted by Rami Barends and Alireza Shabani, Quantum Electronics Engineers",1,1,1
"Posted by Rami Al-Rfou, Research Scientist, Google Research",1,1,1
"Posted by Ramanathan Guha, Google Fellow",1,1,1
"Posted by Rajan Patel, Director, Augmented Reality",1,1,1
"Posted by Raimondas Kiveris, Software Engineer, Google Research",1,1,1
"Posted by Rahul Sukthankar, Research Scientist",1,1,1
"Posted by Rahul Garg, Research Scientist and Neal Wadhwa, Software Engineer",1,1,1
"Posted by Radu Soricut and Zhenzhong Lan, Research Scientists, Google Research",1,1,1
"Posted by Quoc V. Le & Mike Schuster, Research Scientists, Google Brain Team",1,1,1
"Posted by Quoc Le & Barret Zoph, Research Scientists, Google Brain team",1,1,1
"Posted by Quan Wang, Software Engineer, Google Research",1,1,1
"Posted by Qizhe Xie, Student Researcher and Thang Luong, Senior Research Scientist, Google Research, Brain Team",1,1,1
Posted by Proud Googlers,1,1,1
"Posted by Praveen Paritosh, Senior Research Scientist, Ka Wong, Senior Data Scientist",1,1,1
"Posted by Pranav Khaitan, Google Research",1,1,1
"Posted by Prabhu Kaliamoorthi, Software Engineer, Google Research",1,1,1
"Posted by Prabhakar Raghavan, Vice President of Engineering",1,1,1
"Posted by Posted by Yun-hsuan Sung (宋雲軒) and Martin Jansche, Google Research",1,1,1
"Posted by Posted by Juan E. Vargas, University Relations",1,1,1
"Posted by Posted by Corinna Cortes, Head, Google Research NY",1,1,1
"Posted by Piyush Sharma, Software Engineer and Radu Soricut, Research Scientist, Google AI",1,1,1
"Posted by Pi-Chuan Chang, Software Engineer and Lizzie Dorfman, Technical Program Manager, Google Brain Team",1,1,1
"Posted by Phing Lee, Program Manager, Google AI Residency",1,1,1
"Posted by Philip Sun, Software Engineer, Google Research",1,1,1
"Posted by Philip Quinn and Wenxin Feng, Research Scientists, Android UX",1,1,1
"Posted by Phil Long, Research Team",1,1,1
"Posted by Peyman Milanfar, Research Scientist",1,1,1
"Posted by Peter Norvig, Director, Google Research",2,2,2
"Posted by Peter Norvig, Director of Research",1,1,1
Posted by Peter Norvig,1,1,1
"Posted by Peter Liu and Xin Pan, Software Engineers, Google Brain Team",1,1,1
"Posted by Peter J. Liu and Yao Zhao, Software Engineers, Google Research",1,1,1
"Posted by Peter H. Li, Research Scientist and Jeremy Maitin-Shepard, Software Engineer, Connectomics at Google",1,1,1
"Posted by Pete Warden, Software Engineer, Google Brain Team",1,1,1
"Posted by Pete Warden, Software Engineer",1,1,1
"Posted by Pete Florence, Research Scientist and Corey Lynch, Research Engineer, Robotics at Google",1,1,1
"Posted by Per Karlsson and Lucy Yu, Software Engineers, Google Research",1,1,1
"Posted by Peggy Chi, Senior Research Scientist and Irfan Essa, Senior Staff Research Scientist, Google Research",1,1,1
"Posted by Pedro J. Moreno, Staff Research Scientist and Johan Schalkwyk, Senior Staff Engineer",1,1,1
"Posted by Pedro J. Moreno, Research Scientist",1,1,1
"Posted by Paul V. Klimov, Research Scientist, Google AI Quantum Team",1,1,1
"Posted by Paul Natsev, Software Engineer",1,1,1
"Posted by Paul Dille, Senior Software Developer, Carnegie Mellon University CREATE Lab, and Chris Herwig, Geo Data Engineer, Google Earth Outreach",1,1,1
"Posted by Paul C. Boutros, Ontario Institute for Cancer Research, Josh Stuart, UC Santa Cruz, Adam Margolin, Oregon Health & Science University; Nicole Deflaux and Jonathan Bingham, Google Cloud Platform and Google Genomics",1,1,1
"Posted by Patrik Sundberg, Software Engineer and Eyal Oren, Product Manager, Google Brain Team",1,1,1
"Posted by Patrick Riley, Principal Engineer, Accelerated Science Team, Google Research",1,1,1
"Posted by Patrick Riley and Dale Webster, Google Research and",1,1,1
"Posted by Pankaj Gupta and Anand Rangarajan, Engineering Directors, Google India",1,1,1
"Posted by Pablo Samuel Castro, Staff Software Engineer, Google Research",1,1,1
"Posted by Pablo Samuel Castro, Research Software Developer and Marc G. Bellemare, Research Scientist, Google Brain Team",1,1,1
"Posted by Pablo Barrera, Software Engineer, Google Research and Florian Stimberg, Research Engineer, DeepMind",1,1,1
"Posted by Otavio Good, Software Engineer, Google Translate",1,1,1
"Posted by Omid Madani, Senior Software Engineer",1,1,1
"Posted by Olivier Bousquet, Principal Engineer, Google Zürich",1,1,1
"Posted by Olivier Bachem, Research Scientist, Google AI Zürich",1,1,1
"Posted by Olivia Hallisey, 2015 Grand Prize winner, Google Science Fair",1,1,1
"Posted by Ofir Nachum and Bo Dai, Research Scientists, Google Research",1,1,1
"Posted by Noah Fiedel, Software Engineer",1,1,1
"Posted by Nitish Korula and Vahab Mirrokni, Google Research, New York",1,1,1
"Posted by Nikolay Savinov, Research Intern, Google Brain Team and Timothy Lillicrap, Research Scientist, DeepMind",1,1,1
"Posted by Nikita Kitaev, Student Researcher, UC Berkeley and Łukasz Kaiser, Research Scientist, Google Research",1,1,1
"Posted by Nikhil Thorat and Daniel Smilkov, Software Engineers, Google Big Picture Team",1,1,1
"Posted by Nicola Pezzotti, Software Engineering Intern, Google Zürich",1,1,1
"Posted by Nick Johnston, Software Engineer, Machine Perception",1,1,1
"Posted by Nick Johnston, Software Engineer, Google Research",1,1,1
"Posted by Nick Johnston and David Minnen, Software Engineers",1,1,1
"Posted by Nick Dufour, Google Research and Andrew Gully, Jigsaw",1,1,1
"Posted by Nicholas Rubin and Charles Neill, Research Scientists, Google AI Quantum",1,1,1
"Posted by Nicholas Carlini, Research Scientist, Google Research",1,1,1
"Posted by Neil Zeghidour, Research Scientist, Google Research",1,1,1
"Posted by Neil Zeghidour, Research Scientist and Marco Tagliasacchi, Staff Research Scientist, Google Research",1,1,1
"Posted by Neil Houlsby, Research Scientist and Xiaohua Zhai, Research Engineer, Google Research, Zürich",1,1,1
"Posted by Neil Houlsby and Dirk Weissenborn, Research Scientists, Google Research",1,1,1
"Posted by Neil Fraser, Chief Interplanetary Liaison",1,1,1
"Posted by Neil Daswani & Ravi Jain, Google; and Saikat Guha, Cornell University",1,1,1
"Posted by Negar Saei, Program Manager, University Relations",1,1,1
"Posted by Negar Saei, Program Manager, Google Research",1,1,1
"Posted by Neal Wadhwa, Software Engineer and Yinda Zhang, Research Scientist, Google Research",1,1,1
"Posted by Navid Shiee, Senior Software Engineer and Aseem Agarwala, Staff Research Scientist, Google AI",1,1,1
"Posted by Naveen Arivazhagan, Senior Software Engineer and Colin Cherry, Staff Research Scientist, Google Research",1,1,1
"Posted by Nathan Silberman and Sergio Guadarrama, Google Research",1,1,1
"Posted by Nathan Frey, Senior Software Engineer, Google Research, Los Angeles and Zheng Sun, Senior Software Engineer, Google Research, Mountain View",1,1,1
"Posted by Natasha Noy, Research Scientist and Omar Benjelloun, Software Engineer, Google Research",1,1,1
"Posted by Natasha Noy, Google Research and Dan Brickley, Open Source Programs Office",1,1,1
"Posted by Natasha Jaques, Google Research and Michael Dennis, UC Berkeley",1,1,1
"Posted by Natalie Hammel and Lorraine Yurshansky, creators of Nat & Lo’s 20% Project",1,1,1
"Posted by Narayan Hegde, Software Engineer, Google Health and Carrie J. Cai, Research Scientist, Google Research",1,1,1
"Posted by Nal Kalchbrenner and Lasse Espeholt, Google Research",1,1,1
"Posted by Nal Kalchbrenner and Casper Sønderby, Research Scientists, Google Research, Amsterdam",1,1,1
"Posted by Nachiappan Valliappan, Senior Software Engineer and Kai Kohlhoff, Staff Research Scientist, Google Research",1,1,1
"Posted by Murray Stokely, Software Engineer",1,1,1
"Posted by Murray Stokely, Google Storage Analytics Team",1,1,1
"Posted by Murphy Yuezhen Niu and Sergio Boixo, Research Scientists ",1,1,1
"Posted by Moshe Looks, Marcello Herreshoff and DeLesley Hutchins, Software Engineers",1,1,1
Posted by Moshe Looks,1,1,1
"Posted by Moritz Hardt, Research Scientist, Google Brain Team",1,1,1
"Posted by Moritz Hardt, Research Scientist",1,1,1
"Posted by Mohsen Vakilian, Software Engineer",1,1,1
"Posted by Mohammad Babaeizadeh, Research Engineer and Dumitru Erhan, Research Scientist, Google Research",1,1,1
"Posted by Miriam Schneider, Google for Education team",1,1,1
"Posted by Mingxing Tan, Staff Software Engineer and Quoc V. Le, Principal Scientist, Google AI",1,1,1
"Posted by Mingxing Tan, Software Engineer, Google Brain Team",1,1,1
"Posted by Mingxing Tan, Software Engineer and Adams Yu, Research Scientist, Google Research",1,1,1
"Posted by Mingxing Tan and Zihang Dai, Research Scientists, Google Research",1,1,1
"Posted by Ming-Wei Chang and Kelvin Guu, Research Scientists, Google Research",1,1,1
"Posted by Mike Tyka, Software Engineer",1,1,1
