Contributor,Title,Date,Link
"Posted by Elaine Kao, Education Program Manager",1,1,1
"Posted by Elad Hazan and Yoram Singer, Research Scientists, Google AI and Princeton University",1,1,1
"Posted by Ekin Dogus Cubuk, Google AI Resident and Barret Zoph, Research Scientist, Google Brain Team",1,1,1
"Posted by Ehsan Amid, Student Researcher and Rohan Anil, Software Engineer, Google Research",1,1,1
"Posted by Eduard Trulls, Research Scientist, Google Maps",1,1,1
"Posted by Dumitru Erhan, Gentleman Scientist",1,1,1
"Posted by Dr. Stacey Gabriel, Director of the Genomics Platform at the Broad Institute of MIT and Harvard",1,1,1
"Posted by Dr. Robert Rohde, Berkeley Earth",1,1,1
"Posted by Dr. Kyle Ellrott, Oregon Health and Sciences University, Dr. Josh Stuart, University of California Santa Cruz, and Dr. Paul Boutros, Ontario Institute for Cancer Research",1,1,1
"Posted by Douglas Eck, Research Scientist",1,1,1
"Posted by Doug Grundman, Maps Anti-Abuse, and Kurt Thomas, Security & Anti-Abuse Research",1,1,1
"Posted by Doug Eck, Research Scientist, Google Brain Team",1,1,1
"Posted by Dmitriy Genzel, Software Engineer",1,1,1
"Posted by Dmitriy Genzel and Ashok Popat, Research Scientists and Dhyanesh Narayanan, Product Manager",1,1,1
"Posted by Diego Martin Arroyo, Software Engineer and Federico Tombari, Research Scientist, Google Research",1,1,1
"Posted by Dharshan Kumaran and Demis Hassabis, Google DeepMind, London",1,1,1
"Posted by Derek Murray, Software Engineer",1,1,1
"Posted by Dennis Abts, Michael R. Marty, Philip M. Wells, Peter Klausler, and Hong Liu",1,1,1
"Posted by Deirdre O'Brien and Diane Tang, Adwords Team",1,1,1
"Posted by Debidatta Dwibedi, Research Scientist, Robotics at Google",1,1,1
"Posted by Debidatta Dwibedi, Research Associate, Google Research",1,1,1
"Posted by David Weiss and Slav Petrov, Research Scientists",1,1,1
"Posted by David So, Software Engineer, Google AI",1,1,1
"Posted by David Silver and Demis Hassabis, Google DeepMind",1,1,1
"Posted by David Konerding, Staff Software Engineer",1,1,1
"Posted by David Harper, University Relations and Beate List, Research Programs",1,1,1
"Posted by David Harper, Head of University Relations, EMEA",1,1,1
"Posted by David Harper, Google University Relations & Beate List, Google Research Programs",1,1,1
"Posted by David Ha, Staff Research Scientist and Yujin Tang, Research Software Engineer, Google Research, Tokyo",1,1,1
"Posted by David Ha, Google Brain Resident",1,1,1
"Posted by David Chan, Statistician and Lizzy Van Alstine, Research Evangelist",1,1,1
"Posted by David Chan and Lizzy Van Alstine, Quantitative Management Team",1,1,1
"Posted by Dave Thau, Senior Developer Advocate",1,1,1
"Posted by Dave Thau, Developer Advocate for Google Earth Engine and Karin Tuxen-Bettman, Program Manager, Google Earth Outreach",1,1,1
"Posted by Dave Steiner, MD, Research Scientist and Shravya Shetty, Technical Lead, Google Health",1,1,1
"Posted by Dave Orr, Product Manager, and Ciprian Chelba, Research Scientist",1,1,1
"Posted by Dave Orr, Product Manager, Google Research",1,1,1
"Posted by Dave Orr, Google Research Product Manager",2,2,2
"Posted by Dave Orr, Amar Subramanya, and Fernando Pereira, Google Research",1,1,1
"Posted by Dave Orr, Amar Subramanya, Evgeniy Gabrilovich, and Michael Ringgaard, Google Research",1,1,1
"Posted by Dave Epstein, Student Researcher and Chen Sun, Staff Research Scientist, Google Research",1,1,1
"Posted by Danijar Hafner, Student Researcher, Google Research",2,2,2
"Posted by Danijar Hafner, Student Researcher, Google AI",1,1,1
"Posted by Daniel Wolf, Software Engineer",1,1,1
Posted by Daniel Smilkov and the Big Picture group,1,1,1
"Posted by Daniel Seita, Research Intern and Andy Zeng, Research Scientist, Robotics at Google",1,1,1
"Posted by Daniel S. Park, AI Resident and William Chan, Research Scientist",1,1,1
"Posted by Daniel Russell, Über Tech Lead for Search Quality and User Happiness",1,1,1
"Posted by Daniel Ramage, Research Scientist and Stefano Mazzocchi, Software Engineer, Google Research",1,1,1
"Posted by Daniel J. Mankowitz, Research Scientist, DeepMind and Gabriel Dulac-Arnold, Research Scientist, Google Research",1,1,1
"Posted by Daniel Freedman and Ehud Rivlin, Research Scientists, Google Health",1,1,1
"Posted by Daniel Ford, Senior Mathematician",1,1,1
Posted by Daniel Ford and Josh Batson,1,1,1
"Posted by Daniel Adiwardana, Senior Research Engineer, and Thang Luong, Senior Research Scientist, Google Research, Brain Team",1,1,1
"Posted by Dana Alon and Jeongwoo Ko, Software Engineers, Google Research",1,1,1
"Posted by Dan Vanderkam, Software Engineer",1,1,1
"Posted by Dan Russell, Uber Tech Lead, Search Quality & User Happiness and Maggie Johnson, Director of Education and University Relations",1,1,1
"Posted by Dan Russell, Uber Tech Lead, Search Quality & User Happiness",1,1,1
"Posted by Dan Gillick, Research Scientist, and Dave Orr, Product Manager",1,1,1
"Posted by Dan Ellis, Research Scientist, Sound Understanding Team",1,1,1
"Posted by Dan Clancy, Director of Research",1,1,1
"Posted by Dan Belov, Principal Engineer and David Konerding, Software Engineer",1,1,1
"Posted by Dami Choi, Student Researcher and George Dahl, Senior Research Scientist, Google Research",1,1,1
"Posted by Crystal Davis, Director of Global Forest Watch, the World Resources Institute, and Dave Thau, Developer Advocate, Google Earth Engine",1,1,1
"Posted by Craig Citro, Software Engineer",1,1,1
"Posted by Corinna Cortes, Head, Google Research NY",2,2,2
"Posted by Corinna Cortes, Head of Google Research NY and Cong Yu, Research Scientist",1,1,1
"Posted by Corinna Cortes, Google Research",1,1,1
"Posted by Corinna Cortes, Boulos Harb, Afshin Rostamizadeh, Ken Wilder, and Cong Yu, Google Research",1,1,1
"Posted by Corinna Cortes and Alfred Spector, Google Research",5,5,5
"Posted by Colin Evans and Dayu Yuan, Software Engineers",1,1,1
"Posted by Ciprian Chelba, Research Team",1,1,1
"Posted by Ciprian Chelba, Research Scientist",2,2,2
"Posted by Cibu Johny, Software Engineer, Google Research and Saumya Dalal, Product Manager, Google Geo",1,1,1
"Posted by Chunhui Gu & David Ross, Software Engineers",1,1,1
"Posted by Chun-Liang Li and Kihyuk Sohn, Research Scientists, Google Cloud",1,1,1
"Posted by Chuck Rosenberg, Image Search Team",1,1,1
"Posted by Christopher Olah, Research Scientist, Google Brain Team and Alex Mordvintsev, Research Scientist, Google Research",1,1,1
"Posted by Christopher Fifty, Research Engineer, Google Research, Brain Team",1,1,1
"Posted by Christopher Alberti and Michiel Bacchiani, Google Research",1,1,1
"Posted by Christophe Bisciglia, Senior Software Engineer, and Alfred Spector, Vice President of Research",1,1,1
"Posted by Christine Kaeser-Chen, Software Engineer and Serge Belongie, Visiting Faculty, Google Research",1,1,1
"Posted by Christine Kaeser-Chen, Software Engineer and Serge Belongie, Visiting Faculty, Google AI",1,1,1
"Posted by Christian Szegedy, Software Engineer",1,1,1
"Posted by Christian Stefansen, Senior Software Engineer",1,1,1
"Posted by Christian Howard, Google Research",1,1,1
"Posted by Christian Howard, Editor-in-Chief, Research Communications",4,4,4
"Posted by Christian Howard, Editor-in-Chief, Google AI Communications",3,3,3
"Posted by Christian Frank, Google Research, Zürich",1,1,1
"Posted by Chris Stephenson, Head of Computer Science Education Strategy",1,1,1
"Posted by Chris Stephenson, Head of Computer Science Education Programs at Google, and Joyce Malyn-Smith, Managing Project Director at Education Development Center (EDC)",1,1,1
"Posted by Chris Stephenson, Head of Computer Science Education Programs",2,2,2
"Posted by Chris Stephenson, Computer Science Education Program Manager",1,1,1
"Posted by Chris Shallue, Software Engineer, Google Brain Team",1,1,1
"Posted by Chris Shallue, Senior Software Engineer, Google Brain Team",1,1,1
"Posted by Chris Shallue, Senior Software Engineer and George Dahl, Senior Research Scientist, Google AI",1,1,1
"Posted by Chris Reid, Sydney Staffing team",1,1,1
"Posted by Chris Olston, Research Scientist, and Noah Fiedel, Software Engineer, TensorFlow Serving",1,1,1
"Posted by Chris Olah, Research Scientist and Arvind Satyanarayan, Visiting Researcher, Google Brain Team",1,1,1
"Posted by Chris Olah, Google Research",1,1,1
"Posted by Chris Herwig, Program Manager, Google Earth Engine",1,1,1
"Posted by Chris Alberti, Dave Orr & Slav Petrov, Google Natural Language Understanding Team",1,1,1
"Posted by Chong Wang, Research Scientist, Google AI",1,1,1
"Posted by Chinmay Kulkarni, Stanford University Ph.D candidate and former Google Intern, and Ed H. Chi, Google Research Scientist",1,1,1
"Posted by Chia-Kai Liang, Senior Staff Software Engineer and Fuhao Shi, Android Camera Team",1,1,1
"Posted by Chi Zeng and Justine Tunney, Software Engineers, Google Brain Team",1,1,1
"Posted by Chen Sun and Cordelia Schmid, Research Scientists, Google Research",1,1,1
"Posted by Chen Liang and Yifeng Lu, Software Engineers, Google Research, Brain Team",1,1,1
"Posted by Chase Roberts, Research Engineer, Google AI and Stefan Leichenauer, Research Scientist, X",1,1,1
"Posted by Charles Weill, Software Engineer, Google AI, NYC",1,1,1
"Posted by Charles Neill and Zhang Jiang, Senior Research Scientists, Google Quantum AI",1,1,1
"Posted by Charles DuHadway, YouTube Slam Team, Google Research",1,1,1
"Posted by Charles DuHadway and Sanketh Shetty, Google Research",1,1,1
"Posted by Chao Jia and Yinfei Yang, Software Engineers, Google Research",1,1,1
"Posted by Chao Chen, Software Engineer, Google Research",1,1,1
"Posted by Ce Liu, Michael Rubinstein, Mike Krainin and Bill Freeman, Research Scientists",1,1,1
"Posted by Catherine Armato, Program Manager",1,1,1
"Posted by Catherine Armato, Google Research",1,1,1
"Posted by Catherina Xu and Tulsee Doshi, Product Managers, Google Research",1,1,1
"Posted by Cat Armato, Program Manager, Google Research",1,1,1
"Posted by Cat Armato and Jaqui Herman, Program Managers",1,1,1
"Posted by Cat Armato and Emily Knapp, Program Managers",1,1,1
"Posted by Cassidy Curtis, Visual Designer and David Salesin, Principal Scientist, Google Research",1,1,1
"Posted by Carrie J. Cai, Senior Research Scientist, Google Research and Philip J. Guo, Assistant Professor, UC San Diego",1,1,1
"Posted by Carlos Hernández, Software Engineer",1,1,1
"Posted by Carl Vondrick, Research Scientist, Machine Perception",1,1,1
"Posted by Candice Schumann and Susanna Ricco, Software Engineers, Google Research",1,1,1
"Posted by Candice Reimers, Senior Program Manager",1,1,1
"Posted by Cameron Fadjo, Program Lead, Computer Science Teaching Fellows",1,1,1
"Posted by Cam Askew and André Araujo, Software Engineers, Google Research",1,1,1
"Posted by C. Daniel Freeman, Senior Software Engineer and Erik Frey, Staff Software Engineer, Google Research",1,1,1
"Posted by Bryan Perozzi, Research Scientist, NYC Algorithms and Optimization Team",1,1,1
"Posted by Brian Strope, Research Scientist, and Ray Kurzweil, Engineering Director, Google Research",1,1,1
"Posted by Brian Bershad, Director of Engineering, Site Director, Google Seattle",1,1,1
"Posted by Brendan McMahan and Daniel Ramage, Research Scientists",1,1,1
"Posted by Brad Chen, Technical Lead/Manager",1,1,1
"Posted by Bowen Cheng, Student Researcher and Liang-Chieh Chen, Research Scientist, Google Research",1,1,1
"Posted by Bogdan Arsintescu, Software Engineer & Sreenivas Gollapudi, Kostas Kollias, Tamas Sarlos and Andrew Tomkins, Research Scientists",1,1,1
"Posted by Bo Chen, Software Engineer and Jeffrey M. Gilbert, Member of Technical Staff, Google Research",1,1,1
"Posted by Bingyi Cao and Tobias Weyand, Software Engineers, Google AI",1,1,1
"Posted by Bill Magnuson, Hal Abelson, and Mark Friedman",1,1,1
"Posted by Bill Coughran, Senior Vice President of Engineering",1,1,1
"Posted by Bill Byrne and Filip Radlinski, Research Scientists, Google Research",1,1,1
"Posted by Beryl Nelson, Software Engineering Manager",1,1,1
"Posted by Benjamin Yolken, Google Public Data Product Manager",1,1,1
"Posted by Benjamin Eysenbach, Student Researcher, Google Research",1,1,1
"Posted by Ben Bayer, Google Research",1,1,1
"Posted by Behnam Bastani, Software Engineer Manager and Eric Turner, Software Engineer, Daydream",1,1,1
"Posted by Bartlomiej Wronski, Software Engineer and Peyman Milanfar, Lead Scientist, Computational Imaging",1,1,1
"Posted by Barret Zoph, Vijay Vasudevan, Jonathon Shlens and Quoc Le, Research Scientists, Google Brain Team",1,1,1
"Posted by Badih Ghazi and Joshua R. Wang, Research Scientists, Google Research",1,1,1
"Posted by Avinava Dubey, Research Scientist, Google Research",1,1,1
"Posted by Aurko Roy, Research Scientist, Google Research",1,1,1
"Posted by Asim Shankar and Wolff Dobson, Google Brain Team",1,1,1
"Posted by Ashok C. Popat, Research Scientist",1,1,1
"Posted by Ashish Venugopal, Research Scientist",2,2,2
"Posted by Aseem Agarwala, Research Scientist, Clips Content Team Lead",1,1,1
"Posted by Artsiom Ablavatski and Marat Dukhan, Software Engineers, Google Research",1,1,1
"Posted by Artsiom Ablavatski and Ivan Grishchenko, Research Engineers, Google AI",1,1,1
"Posted by Artem Dementyev, Hardware Engineer, Google Research",2,2,2
"Posted by Arindrima Datta and Anjuli Kannan, Software Engineers, Google Research",1,1,1
"Posted by Archit Sharma, AI Resident, Google Research",1,1,1
"Posted by Anurag Batra and Parker Barnes, Product Managers, Google AI",1,1,1
"Posted by Anton Tsitsulin, Research Intern and Bryan Perozzi, Senior Research Scientist, Graph Mining Team, Google Research",1,1,1
"Posted by Anton Mikhailov, Senior Software Engineer, Daydream",1,1,1
"Posted by Anthony Francis, Software Engineer and Alexander Toshev, Staff Research Scientist, Google Research",1,1,1
"Posted by Anne Aula, Rehan Khan, and Zhiwei Guan, User Experience Team",1,1,1
"Posted by Anna Ukhanova, Technical Program Manager, Google Research Europe",1,1,1
"Posted by Anna Ukhanova, Program Manager, Google AI Zürich",1,1,1
"Posted by Anna Goldie, Senior Software Engineer and Azalia Mirhoseini, Senior Research Scientist, Google Research, Brain Team",1,1,1
"Posted by Anna Goldie and Denny Britz, Research Software Engineer and Google Brain Resident, Google Brain Team",1,1,1
"Posted by Ankur Parikh and Xuezhi Wang, Research Scientists, Google Research",1,1,1
"Posted by Ankur Bapna, Software Engineer and Orhan Firat, Research Scientist, Google Research",1,1,1
"Posted by Anelia Angelova, Research Scientist, Robotics at Google",1,1,1
"Posted by Andy Zeng, Student Researcher, Robotics at Google",1,1,1
"Posted by Andy Zeng and Pete Florence, Research Scientists, Robotics at Google",1,1,1
Posted by Andy Connolly and Ryan Scranton,1,1,1
"Posted by André Araujo and Tobias Weyand, Software Engineers, Google Research",1,1,1
"Posted by Andrey Vakunov and Dmitry Lagun, Research Engineers, Google Research",1,1,1
"Posted by Andrew Zaldivar, Responsible AI Advocate, Google Research, on behalf of the TFCO Team",1,1,1
"Posted by Andrew W. Moore, Director, Google Commerce and Site Director, Pittsburgh",1,1,1
"Posted by Andrew Tomkins, Director of Engineering, Google Research",1,1,1
"Posted by Andrew Tomkins, Director of Engineering and William D. Heavlin, Statistician, Google Research",1,1,1
"Posted by Andrew Schwerin, Software Engineer",1,1,1
"Posted by Andrew Poon, Senior Software Engineer and Dhyanesh Narayanan, Product Manager, Google AI Perception",1,1,1
"Posted by Andrew Howard and Suyog Gupta, Software Engineers, Google Research",1,1,1
"Posted by Andrew Helton, Editor, Google Research Communications",2,2,2
"Posted by Andrew Helton, Editor, Google AI Communications",2,2,2
"Posted by Andrew G. Howard, Senior Software Engineer and Menglong Zhu, Software Engineer",1,1,1
"Posted by Andrew Carroll, Product Manager and Cory McLean, Software Engineer, Google Health",1,1,1
"Posted by Andrew Carroll, Product Lead and Pi-Chuan Chang, Technical Lead, Google Health",1,1,1
"Posted by Andrei Broder, Google Distinguished Scientist",1,1,1
"Posted by Andrea Held, University Relations",1,1,1
"Posted by Andrea Held, Program Manager, University Relations",1,1,1
"Posted by Andrea Held, Google University Relations & Matt Cooke, Google News Lab Europe",1,1,1
"Posted by Andrea Held, Google University Relations",1,1,1
"Posted by Andrea Cohan, Google Science Fair Program Manager",1,1,1
"Posted by Andeep Singh Toor, Stadia Software Engineer and Fred Bertsch, Software Engineer, Google Research, Brain Team",1,1,1
"Posted by Ananth Balashankar & Levent Koc, Software Engineers, and Norberto Guimaraes, Product Manager",1,1,1
"Posted by Amy McDonald Sandjideh, Technical Program Manager, TensorFlow",1,1,1
"Posted by Amit Moryossef, Research Intern, Google Research",1,1,1
"Posted by Amir Yazdanbakhsh, Research Scientist, Google Research",1,1,1
"Posted by Amir Yazdanbakhsh, Research Scientist and Junchao Chen, Software Engineer, Google Research",1,1,1
"Posted by Amin Vahdat, Google Fellow",1,1,1
"Posted by Amanda Camp, Software Engineer",1,1,1
"Posted by Alvin Rajkomar, MD and Eyal Oren, PhD, Google AI, Healthcare",1,1,1
"Posted by Alvin Rajkomar MD, Research Scientist and Eyal Oren PhD, Product Manager, Google AI",1,1,1
"Posted by Alon Halevy, Senior Staff Research Scientist",1,1,1
"Posted by Alon Halevy, Google Research and Rebecca Shapley, User Experience",2,2,2
"Posted by Allison Mooney, Christina Park, and Caroline McCarthy, The Think Quarterly Team",1,1,1
"Posted by Allen Hutchison, Engineering Manager",2,2,2
"Posted by Alison Cichowlas and Tony Lam, Google Research",1,1,1
"Posted by Alisa Chang, Software Engineer, Google Cloud and Pritish Kamath, Research Scientist, Google Research",1,1,1
"Posted by Alireza Fathi, Research Scientist and Rui Huang, AI Resident, Google Research",1,1,1
"Posted by Ali Mousavi, AI Resident and Lihong Li, Research Scientist, Google Research",1,1,1
"Posted by Ali Kemal Sinop, Senior Research Scientist, Google Research and Mahmuda Ahmed, Senior Software Engineer, Google Maps",1,1,1
"Posted by Alfred Spector, Vice President, Research",1,1,1
"Posted by Alfred Spector, Vice President, Engineering",3,3,3
"Posted by Alfred Spector, Vice President of Research and Special Initiatives",4,4,4
"Posted by Alfred Spector, VP of Research and Special Initiatives",1,1,1
"Posted by Alfred Spector, VP of Research",4,4,4
"Posted by Alfred Spector, VP of Engineering",1,1,1
"Posted by Alfred Spector, VP Research and Special Initiatives and Maggie Johnson, Director of Education and University Relations",1,1,1
"Posted by Alfred Spector, VP Research and Special Initiatives",1,1,1
"Posted by Alfred Spector, Google Research",1,1,1
"Posted by Alexey Dosovitskiy, Research Scientist, Google Research",1,1,1
"Posted by Alexander Mordvintsev, Software Engineer, Christopher Olah, Software Engineering Intern and Mike Tyka, Software Engineer",2,2,2
"Posted by Alexander Ku, Software Engineer and Peter Anderson, Research Scientist, Google Research",1,1,1
"Posted by Alexander Gutkin, Software Engineer, Google AI",1,1,1
"Posted by Alexander Gutkin, Google Speech Team",1,1,1
"Posted by Alexander B Wiltschko, Senior Research Scientist, Google Research",1,1,1
"Posted by Alex Wiltschko, Research Scientist, Google Brain Team",1,1,1
"Posted by Alex Ratner, Stanford University and Cassandra Xia, Google AI",1,1,1
"Posted by Alex Olwal, Research Scientist, Google Research",1,1,1
"Posted by Alex Kauffmann, Interaction Researcher, and Boris Smus, Software Engineer",1,1,1
"Posted by Alex Kauffmann, Interaction Researcher, Google Research",1,1,1
"Posted by Alex Franz and Thorsten Brants, Google Machine Translation Team",1,1,1
"Posted by Alex Fabrikant, Research Scientist, Google Research",1,1,1
"Posted by Alex D’Amour and Katherine Heller, Research Scientists, Google Research",1,1,1
"Posted by Alex Alemi, Software Engineer",1,1,1
"Posted by Alessandro Epasto, Senior Research Scientist and Bryan Perozzi, Senior Research Scientist, Graph Mining Team",1,1,1
"Posted by Alessandro Epasto, Research Scientist, Google Research NY",1,1,1
"Posted by Alejandro Luebs, Software Engineer and Jamieson Brettle, Product Manager, Chrome",1,1,1
"Posted by Alan Ho, Product Lead and Masoud Mohseni, Technical Lead, Google Research",1,1,1
"Posted by Alan Ho, Product Lead and Dave Bacon, Software Lead, Google AI Quantum Team",1,1,1
"Posted by Alan Cowen, Visiting Researcher and Gautam Prasad, Software Engineer, Google Research",1,1,1
"Posted by Aimin Zhu, University Relationship Manager, Google China",1,1,1
"Posted by Aimin Zhu, China University Relations",1,1,1
"Posted by Afshin Rostamizadeh, Research Scientist",1,1,1
"Posted by Afshin Rostamizadeh, Google Research",1,1,1
"Posted by Aditya Gupta, Software Engineer and Shyam Upadhyay, Research Scientist, Google Assistant",1,1,1
"Posted by Adel Ahmadyan and Tingbo Hou, Software Engineers, Google Research",1,1,1
"Posted by Adel Ahmadyan and Liangkai Zhang, Software Engineers, Google Research",1,1,1
"Posted by Adam Sadilek, Software Engineer and Xerxes Dotiwalla, Product Manager, Google Research",1,1,1
"Posted by Adam Roberts, Staff Software Engineer and Colin Raffel, Senior Research Scientist, Google Research",1,1,1
"Posted by Adam Grunewald, Mobile Marketing Manager",1,1,1
"Posted by Adam Gaier, Student Researcher and David Ha, Staff Research Scientist, Google Research, Tokyo",1,1,1
"Posted by Adam Feldman, Product Manager and Pavel Simakov, Technical Lead, Course Builder Team",4,4,4
"Posted by Abhinav Rastogi, Software Engineer and Pranav Khaitan, Engineering Lead, Google Research",1,1,1
"Posted by Abhinav Gupta, Faculty Advisor, Machine Perception",1,1,1
"Posted by AJ Maschinot, Senior Software Engineer and Jenny Huang, Product Manager, Google Research",1,1,1
Posted by,9,9,9
"Posted Vint Cerf, Chief Internet Evangelist, and Max Senges, Google Research",1,1,1
"Posted Vint Cerf, Chief Internet Evangelist, Roy Want and Max Senges, Google Research",1,1,1
"Posted By Johnny Chen, Product Manager, Google Research",1,1,1
"Posted Alex Irpan, Software Engineer, Google Brain Team and Peter Pastor, Senior Roboticist, X",1,1,1
"Parisa Tabriz, Security Princess & Enigma Program Co-Chair",1,1,1
"Nithya Sambasivan, Research Scientist, Google Research",1,1,1
"Michel Benard, University Relations Manager",1,1,1
"Hanie Sedghi, Google Research and Preetum Nakkiran, Harvard University",1,1,1
"Google Engineers Christian Szegedy, Scott Reed",1,1,1
"Eve Andersson, Manager, Accessibility Engineering",1,1,1
"Erin Mindell, Program Manager, Google Education",1,1,1
"Eric Christiansen, Senior Software Engineer, Google Research",1,1,1
"Ed H. Chi, Staff Research Scientist",1,1,1
"Daniel Ho, Software Engineer, The Everyday Robot Project and Kanishka Rao, Staff Software Engineer, Robotics at Google",1,1,1
"By Maggie Johnson, Director of Education and University Relations and Chris Busselle, Google.org",1,1,1
"By Andrea Held, Program Manager, Google University Relations",1,1,1
By,1,1,1
"Arno Eigenwillig, Software Engineer on Google Maps Directions",1,1,1
"Arnab Bose and Yuheng Kuang, Staff Software Engineers, Robotics at Google",1,1,1
"Andrew Helton, Editor, Google Research Communications",2,2,2
"Andreas Terzis, Software Engineer",1,1,1
"Aleksandra Faust, Senior Research Scientist and Anthony Francis, Senior Software Engineer, Robotics at Google",1,1,1
,9,9,9
