Contributor,Title,Date,Link
"Posted by Mike Schuster, Google Research and Kaisuke Nakajima, Google Japan",1,1,1
"Posted by Mike Schuster (Google Brain Team), Melvin Johnson (Google Translate) and Nikhil Thorat (Google Brain Team)",1,1,1
"Posted by Mike Schuster & Martin Jansche, Google Research",1,1,1
"Posted by Mike Schuster & Kaisuke Nakajima, Google Research",1,1,1
"Posted by Mike Krainin, Software Engineer and Ce Liu, Research Scientist, Machine Perception",1,1,1
"Posted by Mike Belshe, Software Engineer and Roberto Peon, Software Engineer",1,1,1
"Posted by Michelle Tadmor-Ramanovich and Nadav Bar, Senior Software Engineers, Google Research, Tel-Aviv",1,1,1
"Posted by Michelle Chen Huebscher, Software Engineer and Rodrigo Nogueira, New York University PhD Student and Software Engineering Intern, Google AI Language",1,1,1
"Posted by Michele Covell, Vision Research Team",1,1,1
"Posted by Michele Covell, Research Scientist, Google Research",1,1,1
"Posted by Michele Covell & Shumeet Baluja, Research Scientists",1,1,1
"Posted by Michel Benard, University Relations Manager and Cova Soto, Product Marketing Manager, Business Marketing Madrid",1,1,1
"Posted by Michal Januszewski, Software Engineer and Viren Jain, Research Scientist and Technical Lead, Connectomics at Google",1,1,1
"Posted by Michael Schoenberg, uDepth Software Lead and Adarsh Kowdle, uDepth Hardware/Systems Lead, Google Research",1,1,1
"Posted by Michael S. Ryoo, Research Scientist and AJ Piergiovanni, Student Researcher, Robotics at Google",1,1,1
"Posted by Michael Ringgaard, Software Engineer and Rahul Gupta, Research Scientist",1,1,1
"Posted by Michael Rennaker, Program Manager, University Relations",1,1,1
"Posted by Michael Rennaker, Program Manager",1,1,1
"Posted by Michael Rennaker, Google University Relations",3,3,3
"Posted by Michael Rennaker, Google PhD Fellowships Lead",1,1,1
"Posted by Michael Dixon, Software Engineer and Reena Singhal Lee, Product Manager, Google Health",2,2,2
"Posted by Michael Bendersky and Xuanhui Wang, Software Engineers, Google Research",1,1,1
"Posted by Michael Ahn, Software Engineer and Vikash Kumar, Research Scientist, Robotics at Google",1,1,1
"Posted by Melvin Johnson, Senior Software Engineer, Google Translate",1,1,1
"Posted by Melvin Johnson, Senior Software Engineer, Google Research and Sebastian Ruder, Research Scientist, DeepMind",1,1,1
"Posted by Melvin Johnson, Senior Software Engineer, Google Research",1,1,1
Posted by Melody Pound and Lauren Jones,1,1,1
"Posted by Mei Han and Sergey Ioffe, Research Team",1,1,1
"Posted by Maya Gupta, Research Scientist, Jan Pfeifer, Software Engineer and Seungil You, Software Engineer",1,1,1
"Posted by Mauricio Delbracio, Research Scientist and Sungjoon Choi, Software Engineer, Google Research",1,1,1
"Posted by Matthias Grundmann, Vivek Kwatra, and Irfan Essa, Research at Google",1,1,1
"Posted by Matthias Grundmann, Research Scientist and Jianing Wei, Software Engineer, Google Research",1,1,1
"Posted by Matthias Grundmann and Vivek Kwatra, Google Research",1,1,1
"Posted by Matthias Grundmann and Ken Conley, Machine Perception",1,1,1
"Posted by Matthew Burgess and Natasha Noy, Google AI",1,1,1
"Posted by Matt Mohebbi, Software Engineer",1,1,1
"Posted by Matt Harvey, Software Engineer, Google AI Perception",1,1,1
"Posted by Matt Hansen and Peter Potapov, University of Maryland; Rebecca Moore and Matt Hancher, Google",1,1,1
"Posted by Massimiliano Ciaramita, Research Scientist and David Harper, Head University Relations (EMEA)",1,1,1
"Posted by Maryam Kamvar, Melanie Kellar, Rajan Patel and Ya Xu, Google Research",1,1,1
"Posted by Martin Stumpe, Technical Lead, and Lily Peng, Product Manager",1,1,1
"Posted by Martin Stumpe, Technical Lead and Craig Mermel, Product Manager, Healthcare, Google AI",2,2,2
"Posted by Martin Stumpe, Technical Lead and Craig Mermel, Product Manager, Google Brain Team",1,1,1
"Posted by Martin Mladenov, Research Scientist and Chih-wei Hsu, Software Engineer, Google Research",2,2,2
"Posted by Martin Jansche, Software Engineer, Google Research for Low Resource Languages",1,1,1
"Posted by Martin Jansche and Alex Salcianu, Google Speech Team",1,1,1
"Posted by Mark Sandler and Andrew Howard, Google Research",1,1,1
"Posted by Mark Díaz and Emily Denton, Research Scientists, Google Research, Ethical AI Team",1,1,1
"Posted by Mark DePristo and Ryan Poplin, Google Brain Team",1,1,1
"Posted by Mario Lučić, Research Scientist and Marvin Ritter, Software Engineer, Google AI Zürich",1,1,1
"Posted by Marianna Dizik, Statistician",1,1,1
"Posted by Marco Tagliasacchi, Research Scientist, Google Research",1,1,1
"Posted by Marco Cuturi and Jean-Philippe Vert, Research Scientists, Google Research, Brain Team",1,1,1
"Posted by Marc van Zee, Software Engineer, Google Research",1,1,1
"Posted by Marc Pickett, Software Engineer, Chris Tar, Engineering Manager and Brian Strope, Research Scientist",1,1,1
"Posted by Marc Levoy, Principal Engineer and Yael Pritch, Software Engineer",1,1,1
"Posted by Marc Levoy, Google[x] Software Engineering Manager and",1,1,1
"Posted by Marc Levoy, Distinguished Engineer and Yael Pritch, Staff Software Engineer",1,1,1
"Posted by Manfred Ernst and Bartlomiej Wronski, Software Engineers, Google Research",1,1,1
"Posted by Manaal Faruqui, Senior Research Scientist and Emily Pitler, Staff Research Scientist, Google AI Language",1,1,1
"Posted by Malay Haldar, Matt MacMahon, Neha Jha and Raj Arasu, Software Engineers",1,1,1
"Posted by Maithra Raghu, Google Brain Team and Ari S. Morcos, DeepMind",1,1,1
"Posted by Maithra Raghu, Google Brain Team",1,1,1
"Posted by Maithra Raghu and Chiyuan Zhang, Research Scientists, Google Research",1,1,1
"Posted by Maggie Johnson, Vice President of Education and University Relations, Google",1,1,1
"Posted by Maggie Johnson, VP, Google Research",1,1,1
"Posted by Maggie Johnson, VP, Education and Negar Saei, Program Manager, University Relations",1,1,1
"Posted by Maggie Johnson, VP and Negar Saei, Program Manager, Google Research",1,1,1
"Posted by Maggie Johnson, Director of Education, University Relations",1,1,1
"Posted by Maggie Johnson, Director of Education and University Relations, and Aimin Zhu, University Relations Manager, APAC",1,1,1
"Posted by Maggie Johnson, Director of Education and University Relations, Google",5,5,5
"Posted by Maggie Johnson, Director of Education and University Relations and Andrea Held, University Relations Program Manager",1,1,1
"Posted by Maggie Johnson, Director of Education and University Relations",19,19,19
"Posted by Maggie Johnson, Director of Education & University Relations and Jeff Walz, Head of University Relations",1,1,1
"Posted by Maggie Johnson, Director of Education & University Relations",7,7,7
"Posted by Maarten Bosma, Research Engineer and Jason Wei, AI Resident, Google Research",1,1,1
"Posted by Lusann Yang, Software Engineer, Google Research, Applied Science Team",1,1,1
"Posted by Luke Metz, Research Associate and Yun Liu, Software Engineer, 2016 Google Brain Resident Alumni",1,1,1
"Posted by Lukas Zilka, Software Engineer, Google AI, Zürich",1,1,1
"Posted by Lucas Beyer and Alexander Kolesnikov, Research Engineers, Google Research, Zürich",1,1,1
"Posted by Luc Vincent, Engineering Director, Geo Imagery",1,1,1
"Posted by Lu Jiang, Senior Research Scientist and Weilong Yang, Senior Staff Software Engineer, Google Research",1,1,1
"Posted by Lora Aroyo and Praveen Paritosh, Research Scientists, Google Research",1,1,1
"Posted by Lizzy Van Alstine, Research Evangelist and David Chan, Statistician",1,1,1
"Posted by Lizzy Van Alstine and Jon Vaver, Quantitative Analysis Team",1,1,1
"Posted by Linne Ha, Senior Program Manager, Google Research for Low Resource Languages",1,1,1
"Posted by Lily Peng MD PhD, Product Manager, Google Brain Team",1,1,1
"Posted by Lily Peng MD PhD, Product Manager and Varun Gulshan PhD, Research Engineer",1,1,1
"Posted by Lilly Irani & Jens Riegelsberger, User Experience team",1,1,1
"Posted by Liang-Chieh Chen and Yukun Zhu, Software Engineers, Google Research",1,1,1
"Posted by Li Zhang and Wei (Alex) Hong, Software Engineers",1,1,1
"Posted by Leslie Yeh Johnson, University Relations Manager",2,2,2
"Posted by Leslie Yeh Johnson, University Relations",1,1,1
"Posted by Leslie Yeh Johnson, Google University Relations",2,2,2
"Posted by Leopold Haller and Hernan Moraldo, Software Engineers, Google Research",1,1,1
"Posted by Le Hou and Youlong Cheng, Software Engineers, Google Research",1,1,1
"Posted by Laurent El Shafey, Software Engineer and Izhak Shafran, Research Scientist, Google Health",1,1,1
"Posted by Lasse Espeholt, Research Engineer, Google Research, Amsterdam",1,1,1
"Posted by Kurt Thomas and Yuan Niu, Spam & Abuse Research",1,1,1
"Posted by Kurt Konolige, Software Engineer, Robotics at Google",1,1,1
"Posted by Krzysztof Choromanski and Lucy Colwell, Research Scientists, Google Research",1,1,1
"Posted by Krishna Srinivasan, Software Engineer and Karthik Raman, Research Scientist, Google Research",1,1,1
"Posted by Krishna Bharat, Distinguished Research Scientist",1,1,1
"Posted by Kostas Kollias and Sreenivas Gollapudi, Research Scientists, Google Research",1,1,1
"Posted by Koray Kavukcuoglu, Research Scientist, Google DeepMind",1,1,1
"Posted by Konstantinos Bousmalis, Senior Research Scientist, and Sergey Levine, Faculty Advisor, Google Brain Team",1,1,1
"Posted by Konstantin Davydov, Software Engineer and Afshin Rostamizadeh, Research Scientist",1,1,1
"Posted by Kishore Papineni, Research Scientist, Google Research NY",1,1,1
"Posted by Kevin Zakka, Research Intern and Andy Zeng, Research Scientist, Robotics at Google",1,1,1
"Posted by Kevin Murphy, Research Scientist and David Harper, Head of University Relations, EMEA",1,1,1
"Posted by Kevin Murphy, Research Scientist",1,1,1
"Posted by Kevin McCurley, Research Team",2,2,2
"Posted by Kevin Kilgour, Software Engineer and Thomas Unterthiner, Research Software Engineer, Google Research, Zürich",1,1,1
"Posted by Kevin Clark, Student Researcher and Thang Luong, Senior Research Scientist, Google Research, Brain Team",1,1,1
"Posted by Kester Tong, David Soergel, and Gus Katsiapis, Software Engineers",1,1,1
"Posted by Kenton Lee, Research Scientist and Slav Petrov, Principal Scientist, Language Team, Google AI",1,1,1
"Posted by Ken Conley and Matthias Grundmann, Machine Perception",1,1,1
"Posted by Kellie Webster, Software Engineer, Google Research",1,1,1
"Posted by Keith Hall, Research Scientist, Natural Language Understanding, Google Research",1,1,1
"Posted by Keith Hall and Richard Sproat, Staff Research Scientists, Speech",1,1,1
"Posted by Kayur Patel, Kester Tong, Mark Sandler, and Corinna Cortes, Google Research",1,1,1
"Posted by Katrin Tomanek, Software Engineer and Bob MacDonald, Technical Program Manager, Google Research",1,1,1
"Posted by Katie Meckley, Program Manager, Google AI Residency",1,1,1
"Posted by Kathryn Rough, Research Scientist and Alvin Rajkomar, MD, Google Health",1,1,1
"Posted by Katherine Chou, Product Manager and Chung-Cheng Chiu, Software Engineer, Google Brain Team",1,1,1
"Posted by Kartik Singh and Kuntal Loya, Google Scribe team",1,1,1
"Posted by Karthik Raveendran and Suril Shah, Software Engineers, Google Research",1,1,1
"Posted by Karol Kurach, Research Lead and Olivier Bachem, Research Scientist, Google Research, Zürich",1,1,1
"Posted by Karol Hausman, Senior Research Scientist and Yevgen Chebotar, Research Scientist, Robotics at Google",1,1,1
"Posted by Karen Parker, App Inventor Program Manager",1,1,1
"Posted by Julian Kelly, Research Scientist, Quantum AI Lab",1,1,1
"Posted by Julian Kelly, Rami Barends, and Austin Fowler, Quantum Electronics Engineers",1,1,1
"Posted by Julian Ibarz, Staff Software Engineer, Google Brain Team and Sujoy Banerjee, Product Manager, Ground Truth Team",1,1,1
"Posted by Julian Eisenschlos, AI Resident, Google Research, Zürich",1,1,1
"Posted by Julia Wilkowski, Staff Instructional Designer",1,1,1
"Posted by Julia Wilkowski, Senior Instructional Designer",1,1,1
"Posted by Juan Vargas,",1,1,1
"Posted by Joshua Bloch, Software Engineer",1,1,1
"Posted by Joseph Xu, Senior Software Engineer and Pranav Khaitan, Engineering Lead, Google Research",1,1,1
"Posted by Joseph L. Hellerstein, Manager of Google Performance Analytics",1,1,1
"Posted by Joseph Bardin, Visiting Faculty Researcher and Erik Lucero, Staff Research Scientist and Hardware Lead, Google AI Quantum Team",1,1,1
"Posted by Jordi Pont-Tuset, Research Scientist, Google Research",1,1,1
"Posted by Joonseok Lee, Software Engineer, Google AI",1,1,1
"Posted by Joonseok Lee and Joe Yue-Hei Ng, Software Engineers, Google Research",1,1,1
"Posted by Jonathan Shen and Ruoming Pang, Software Engineers, on behalf of the Google Brain and Machine Perception Teams",1,1,1
"Posted by Jonathan Mallinson and Aliaksei Severyn, Research Scientists, Google Research",1,1,1
"Posted by Jonathan Huang, Research Scientist and Vivek Rathod, Software Engineer, Google AI Perception",1,1,1
"Posted by Jonathan Huang, Research Scientist and Vivek Rathod, Software Engineer",1,1,1
"Posted by Jonathan Ho, Research Scientist and Chitwan Saharia, Software Engineer, Google Research, Brain Team",1,1,1
"Posted by Jonathan Clark, Research Scientist, Google Research",1,1,1
"Posted by Jonathan Bingham, Product Manager",1,1,1
"Posted by Jon Vaver, Research Scientist and Lizzy Van Alstine, Marketing Manager",1,1,1
"Posted by Jon Shlens, Senior Research Scientist",1,1,1
"Posted by Jon Orwant, Engineering Manager, Google Books",1,1,1
"Posted by Jon Orwant, Engineering Manager for Google Books",1,1,1
"Posted by Jon Orwant, Engineering Manager",5,5,5
"Posted by John Wilkes, Principal Software Engineer, Google Cloud",1,1,1
"Posted by John Wilkes, Principal Software Engineer",2,2,2
Posted by John Taylor and Kevin Serafini,1,1,1
"Posted by John Quinn, Software Engineer, Google Research, Ghana",1,1,1
"Posted by John Martinis, Chief Scientist Quantum Hardware and Sergio Boixo, Chief Scientist Quantum Computing Theory, Google AI Quantum",1,1,1
"Posted by John D. Co-Reyes, Research Intern and Yingjie Miao, Senior Software Engineer, Google Research",1,1,1
"Posted by John Cox, Software Engineer",2,2,2
"Posted by John Cox and Pavel Simakov, Course Builder Team, Google Research",1,1,1
"Posted by John Blitzer and Douglas Eck, Google Research",1,1,1
"Posted by John Atwood, Program Manager",1,1,1
"Posted by Johan Schalkwyk, Software Engineer",1,1,1
"Posted by Johan Schalkwyk, Google Research",1,1,1
"Posted by Johan Schalkwyk, Google Fellow, Speech Team",1,1,1
"Posted by Johan Ferret, Student Researcher, Google Research, Brain Team",1,1,1
"Posted by Joel Shor, Software Engineer, Google Research, Tokyo and Sachin Joglekar, Software Engineer, TensorFlow",1,1,1
"Posted by Joel Shor, Software Engineer, Google Research and Sercan Arik, Research Scientist, Google Research, Cloud AI Team",1,1,1
"Posted by Joel Shor, Software Engineer and Oran Lang, Software Engineer, Google Research, Israel",1,1,1
"Posted by Joel Shor, Senior Software Engineer, Machine Perception",1,1,1
"Posted by Joel Shor and Dotan Emanuel, Research Engineers, Google Research, Tel Aviv",1,1,1
"Posted by Jinsung Yoon and Sercan O. Arik, Research Scientists, Cloud AI Team, Google Research",1,1,1
"Posted by Jing Yu Koh, Research Engineer and Peter Anderson, Senior Research Scientist, Google Research",1,1,1
"Posted by Jimmy Chen, Quantum Research Scientist and Matt McEwen, Student Researcher, Google Quantum AI",1,1,1
"Posted by Jimbo Wilson, Software Engineer, Google Big Picture Team and Brendan Meade, Professor, Harvard Department of Earth and Planetary Sciences",1,1,1
"Posted by Jie Ren, Research Scientist, Google Research and Balaji Lakshminarayanan, Research Scientist, DeepMind",1,1,1
"Posted by Jiawen Chen and Sam Hasinoff, Software Engineers, Google Research",1,1,1
"Posted by Jianing Wei and Tyler Mullen, Software Engineers, Google Research",1,1,1
"Posted by Ji Hun Kim and Richard Wu, Software Engineers, Stadia",1,1,1
Posted by Jeremy Brewer,1,1,1
"Posted by Jennifer Vaden Barth, Executive Assistant",1,1,1
"Posted by Jennifer Kurkoski, Ph.D., Manager, People & Innovation Lab",1,1,1
"Posted by Jennifer J. Sun, Student Researcher and Ting Liu, Senior Software Engineer, Google Research",1,1,1
"Posted by Jennifer Daniel, Expressions Creative Director, Allo",1,1,1
"Posted by Jeff Walz, University Relations and Anne Bray, Head of Agency, WPP",1,1,1
"Posted by Jeff Walz, University Relations Team",1,1,1
"Posted by Jeff Walz, Head of University Relations",1,1,1
Posted by Jeff Walz and Kevin McCurley,1,1,1
Posted by Jeff Walz and Andrea Held,1,1,1
"Posted by Jeff Dean, Senior Google Fellow, and Rajat Monga, Technical Lead",1,1,1
"Posted by Jeff Dean, Senior Fellow and SVP of Google Research and Health, on behalf of the entire Google Research community",2,2,2
"Posted by Jeff Dean, Senior Fellow and Google AI Lead, on behalf of the entire Google Research Community",1,1,1
"Posted by Jeff Dean, Google Senior Fellow, on behalf of the entire Google Brain Team",3,3,3
"Posted by Jeff Dean, Google Senior Fellow, Head of Google Research and Machine Intelligence",1,1,1
"Posted by Jeff Dean, Google Senior Fellow and Leslie Phillips, Google Brain Residency Program Manager",1,1,1
"Posted by Jeff Dean, Google Senior Fellow",1,1,1
Posted by Jayant Madhavan and Alon Halevy,1,1,1
"Posted by Jay Yagnik, Head of Computer Vision Research",2,2,2
"Posted by Javier Bargas-Avila, User Experience Research at Google",1,1,1
"Posted by Javier Bargas-Avila, Senior User Experience Researcher at YouTube UX Research",2,2,2
"Posted by Javier Bargas-Avila and Mirjam Seckler, User Experience Research at Google",1,1,1
"Posted by Jasper Uijlings and Vittorio Ferrari, Research Scientists, Machine Perception",1,1,1
"Posted by Jasper Snoek, Research Scientist and Zachary Nado, Research Engineer, Google Research",1,1,1
"Posted by Jason Weston and Samy Bengio, Research Team",1,1,1
"Posted by Jason Mars, Software Engineering Intern",1,1,1
"Posted by Jason Holt, Software Engineer",1,1,1
"Posted by Jason Hickey, Senior Software Engineer, Google Research",1,1,1
"Posted by Jarrod McClean, Staff Research Scientist and Hsin-Yuan (Robert) Huang",1,1,1
"Posted by Jarrod McClean, Senior Research Scientist and Hartmut Neven, Director of Engineering, Google AI Quantum Team",1,1,1
"Posted by Jaqui Herman, Research Specialist and Tim Herrmann, Program Manager",1,1,1
"Posted by Jaqui Herman and Cat Armato, Program Managers",2,2,2
"Posted by JamieSue Goodman, Program Lead, CS First",1,1,1
"Posted by James Wexler, Software Engineer, Google AI",1,1,1
"Posted by James Wexler, Software Developer and Ian Tenney, Software Engineer, Google Research",1,1,1
"Posted by James Wexler, Senior Software Engineer, Google Big Picture Team",1,1,1
"Posted by James Lyon, Google AI, Zürich",1,1,1
"Posted by James Cook, Yechen Li, Software Engineers and Ravi Kumar, Research Scientist",1,1,1
"Posted by Jakub Łącki and Vahab Mirrokni, Research Scientists, Google Research",1,1,1
"Posted by Jakob Uszkoreit, Software Engineer, Natural Language Understanding",1,1,1
"Posted by Jakob Uszkoreit, Software Engineer",1,1,1
"Posted by Jakob Uszkoreit, Ingeniarius Programmandi",1,1,1
"Posted by Jake Brutlag, Web Search Infrastructure",1,1,1
"Posted by Jaime Lien, Research Engineer and Nicholas Gillian, Software Engineer, Google Advanced Technology and Projects",1,1,1
"Posted by Jae Hun Ro, Software Engineer and Ananda Theertha Suresh, Research Scientist, Google Research",1,1,1
"Posted by Jacob Devlin and Ming-Wei Chang, Research Scientists, Google AI Language",1,1,1
"Posted by Ivan Krasin and Tom Duerig, Software Engineers",1,1,1
"Posted by Ivan Grishchenko and Valentin Bazarevsky, Research Engineers, Google Research",1,1,1
"Posted by Iulia-Maria Comșa and Krzysztof Potempa, Research Engineers, Google Research, Zürich",1,1,1
"Posted by Itay Inbar, Senior Software Engineer, Google Research",1,1,1
"Posted by Itay Inbar and Nir Shemy, Software Engineers, Google Research",1,1,1
"Posted by Isaac Caswell and Bowen Liang, Software Engineers, Google Research",1,1,1
"Posted by Irwan Bello, Research Associate, Google Brain Team",1,1,1
"Posted by Inbar Mosseri, Software Engineer and Michael Rubinstein, Research Scientist, Google Research",1,1,1
"Posted by Inbar Mosseri and Oran Lang, Software Engineers, Google Research",1,1,1
"Posted by Ian Goodfellow, Staff Research Scientist, Google Brain Team",1,1,1
"Posted by Hyunyoung Choi and Paul Liu, Senior Economists",1,1,1
"Posted by Huiyu Wang, Student Researcher and Yukun Zhu, Software Engineer, Google Research",1,1,1
"Posted by Huiyu Wang, Student Researcher and Liang-Chieh Chen, Research Scientist, Google Research",1,1,1
"Posted by Hui Fang, Software Engineer, Machine Perception",1,1,1
"Posted by Huanming Fang and Hui Miao, Software Engineers, Google Research",1,1,1
"Posted by Hsu-Chieh Lee, Xing Chen, Software Engineers, and Qian An, Analyst",1,1,1
"Posted by Hossein Talebi, Software Engineer and Peyman Milanfar Research Scientist, Machine Perception",1,1,1
"Posted by Hossein Bateni, Research Scientist and Kevin Aydin, Software Engineer, NYC Algorithms and Optimization Research Team",1,1,1
"Posted by Heng-Tze Cheng, Senior Software Engineer, Google Research",1,1,1
"Posted by Hendrik Mueller, User Experience Researcher",1,1,1
"Posted by Haşim Sak, Andrew Senior, Kanishka Rao, Françoise Beaufays and Johan Schalkwyk – Google Speech Team",1,1,1
"Posted by Hartmut Neven, Technical Lead Manager Image Recognition",1,1,1
"Posted by Hartmut Neven, Director of Engineering",3,3,3
"Posted by Harsh Mehta, Software Engineer and Jason Baldridge, Research Scientist, Google Research",1,1,1
"Posted by Hansa Srinivasan, Software Engineer, Google Research",1,1,1
"Posted by Hanna Mazzawi, Research Engineer and Xavi Gonzalvo, Research Scientist, Google Research",1,1,1
"Posted by Hanah Kim, University Programs",1,1,1
"Posted by Han Zhang, Research Scientist and Jing Yu Koh, Software Engineer, Google Research",1,1,1
"Posted by Hal Varian, Chief Economist and Hyunyoung Choi, Sr. Economist",1,1,1
"Posted by Hal Varian, Chief Economist and Hyunyoung Choi, Decision Support Engineering Analyst",1,1,1
"Posted by Hal Abelson, Visiting Faculty",1,1,1
"Posted by Hal Abelson, Professor of Computer Science and Engineering, MIT",1,1,1
"Posted by Guy Calvert, AdSense Sales",1,1,1
"Posted by Grzegorz Czajkowski, Systems Infrastructure Team",1,1,1
"Posted by Grzegorz Czajkowski, Marián Dvorský, Jerry Zhao, and Michael Conley, Systems Infrastructure",1,1,1
Posted by Greg Corrado,1,1,1
"Posted by Google Research Scientists Oriol Vinyals, Alexander Toshev, Samy Bengio, and Dumitru Erhan",1,1,1
"Posted by Gilles Baechler and Srinivas Sunkara, Software Engineers, Google Research",1,1,1
"Posted by George Tucker, Research Scientist and Sergey Levine, Faculty Advisor, Google Research",1,1,1
"Posted by George Dahl, Research Scientist, Google Brain Team",1,1,1
"Posted by Frederick Liu and Garima Pruthi, Software Engineers, Google Research",1,1,1
"Posted by Françoise Beaufays, Research Scientist",1,1,1
"Posted by Françoise Beaufays, Principal Scientist, Speech and Keyboard Team and Michael Riley, Principal Scientist, Speech and Languages Algorithms Team",1,1,1
"Posted by Franz Och, Research Scientist",1,1,1
"Posted by Franz Och, Principal Scientist",1,1,1
Posted by Franz Josef Och,1,1,1
Posted by Francoise Beaufays,1,1,1
"Posted by Francisco Ruiz Anton, Policy Manager, Google Spain",1,1,1
"Posted by Forrester Cole, Software Engineer and Tali Dekel, Research Scientist",1,1,1
"Posted by Florian Kainz, Software Engineer, Google Daydream",1,1,1
"Posted by Florian Kainz and Kiran Murthy, Software Engineers, Google Research",1,1,1
"Posted by Flavien Prost, Senior Software Engineer and Alex Beutel, Staff Research Scientist, Google Research",1,1,1
"Posted by Fernando Pereira, Research Director",3,3,3
"Posted by Fernando Pereira, Google Research",1,1,1
"Posted by Fereshteh Sadeghi, Student Researcher, Google Brain Team",1,1,1
"Posted by Felix Stahlberg and Shankar Kumar, Research Scientists, Google Research",1,1,1
"Posted by Fadi Biadsy, Research Scientist and Ron Weiss, Software Engineer, Google Research",1,1,1
"Posted by Evgeniy Gabrilovich, Senior Staff Research Scientist, Google Research, and WWW 2017 Technical Program Co-Chair",1,1,1
"Posted by Eunsol Choi, Visiting Faculty Researcher and Tom Kwiatkowski, Research Scientist, Google Research",1,1,1
"Posted by Eugene Weinstein and Pedro Moreno, Google Speech Team",1,1,1
"Posted by Esteban Real, Vincent Vanhoucke, Jonathon Shlens, Google Brain Team and",1,1,1
"Posted by Esteban Real, Staff Software Engineer and Chen Liang, Software Engineer, Google Research, Brain Team",1,1,1
"Posted by Esteban Real, Senior Software Engineer, Google Brain Team",1,1,1
"Posted by Eric Jang, Software Engineer, Robotics at Google and Coline Devin, Berkeley PhD Student and former Research Intern",1,1,1
"Posted by Erez Lieberman Aiden and Jean-Baptiste Michel, Visiting Faculty at Google",1,1,1
"Posted by Enrique Alfonseca, Staff Research Scientist, Google Assistant",1,1,1
"Posted by Enrique Alfonseca, Google Research",1,1,1
"Posted by Emmanuel Mogenet, Head of Google Research, Europe",1,1,1
"Posted by Emily Knapp, Program Manager and Benjamin Hütteroth, Program Specialist",1,1,1
"Posted by Emily Knapp and Tim Herrmann, Program Managers",1,1,1
"Posted by Emilie Danna, Google Research & Michal Segalov,Networking Software",1,1,1
"Posted by Elie Bursztein - anti-abuse & security research, Nicolas Lidzborski - Gmail security engineering, and Vijay Eranti - Gmail anti-abuse engineering",1,1,1
"Posted by Elie Bursztein - Anti-abuse team, Parisa Tabriz - Chrome Security and Niels Provos - Security team",1,1,1
"Posted by Eleni Triantafillou, Student Researcher and Vincent Dumoulin, Research Scientist, Google Research",1,1,1
