Title;Date;Contributor;Content;Link;Role
Be a Part of Ambient Intelligence;Tue Nov 16 11:43:00 UTC 2021;Bob Mars;"Ambient intelligence is an environment where each of your devices and services is interconnected through artificial intelligence (AI), offering far more capabilities than any single service or device could. In this paradigm, AI understands the state of your environment and your preferences, helps you when you need it, and recedes into the background when you don't. Imagine a smart picture frame that shows you your personal schedule as you approach it, interacts with a third-party weather service to proactively make a suggestion for what to wear, and reverts to artwork as you walk away.
Amazon is just one of many companies investing in ambient intelligence. We're making it easier for developers and partners to build devices and services that integrate deeply with our products. We believe that a truly ambient environment will include many different technologies and voice AIs working together, seamlessly, in a customer's household. Amazon understands that developing ambient environments requires support and knowledge from the entire industry — so we sponsored the Voice Interoperability Initiative to support and accelerate voice AIs working together.
In a world with multiple voice services, each with different capabilities, we believe customers should have the freedom to choose their preferred service. To this end, Amazon, along with leading technology companies, announced the Voice Interoperability Initiative (VII) just over two years ago. VII now has over 90 members committed to providing customers choice and flexibility to interact with multiple voice services. Our aim is to deliver this experience through simultaneously available voice services, each with their own ‘wake word’ or invocation name that enable customers to talk to the service of their choice by simply saying its name.
Bringing together many different technologies and having voice services working together in ambient environments introduces new challenges for product and voice agent designers. To understand how simultaneously available voice services can work together on the same product, Amazon published a Multi-Agent Design Guide (MADG) with the input of VII members. The MADG provides design recommendations and best practices for delivering delightful customer experiences with multi-agent devices.
The MADG paves the way to natural voice interactions with agents. For example, it should be clear to customers which agent is listening so they can direct the question they are asking or command to the intended agent. Also, when a user is in a conversation with one agent, interruptions from other agents should be limited, much the same way we limit interruptions when we engage in human conversations. The MADG covers these topics and also introduces new concepts such as Universal Device Commands (UDCs) and Agent Transfers.
UDCs allow a person to ask any agent on a device to perform certain functions, such as stopping music playback, which is helpful when it is unclear which agent was initially asked to play music because the person who started the music has since left the room. An Agent Transfer redirects to another agent on the device when a user asks an agent to perform a task that it cannot fulfill. In this case, the agent automatically initiates a dialog with another agent that may be able to fulfill the task. UDCs and Agent Transfers improve the customer experience in ambient environments by helping accomplish what the customer wants when multiple voice agents are involved.
Amazon has recently announced two new technologies that support agent interoperability on a single product that are consistent with the principles outlined in the Multi-Agent Design Guide: Alexa Custom Assistant (ACA) and the Multi-Agent eXperience (MAX) Toolkit.
ACA is a comprehensive new solution built directly on top of Alexa technology that lets device makers and service providers create intelligent assistants tailored to their brand personality and customer needs. It provides companies with access to world class, always-improving voice AI technology, customized with a unique wake word, voice, skills, and capabilities. The brand's assistant also seamlessly coexists and cooperates with Alexa, providing customers the benefit of an intelligent assistant that is their product and services expert, while Alexa provides the familiar experiences they already know and love.
MAX Toolkit includes an agent-agnostic MAX Library middleware that enables your agent and cloud services to coordinate and interoperate with other agents. MAX models conversations between people and agents in much the same way that people engage in conversations with one another. It also provides methods for coordinating potential simultaneous speech output by multiple agents. For example, if the user has asked an agent to remind them of something later in the day and that reminder is about to occur while another agent is speaking, the reminder speech can be queued to be output after the speaking agent finishes.
Both ACA and MAX facilitate the integration of multiple agents on products in ambient environments. Use ACA to host your brand agent if you do not have a voice agent infrastructure. Or consider MAX Toolkit to integrate your agent and its cloud services alongside other agents and Alexa on your product.
Today, customers can interact with Alexa and other agents on a number of devices, including Facebook's Portal devices and Deutsche Telekom's Smart Speaker Mini. There are also devices from Orange, Xiaomi, OnePlus and more as well as in vehicles from Audi, BMW, VW, and Nissan where voice agents co-exist. That's the beauty of ambient intelligence done right — it enables developers to bring together different solutions into a unified, delightful customer experience.
In the coming years, a large number of homes and work places will have ambient intelligence that will be able to learn about your environment and preferences and act on those insights in ways that are useful to you. Ambient environments consist of many different technologies and voice agents that work together seamlessly on, and across, devices. VII, MADG, ACA and MAX Toolkit are making it easier for developers and partners to build devices and voice services that work well together in serving customer needs.";https://developer.amazon.com/en-US/blogs/alexa/device-makers/2021/11/be-a-part-of-ambient-intelligence;
Launch of Smart Home Device Health Service;Mon Nov 08 13:02:00 UTC 2021;Sharon Morrow;"Do you want to use Smart Home technology to help customers resolve device issues like connectivity? Today we are pleased to announce “Smart Home Device Health Service (SHDHS)”, a first step on our journey to support customers as they purchase and use a wide variety of Smart Home devices. Smart Home Device Health Service is a free service that monitors the status of Smart Home devices and, if an issue is detected, guides customers through the troubleshooting process. With Device Health Service, customers can solve device issues themselves, giving them more time to enjoy the convenience of Smart Home technology.

Device Health Service analyzes device health to detect network connectivity issues, notifies the customer, then suggests ways to reconnect the device. For example, if a device is disconnected from a Wi-Fi network, Device Health Service will send a notification to the customer and provide device-specific troubleshooting steps as shown in the images below. If these do not resolve the problem, the Alexa App will guide the customer to the right customer support tools for further assistance.
In this first release, we are launching support for LIFX, Sengled, and TP-Link KASA lights. In 2022, we plan to expand Device Health Service support to other devices that provide device health status, including many products with the Certified for Humans badge.
To add the benefits of Device Health Service to your device, just implement the Alexa.EndpointHealth interface in your Alexa skill! This will enable your device to report its connectivity status to Alexa. Detailed developer documentation can be found here.";https://developer.amazon.com/en-US/blogs/alexa/device-makers/2021/11/smart-home-device-health-service;
Support for Matter over Thread coming to Echo and eero devices;Wed Nov 03 15:23:00 UTC 2021;Gabe Kassel;"Today, we are excited to announce our support for Matter over Thread in millions of Echo and eero households, further expanding Amazon’s commitment to Matter and reinforcing our smart home philosophy of flexibility, privacy, collaboration, and interoperability.
There are over 140,000 smart home products compatible with Alexa, and customers have connected more than 200 million smart home devices to Alexa over wifi, Zigbee, and BLE. By adding support for Matter, over Thread and wifi, we are continuing our efforts to ensure customers can use Alexa with as many devices as possible while allowing device makers to build with their preferred protocols.

Thread provides a low-power, low-bandwidth, and low-latency mesh networking option when building Matter devices. We are already working with leading brands who are creating Matter over Thread devices, such as Yale, Wemo, Schlage, Sengled, Netatmo, Eve, Nanoleaf, Tuya, eWeLink and Leedarson.
After contributing to the Thread Group for over five years as a member, we are now joining the Thread Group Board of Directors to help shape the future of this key Matter protocol. As a board member, we are excited to provide thought leadership and advocacy for Thread as a standard, contribute to ongoing open-source development, and increase the number of Thread border routers. We are pleased to announce that we will be supporting Matter over Thread across millions of new and existing Echo and eero devices. All eero Pro, eero Beacon, eero Pro 6, and eero 6 devices already act as border routers, and they will gain Matter over Thread support alongside Echo (4th Gen) in time for Matter’s SDK release next year. Support for additional Echo devices is expected to follow later.

For the latest updates on building Matter devices with Alexa, visit https://developer.amazon.com/en-US/alexa/matter.";https://developer.amazon.com/en-US/blogs/alexa/device-makers/2021/11/support-for-matter-over-thread-coming-to-echo-and-eero-devices;
Alexa is Coming to Hospitals and Senior Living Communities to Improve Care Experience and Help Fight Loneliness;Mon Oct 25 08:15:00 UTC 2021;Shantanu Kurhekar;"Today, we are excited to announce two new solutions as part of Alexa Smart Properties that will enable senior living and healthcare providers to integrate Alexa into their properties and empower residents and patients to stay connected, informed and entertained, just by asking Alexa. These two solutions take another step toward our vision for Alexa and ambient technology to foster connection and help make our customers’ lives better — inside and outside of the home.
With Alexa Smart Properties in senior living communities, we aim to reduce loneliness for senior residents by enabling interactions with friends and family via Alexa, and enable a more connected environment that enables residents to communicate with staff, participate in property activities, and stay engaged with their community, by just asking Alexa. With Alexa Smart Properties in healthcare systems, we aim to improve the care experience for patients and care providers, enabling healthcare providers to communicate with patients quickly and easily with features like calling and Drop In—without the need to enter patient rooms. This enables hospitals to increase productivity, conserve medical supplies and protective equipment such as masks, gloves, and gowns, and frees up staff time to provide more personalized care. Healthcare properties can also enable HIPAA-eligible skills to connect care providers with residents and patients in an environment designed to protect their health information. Additionally, both solutions include the Alexa capabilities customers know and love, such as in-room smart device control, entertainment, and access to information. Solution providers will have access to Alexa Management APIs and Alexa Management Console, so they can grow their business quickly by automating set up and management of Alexa on a large number of devices, and offering a wider variety of features and devices to their customers. Our early adopters share their experience in this post.
Over the last several years, social interactions in the world have undergone a significant change, and the impact of COVID-19 has further underlined this impact. Senior living communities have been hit hard, and senior residents report finding it challenging to stay in touch with their loved ones. With Alexa Smart Properties, we enable permissions-managed, two-way audio and video calling, so that senior residents can connect with friends and family often. Moreover, friends and family can check in with senior residents through inbound calling. Senior residents can stay more connected with their community by asking Alexa for the menu of the day, by joining bingo night on video, or by connecting with other residents on an Alexa call.
The healthcare systems have been under a lot of stress lately. With Alexa Smart Properties, we enable care staff such as nurses and doctors to care for patients more efficiently. Customer testimonials from early adopters indicate that Alexa has helped hospitals streamline care process, save on costly personal protection equipment (PPE) and increase staff safety by reducing the number of in-person interactions required between care staff and patients, helping to curb infection risk.
Alexa Smart Properties senior living and healthcare solutions were designed with privacy in mind. No personal information is shared with Alexa to use the device, and voice recordings are not saved. Every Amazon Echo device offers multiple layers of privacy protection, and residents and patients can disable Alexa’s ability to hear and respond to the wake word at any time simply by pressing the mute button on top of their Echo device. Amazon implements administrative, technical, and physical safeguards for protected health information received as part of HIPAA-eligible skill interactions.
Todd Carling, Director of Business Development, Fellowship Square Mesa Community says “When we started using Alexa three years ago, our senior residents were hesitant about using technology. By adopting voice technology into our community, our residents have found more independence in their daily living. We also found that we are attracting younger residents, and the average age of our residents has decreased by two and one-half years. With baby boomers entering senior living communities, they are expecting to have technology in their lives. Communities will either flourish with technology or become stagnant without technology.”
Matt Smith, CEO of Speak2Software, says ""What we do impacts people's lives. We create ways for people to connect, we deliver positive human emotions. We literally couldn't do that without our partnership with Alexa Smart Properties. They provide the tools and services for us to build our software on, but more importantly, they provide the guidance, support, and leadership we need to be successful and to bring those tears of joy to our customers.""
Craig Anderson, Director of Innovation at Baycare, says, “One of the things we like about Alexa voice technology is that it lets our care team save steps while keeping them closer to our patients. The patient can simply ask Alexa for things they need like a blanket or a glass of water. Alexa interprets all those requests and sends it to right person. It is a seamless connection between the patient and their care team.”
Timothy Driscoll, Director of Technology Strategy at Boston Children’s Hospital, says, “Boston Children's Hospital is using Amazon Echo devices to provide an array of features to patients including entertainment in the form of music and games, hospital and unit-specific frequently-asked questions, and control of the in-room televisions. Our patients will soon be able to express their needs for things like pain management support - ""Alexa, tell my nurse I'm in pain,"" or general comfort - ""Alexa, tell my nurse I need a pillow."" Using AI for the interpretation of patient intent will enable the direction of messages to the appropriate resource using real-time smart routing to existing hospital communication systems. Ultimately this will reduce the number of steps taken to understand and address patient needs.”
Visit https://developer.amazon.com/en-US/alexa/seniorliving and https://developer.amazon.com/en-US/alexa/healthcare to learn more. Contact us to onboard to Alexa Smart Properties. We can’t wait to see what you build.";https://developer.amazon.com/en-US/blogs/alexa/device-makers/2021/10/alexa-is-coming-to-hospitals-and-senior-living-communities;
Introducing the New Alexa Connect Kit SDK for Smart Home Devices ;Wed Oct 20 11:11:00 UTC 2021;Nithya Chandrasekaran;"Today, we are excited to announce Alexa Connect Kit SDK (ACK SDK), a software package that enables Original Design Manufacturers (ODMs) and System Integrators (SIs) to build their own ACK-based modules and differentiated Alexa-compatible smart device solutions without having to worry about managing cloud services, building an app, or writing an Alexa skill. Since the launch of Alexa Connect Kit in 2019, dozens of leading consumer product brands have used ACK Modules to build Alexa-compatible products ranging from lighting products to fans, air purifiers, coffee makers, microwaves, and even Christmas trees.
This new SDK enables you to build your own Alexa-compatible solutions with the same benefits as ACK, and with more control over costs and features. ODMs and SI solution providers such as Leedarson, Tonly, Innotech, and Linkplay are developing solutions with ACK SDK on Espressif hardware, and leading device makers like Globe Electric and Jasco are creating devices utilizing ACK SDK based solutions.  

“Our consumer demand is moving so quickly, and our product margins are thin; with this new ACK SDK, we are able to build a low-cost module that meets the thermal, size, and cost requirements for smart home devices like lighting products, switches, dimmer switches, plugs, and air purifiers. All of this is possible without compromising the set-up experience or the convenience of lifetime device management enabled by ACK. We value the flexibility, hardware and cost optimization options that the new ACK SDK provides for our scale,” said Kellen Yang, Global VP of Sales & Marketing, LEEDARSON IoT Technology Inc.
You can prototype your product using ACK SDK, and design your hardware module with an Amazon-qualified SoC for mass manufacturing. ACK SDK uses the same connectivity and device management software components from Amazon Common Software that many of our Amazon devices use today. You can choose the level of customization for your device, and implement simple applications with just a few managed callbacks and APIs. ACK SDK comes pre-integrated with components for Alexa control (Smart Home Skill APIs), Frustration Free Setup, security, log and metric collection, and firmware updates – managed by Amazon. Further, since ACK SDK is available as source code, it allows you to customize even more, such as fine-tuning power profiles by taking advantage of the SoCs low-power modes and having better control over peripherals. Example applications included with ACK SDK, as well as the device-side test suite for different device types, help developers catch programming errors and troubleshoot issues during prototyping. The development experience is supported by a set of robust program guidelines and certification processes to enable building secure and high-quality connected device solutions.
With the new ACK SDK, solution providers can now build device solutions to fit their design, manufacturing, and cost needs, while leveraging the ACK managed cloud. This new SDK works with any Amazon-qualified SoC, or you can apply to bring your own SoC. Additionally, unlike the existing ACK Modules which are designed to run the device application on a MCU separate from the connectivity module, ACK SDK allows you to run the device application on the same hardware module, enabling single-chip designs that open up lower cost use cases.
Solutions built with ACK SDK are backed by the ACK managed cloud service, built on AWS IoT, and benefit from using the same secure and reliable infrastructure Amazon leverages for its own products.
“We’re excited to leverage the ACK SDK through Amazon’s Solution Providers to develop a whole suite of low-cost products such as LED smart bulbs and smart lighting controls, which we weren’t previously able to enable with ACK,” said Mitchell Davis, VP of Connected Home at Jasco. “We appreciate the reliability and security of ACK’s managed cloud and infrastructure, and are excited to extend it to more products in our portfolio using this technology.”
Customers love their ACK devices because these devices offer the benefits of the Smart Home Skill API, as well as Frustration Free Setup, and Amazon Dash Replenishment. Plus, the ACK managed cloud service is built on AWS IoT, so ACK-built devices will automatically meet the cloud service reliability requirements necessary for Works with Alexa (WWA) and Certified for Humans (CFH) certifications, subject to the testing and other requirements set forth in the program guidelines for WWA and CFH. After your device is certified, you can feature the WWA or CFH badges in the Amazon Smart Home Store and on product packaging, opening new marketing opportunities and increasing customer confidence that your devices work seamlessly with Alexa.
Amazon is working with silicon vendors to grow the selection of ACK SDK compatible hardware for ODMs and SIs to choose from. 

 “We are pleased to be part of the ACK SDK program, and excited to partner with Amazon to announce our first ACK SDK-compatible development kit. Espressif’s ACK SDK-compatible development kit is going to make it even easier for solution providers and device makers to use our products to build innovative connected-devices using the best-in-class ACK SDK,” says Espressif's Director of Technical Marketing, Mr. Amey Inamdar.

 Silicon vendors can apply below to get their SoCs qualified for the program.
To build solutions and reference device designs with ACK SDK, apply to be an ACK partner today and get access to ACK SDK Developer Preview by signing up below.";https://developer.amazon.com/en-US/blogs/alexa/device-makers/2021/10/new-alexa-connect-kit-sdk-for-smart-home-devices;
