Title;Date;Contributor;Content;Link;Role
Alexa Voice Service Expands to Canadian French, with Sonos, Bose, Harman Kardon, Logitech, Jabra, and First Alert;Thu Mar 21 07:00:00 UTC 2019;Haidee Griswold;"Since November 2017, Canadian customers have used Alexa devices to stream millions of songs, access thousands of skills, and control their smart homes using their voice. Today, we are excited to announce that we are further expanding Alexa Voice Service (AVS) capabilities by bringing French language Alexa experiences to customers across Canada. Beginning March 21, device makers will be able to access the new Canadian French language models using AVS APIs, adding support for another language to their Alexa built-in products. This launch follows our October 2018 announcement that Alexa is coming to French Canadian customers.
Sonos, Bose, Harman Kardon, Jabra, Logitech, and First Alert have announced they will bring French to Canadian customers in March. With these Alexa built-in products, customers in Canada can ask Alexa to stream millions of songs from Amazon Music and access a variety of skills from major brands, including: Radio-Canada, Air Canada, MétéoMédia, Pages Jaunes, Deezer, Philips Hue, Ring Video Doorbell, LogiCircle, TP-Link, iRobot Home, Wemo, Wink, Sonos, and more.
Sonos: Sonos will offer Canadian French for their Sonos One smart speaker and Sonos Beam Smart Soundbar.
Bose: Bose will provide Canadian French into a range of wireless devices, including its QuietComfort 35 II headphones, Home Speaker 500, Soundbar 500, and Soundbar 700.
Harman Kardon: Harman Kardon will add Canadian French into its premium smart speakers, the Allure and Allure Portable.
Jabra: Jabra will offer Canadian French via its range of advanced wireless headphones and earbuds, including the Elite 65t, Elite Active 65t, and 65e Wireless Headphones.
First Alert: First Alert is adding Canadian French to their Alexa Built-in smoke and carbon monoxide detector.
Logitech: Ultimate Ears is expanding their language selection to include Canadian French on their Alexa Built-in Megablast portable speakers.
You can now speak to, and receive responses from, Alexa in Canadian French on supported devices. Try these sample utterances to get started:
Canadian French:
Alexa, quel temps fait-il?
Alexa, mets une minuterie de cinq minutes.
Alexa, ajoute du lait à ma liste d'achats.
Get an overview of AVS and start building with the AVS Device SDK now. Learn about AVS multi-language and localization support on our AVS International page.";https://developer.amazon.com/en-US/blogs/alexa/device-makers/2019/03/alexa-voice-service-expands-to-canadian-french-with-sonos-bose-harman-kardon-logitech-jabra-and-first-alert;
Introducing Product Access Control for the AVS Developer Portal;Wed Mar 13 07:00:00 UTC 2019;Vinay Athma;"On 8-March-2019, Alexa Voice Service (AVS) launched a new capability in the AVS Developer Portal called Product Access Control. This capability enables portal users with the Administrator role to manage which AVS products the users in their account can access.
Product Access Control is useful for two core reasons:

Working with External Entities: If your company works closely with external entities such as AVS System Integrators (SIs) or Original Device Manufacturers (ODMs), Product Access Control allows you to invite and grant access to users for specific AVS products in your developer account. This makes it easy for external parties to collaborate with your company on a specific product without being able to see or access other AVS devices in your account.
Maintaining Product Secrecy: If your developer account has an AVS product that you do not want accessible by others in your company (e.g. a secret project), Product Access Control allows you to restrict who has access to that product.

Product Access Control can be accessed within “AVS Developer Portal > My Preferences > Users & Access.” Please note that this capability is available only to users who have an Administrator role in your developer account. See the screenshot below:";https://developer.amazon.com/en-US/blogs/alexa/device-makers/2019/03/introducing-product-access-control-for-the-avs-developer-portal;
Mesh Wi-Fi Systems with Alexa Built-in: Redefining How Users Interact with their Wireless Network;Wed Feb 20 08:00:00 UTC 2019;Dileepan Narayanan;"Qualcomm Technologies, Inc. today announced the launch of the Qualcomm Mesh Networking Development Kit for Amazon Alexa Voice Service (AVS). This development kit accelerates the integration of AVS into mesh Wi-Fi systems.
The Wi-Fi router in the home has held an important and evolving role in enabling connected devices and experiences. As Wi-Fi technology faces the explosive increase of video consumption and connected devices, ensuring corner-to-corner Radio Frequency (RF) coverage in homes with brick or cinder block walls is a challenge. Data and RF requirements have resulted in the Wi-Fi router moving to more central locations within the home by the consumer, many of whom are leveraging Alexa’s ability to play the role of central communicator in the smart home ecosystem. These factors have also resulted in the standalone Wi-Fi router evolving into mesh Wi-Fi systems. Collectively, these changes make the residential Wi-Fi network a natural new home for Alexa.
The Qualcomm Mesh Networking Development Kit for Amazon AVS is the first ever Amazon-qualified reference design for a mesh Wi-Fi system with Alexa built-in. This reference platform is based on the Qualcomm IPQ4019 SoC and includes a rectangular 4-microphone array, far-field audio processing algorithms for noise suppression, acoustic echo cancellation, wake word engine, and the AVS Device SDK, to provide far-field voice recognition capability. It simplifies product engineering and reduces development time for OEMs looking to build Alexa into mesh routers.
“Qualcomm’s development kit enables device makers to build voice-first mesh Wi-Fi systems with minimal time and financial investment,” said Priya Abani, Director of the Alexa Voice Service. “We’re thrilled that Qualcomm continues to provide solutions that make it even easier for companies to bring Alexa built-in products to their customers.” 
Here are a few ways users can interact with Alexa on their mesh Wi-Fi systems:
The Qualcomm Mesh Networking Dev Kit for Amazon AVS brings a host of benefits to consumers. First, with Alexa integrated in a mesh system, whole home deployment of Alexa is a simpler decision. Second, with Alexa leveraging the mesh system’s local processing and connectivity, the need for separate standalone Alexa built-in devices in the home is reduced. Third, Alexa’s integration into the home Wi-Fi infrastructure ensures more seamless control of all devices throughout the home via voice.
With the Qualcomm Mesh Networking Dev Kit for Amazon AVS, it is now simpler and quicker than ever to create next-generation voice-enabled connected experiences in the home.
To start developing with the Qualcomm Mesh Networking Dev Kit for Amazon AVS, visit Qualcomm’s product page where you’ll find specifications, guidelines, and links to distributors carrying the solution. To see all development kits for AVS qualified by Amazon, please visit our development kits for AVS page on Amazon’s developer portal.
AVS makes it easy to develop products with Alexa built-in and bring voice-forward experiences to your customers. Through AVS, you can add a new natural user interface to your products and offer your customers access to a growing number of Alexa features, smart home integrations, and skills. Get started.";https://developer.amazon.com/en-US/blogs/alexa/device-makers/2019/02/alexa-built-in-home-mesh-wi-fi-systems;
Works with Alexa Certification Helps Wyze Labs Sell 1 Million Smart Cameras in Only 12 Months;Thu Feb 07 08:00:00 UTC 2019;Brian Crum;"When four former Amazonians founded Wyze Labs in July 2017, they were on a mission: to challenge the notion that full-featured, easy-to-use, smart home cameras had to be expensive. Only one year after introducing the first generation Wyze Cam, they’ve introduced new cameras, new features, added Alexa connectivity, and achieved Works with Alexa (WWA) certification - helping them to achieve their goal of selling 1 million devices in its first year.
“In October, we celebrated the one-year anniversary of Wyze Cam and a major milestone in our business,” says Elana Fishman, co-founder and chief operating officer of Wyze Labs. “Thanks to having a reliable product, a great customer experience, and the Works with Alexa badge, we’re thrilled to have sold a million cameras in only 12 months.”
Sharing Amazon’s obsession with providing premium customer experiences, Wyze’s leadership team immediately recognized the growth opportunities offered by the Works with Alexa program. Works with Alexa is a certification program that helps assure customers the products they buy will integrate smoothly with Alexa. WWA-certified devices can carry the Works with Alexa badge, appear in the Amazon Smart Home store, and can be considered for additional co-marketing opportunities. For Wyze, adding Alexa support gave existing Wyze customers the Alexa integration they wanted, and becoming WWA certified increased customer awareness and confidence in the Wyze brand.
“Even though we exceed our customers’ expectations, buyers are often skeptical they can actually get such a high-quality camera at our competitive price tag,” says Fishman. “The Works with Alexa badge helped change that. It adds an extra stamp of quality to our products, so shoppers are confident in selecting our cameras over non-certified devices.”
 
What Customers Want: An Affordable High-Quality Smart Camera -with Alexa Integration
Wyze set out to build a high-quality smart home security camera that anyone could afford. Only three months after setting up shop, they launched the first Wyze Cam and quickly sold out in their first quarter of sales. But even after such a successful launch, Wyze wanted to improve its cameras and the user experience.
“Having used Amazon Launchpad to build our first major sales channel, we asked customers which integrations they wanted, directly on our Amazon.com product page,” says Fishman. “And the top customer request, again and again, was Alexa.”
Wyze decided to give customers what they wanted: the ability to view their Wyze Cam live stream video via Alexa. To do that, they needed to create an Alexa smart home skill. Wyze re-architected some of its communication mechanisms to integrate with Alexa. The Wyze Cam uses a peer-to-peer connection to stream video to the mobile app, instead of the cloud model used with Alexa smart home skills. The Wyze team made the investment of time and resources to make the Wyze Cam compatible with Alexa because they knew it was important to customers.
No longer limited to a smartphone app, Wyze customers can now use natural voice commands to view their camera video feeds on more devices than ever, including Alexa-enabled devices with screens like Echo Show, Echo Spot, and Fire TVs.
 
Works with Alexa: A Boost to the Business to Reach 1 Million Units Sold
Works with Alexa certification communicates to customers that your products integrate seamlessly with Alexa, with the WWA badge added to your products in both the Alexa Smart Home Store and offline channels.  For Wyze, WWA certification came just in time for Prime Day 2018, allowing them to use the WWA badge during this significant sales opportunity And Wyze isn’t alone in seeing a sales uplift after achieving WWA certification. In fact, sales analysis across the entire Amazon Smart Home store shows a double-digit sales uplift after achieving WWA certification for the 8 weeks post-certification compared to the 8 weeks pre-certification.
“What our customers asked for was to use our cameras with Alexa, and it was an awesome thing to deliver on that,” says Fishman. “But from the business side, WWA has opened up a lot of lucrative marketing opportunities not otherwise available to us.” With the WWA badge, Fishman says the Wyze Cam started “showing up all over Amazon.com” with other Alexa-compatible smart devices, immediately increasing its visibility. Wyze was also able to create promotional bundles of its cameras with Echo Show and Echo Spot, right in time for the holidays. And, as if heightened online visibility wasn’t enough, Amazon invited Wyze to feature its cameras in Amazon’s physical retail locations, including Amazon 4-Star, Amazon Books, and Amazon Pop-Ups in malls across America. And the WWA badge can be used on product packaging and marketing materials in other online and physical retail locations, increasing customer confidence wherever your products are sold. 
“The Works with Alexa program opens up a huge number of opportunities for partnerships, visibility, and general customer awareness of our products,” says Fishman. “Works with Alexa has helped us grow our sales even faster by expanding both our online and offline footprint, while delivering a great experience to our customers.”
Visit the Works with Alexa certification program site to learn more and get started. We can’t wait to see what you build.";https://developer.amazon.com/en-US/blogs/alexa/device-makers/2019/02/works-with-alexa-certification-helps-wyze-labs-sell-1-million-smart-cameras-in-only-12-months;
Tips for Submitting Test Account Credentials for Smart Home Skills;Thu Jan 31 08:00:00 UTC 2019;Aaron Tang;"With the increased popularity of Alexa-compatible smart devices, we’ve seen a surge in the number of smart home skill submissions. In 2018, there was a significant increase in Alexa-compatible devices, from 4,000 devices in January to over 28,000 devices from more than 4,500 brands in December. Developers around the world are enabled to connect any device to Alexa. Most of these skills are created using the Smart Home Skill API, but many are also created using a Custom Interaction Model. The certification process for smart home skills varies slightly based on the implementation method.

Our previous smart home blog, Tips for a Successful Alexa Smart Home Skill Certification, highlights important tips for a successful smart home skill certification. In this post, we’ll dive deep into the requirements for test account credentials as this is a certification requirement that you can easily check off and will help your skill get through certification as quickly as possible.

Smart home skills require account linking to control smart home devices. However, sometimes test credentials for account linking are not provided during skill submission, which results in the certification team being unable to successfully certify the skill, often leading to rejection. To avoid this common mistake when submitting your smart home skill for certification, be sure to provide test credentials (e.g., username and password) of the cloud-based device with which your skill will interact. The credentials should be submitted in the Testing Instructions field, located on the Distribution tab of the Developer Console, when you complete the Privacy & Compliance Page.
 
Tips for Submitting Test Account Credentials:

Make sure at least one device is discoverable on the device cloud associated with the testing credentials you provide.
Maintain the account credentials in a live status until you receive certification feedback for your skill or your skill has passed the certification process.
Ensure that the device(s) associated with the account are online and accessible until you receive certification feedback on the skill or your skill is published live.
Provide accurate account credentials (e.g. username and password) in the Testing Instructions.
Be sure to validate the test account credentials you provide with any subsequent submissions.
If the account is setup for two-step verification, then be sure to disable two-step verification. Without this, the verification code will not be accessible to certification team, causing delays and possible rejections.
 

Related Content

Tips for a Successful Alexa Smart Home Skill Certification
10 Tips for Successfully Adding Account Linking to Your Alexa Skill
Alexa Account Linking: 5 Steps to Seamlessly Link Your Alexa Skill with Login with Amazon
Understand Account Linking";https://developer.amazon.com/en-US/blogs/alexa/device-makers/2019/01/tips-for-submitting-test-account-credentials-for-smart-home-skills;
Alexa Gadgets Toolkit (Beta): How It Makes the Twerking Bear Groove to Amazon Music;Thu Jan 17 08:00:00 UTC 2019;Karen Yue;"Alexa Gadgets Toolkit (Beta): How It Makes the Twerking Bear Groove to Amazon Music
Today, we are excited to announce a new addition to the Alexa Gadgets Toolkit (Beta) – the MusicData Interface which enables you to build Bluetooth-connected gadgets that respond to Amazon Music playing on an Echo device. Tens of millions of Alexa customers enjoy playing music on their Echo devices, and we’re excited to give you the ability to make that experience even more enjoyable with accompanying gadgets.
So how does it work? When a customer says “Alexa, play popular songs on Amazon Music” and the first song begins, a single value representing the average tempo of the song (expressed in beats per minute) is sent to the gadget in the form of a Tempo directive. Another directive is sent when a song stops or transitions to another song on the Echo device. With these directives, you can choose how you want your gadget to react to the BPM data shared. For example, you can map the data to control the speed of motors, flash colors based on predefined “fast” songs, and more. There are endless possibilities for you to build gadget experiences for Alexa customers to enjoy with music.
The functionality provided through the MusicData Interface will continue to grow, but here are some ways you can use tempo data to get started on your first gadget: build a hula girl that sways its hips, a disco ball that lights the room, or even a bear that twerks when Amazon Music is playing on an Echo device.
 
Alexa Gadgets Spotlight: MusicData Interface + Twerking Bear, by Gemmy Industries
Gemmy Industries introduced its customers to the world of twerking plush animatronics in 2015. Now, they have extended the fun to Alexa customers with Twerking Bear – an animated plush that brings fun into the home of Echo device owners. Twerking Bear is the first commercial product that uses the MusicData Interface.
The diagram below illustrates how all of this works. First, a customer requests a song from Amazon Music on their Echo device, and the command is processed in the cloud. Then, the Alexa Gadgets tempo directive with the BPM value is sent from the Echo device to Twerking Bear via Bluetooth. Based on the BPM value shared, Twerking Bear moves its body motors to the song played, pauses its motors when the song stops, and adjusts the speed of its motors when a new song begins.
Other Gadget Interfaces Used by Twerking Bear
In addition to music, Twerking Bear responds to speech, timers, alarms, reminders, wake word, and notifications – which are available in the Alexa Gadgets Toolkit. You can check out Alexa Gadgets Toolkit (Beta): How It Makes the Echo Wall Clock Tick for more detail on these Gadget Interfaces.
Let’s take a look at how Twerking Bear responds to the following directives that are sent from an Echo device:
Speech
When Alexa starts speaking on an Echo device, Speechmarks Directives (SpeechData Interface) are sent to Twerking Bear with speechmark data. The Speechmarks Directives contain visemes, which are mouth positions that correspond to spoken sounds. Twerking Bear moves its mouth motors to demonstrate visual experiences of Alexa's text-to-speech (TTS) so that when a customer asks ""Alexa, what's the weather,"" he/she can observe Twerking Bear moving its mouth in sync with Alexa's response.
Wake Word Detection
When the wake word “Alexa” is detected on an Echo device, a StateUpdate Directive (StateListener Interface) is sent to Twerking Bear which includes the name and value of the state type. For the wakeword state, the valid values are active and cleared. When active, Twerking Bear tilts its head and moves its body motors for a dance movement that acknowledges the customer’s intent. This directive is also used for Twerking Bear to react to timers, alarms, and reminders on an Echo device.
 
Get Started with the Alexa Gadgets Toolkit
Available in the US, UK, and Germany, you can create your own gadget using one or more of the available Gadget Interfaces. The possibilities for designing delightful gadgets for customers to enjoy are endless. Visit our resources below to get started:

Alexa Gadgets technical documentation
Sample code on GitHub
Sign up for our email list to get updates

We can’t wait to see what you build!";https://developer.amazon.com/en-US/blogs/alexa/device-makers/2019/01/alexa-gadgets-toolkit-beta-how-it-makes-the-twerking-bear-groove-to-amazon-music;
