Title;Date;Contributor;Content;Link;Role
CES 2020 Highlights: New Alexa Experiences from Developers and Device Makers ;Wed Jan 15 08:00:00 UTC 2020;Jennifer King;"CES is officially a wrap for 2020. Throughout the event, Amazon announced dozens of new features and experiences for customers, and we joined dozens of our partners in showcasing new Alexa products and integrations. Customers worldwide have now purchased hundreds of millions of Alexa devices, and it's these innovations from developers and device makers fueling Alexa's growth.
Many new Alexa products from developers and device makers were announced at the four-day event, offering a variety of new voice-driven experiences for customers. Tens of thousands of attendees visited Amazon’s three public exhibits, where they interacted with technologies that show how Alexa makes life easier when you’re at home, at work, and on the go.
As witnessed at CES 2020, Amazon is already busy supporting the next generation of voice experiences, enabling companies from around the world to integrate Alexa into their products. Here’s a look at the new Alexa innovations from developers and device makers that debuted at CES this year.
Smart home device makers introduced many new products with Alexa to make every day easier at home – ranging from cooking appliances and shower heads to routers and security devices.

GE announced that C by GE Hubless, three-Wire Smart Switch, and two Hubless Dimmer models will now integrate with Alexa for voice control.
Moen announced next-generation, Wi-Fi/cloud-based digital shower and faucet that offer mobile connectivity with Alexa integration.
Abode announced new smart video cameras with live video stream support on Echo Show.
Kwikset introduced Halo Touch Wi-Fi Smart Lock, which features voice assistant integration with Alexa through voice commands.
Kohler unveiled a new Kohler Moxie showerhead and wireless speaker which includes Alexa Built-in.
Weber announced that Connect Smart Grill will continue to evolve and offer new functionality and features, including a planned Alexa integration in 2020.
Sengled unveiled a new range of smart light bulbs and features including a new Smart LED Edison Filament Bulb, supported by Alexa.
Schneider Electric announces Square D Connected Home, comprised of devices and applications to help homeowners consolidate the connected home, now supported by Alexa. 
LG announced LG ThinQ front-load washing machine, which can connect with Alexa to provide notifications when the laundry detergent is running low, and customers can enable Amazon Dash Replenishment via the app to automatically reorder pre-selected supplies such as detergent and fabric softener to be delivered right to their door.
Panasonic introduced HomeHawk FLOOR, a new floor lamp with a camera system that blends into any decor for smart, discreet and reliable home monitoring, now compatible with Alexa.
Orbit introduced B-hyve XR Smart Sprinkler Timer, which allows users to manage their devices using Alexa.
VIZIO unveiled All-New VIZIO Voice Remote with Alexa integration.
Klipsch unveiled a new sound bar with Alexa Built-in.
D-Link has announced new routers, including the new Smart AX5400 Mesh WiFi 6 Router, which features Amazon Alexa.
POW Audio debuts Biz And Una Ultra speakers with Alexa integration.
Toshiba announced the Toshiba smart microwave oven, which can be paired with Alexa for the ultimate in convenience and hands-free navigation.
TP-Link announced Deco Mesh Wi-Fi 6 System, which integrates Alexa so customers can quickly and easily control guest Wi-Fi networks through voice control.
ViewSonic Corp debuted a line of portable and 4K projectors with Alexa voice control.
Tineco unveiled an upgraded PURE ONE S12 V featuring integration with Alexa.
RoomMe announced new sensors that are compatible with Alexa.
CookingPal announced Julia, a new do-it-all countertop chef, which now works with Alexa.
LifeShield/ADT announced three new security devices in the “Blue by ADT” lineup: An indoor camera, an outdoor camera, and a doorbell camera with Alexa integration.
Swann announced three new products: Swann Wire-Free Security Camera, Swann Wire-Free Video Doorbell and Chime and Wi-Fi Security Tracker Camera, all fully integrated with Alexa.
Sharp Electronics unveiled its Alexa-enabled IoT Microwave Drawer Oven with Sharp Kitchen App & Easy Wave Open.
InFocus launched a new line of Alexa-enabled, frameless-designed Infinity 4K Smart TV.
ARRIS expanded its Wi-Fi 6 Tri-band mesh portfolio with new SURFboard mAX System. Using Alexa, customers can manage their SURFboard mAX system’s guest Wi-Fi, pause and unpause Wi-Fi access, and schedule specific WiFi access times.
Ossia unveiled Cota HOME, a 30-by-30 centimeter transmitter that can power multiple devices, which can be integrated with Alexa.
OneLife launched PureOne, a sustainable home and office air purifier, which can be controlled and get air quality updates from Alexa.
Lutron announced two new accessories to its Caseta line of light bulbs and switches, both of which are Alexa enabled.
Belkin announced a new crock pot, which can be controlled with Alexa.
August introduced a new 4th generation Wi-Fi smart lock, which will integrate with Alexa.
The Genie Company launched new wall mount garage door openers compatible with Alexa.
Leroy Merlin announced Enki Smart Display, a connected screen control center with Alexa voice integration.
Chamberlain announced a smart garage door opener with 3,100 lumen LEDs with Alexa capabilities.
Eufy announced the RoboVac G30 Edge with Smart Dynamic Navigation, an Optical Flow sensor to help it clean efficiently and 2000Pa suction.
Coway launched the Coway Bidetmega 400 and announced further integration with Alexa. Select Coway models can now enable notifications from Alexa when it's time to replace their Coway air purifier's filters and integrate with Amazon Dash Replenishment through Alexa.
RB announced four new products, all with Amazon Dash Replenishment capabilities: Enfamil Infant Formula, Finish Dishwasher Tablets, SmartCap for Vitamins, Supplements and Medicine Bottles, and Air Wick Essential Mist Bluetooth.
Device makers and automakers introduced new Alexa products and integrations to make Alexa more useful, more delightful, and more accessible to customers wherever they go.

Lamborghini is bringing Alexa to its Huracan Evo range starting in 2020.
Rivian will integrate Alexa into its first two all-electric vehicles, the R1S and R1T, as well as its upcoming fleet of 100,000 all-electric Amazon delivery vans.
Navigation providers like BOSCH, HERE, MELCO, Telenav and TomTom will make it even easier for automakers to add voice-first navigation experiences to upcoming vehicles.
JBL announced CLUB Headphones Series and Expands True Wireless Headphone Line-up, all with Alexa integrations.
Pioneer debuted a range of NsEX in-dash receivers with Alexa Built-in.
Royole announced Mirage Smart Speaker, which ensures access to Alexa’s full functionalities.
Safe-tec showcased a cycling helmet with Alexa Built-in, also equipped with headphones and dual microphones.
Aipower unveiled its Alexa-enabled Wearbuds Pro and updated Wristband-housed True Wireless Earbuds.
Jarvish announced a new smart motorcycle helmet with a Built-in 2K HD action camera, a sensor that detects whether the helmet is being worn, and Alexa voice capabilities.
Panasonic announced RZ-S500W noise-cancelling Earbuds that supports Alexa.
Device makers are using Alexa to help customers connect to endless entertainment and increase productivity both at work and the home office.

Sony announced its 48-inch Master Series A9S TV, the company’s smallest 4K OLED ever. The TV features connectivity with Alexa devices.
Sony Electronics announced a new line of smart speakers with Alexa capabilities.
LG unveiled eight TVs with new 77- and 65-inch class models, which will all have Alexa and Alexa Premium Far-Field Voice compatibility in the future.
Samsung released a new range of Alexa-compatible soundbars, with unique features for gaming integration and TV compatibility. Samsung also announced select 2020 smart TVs, including QLED 8K models, will feature Alexa Built-in.  
Lenovo announced a new Yoga Creator 7 PC with Alexa Built-in, with features including the ability to broadcast announcements throughout the home, and a new Smart Light accessory to demonstrate when Alexa is listening.
Hisense announced its new 4K HDR LED model with Alexa Built-in.
Citizen released a new Alexa smart speaker with an analog clock.
Panasonic announced HZ2000, a new TV featuring a custom-made Master HDR OLED Professional Edition Panel, compatible with Alexa, allowing users to operate some key TV functions, just using their voice.
Philips launched Philips Hue Play HDMI Sync Box with Built-in Alexa capabilities to control lights in your home.
Skyworth announced that Alexa is now built into its Far-Field TV platform.
Procter & Gamble announced the Oral-B Guide tooth-brushing system with a Wi-Fi-enabled base that provides real-time feedback to your mobile device while you brush and voice control with Alexa Built-in.
With the Alexa Voice Service (AVS), you can build natural voice experiences that offer customers a more intuitive way to interact with the technology they use every day. Companies are integrating Alexa into their products to create engaging voice experiences for customers. Create devices with Alexa Built-in and join the growing family of Alexa devices.";https://developer.amazon.com/en-US/blogs/alexa/device-makers/2020/01/ces-2020-highlights-new-alexa-experiences-from-developers-and-device-makers;
Alexa Gadgets Toolkit Now Supports Bluetooth Low Energy;Wed Jan 08 08:00:00 UTC 2020;BJ Haberkorn;"Since the launch of the Alexa Gadgets Toolkit with Classic Bluetooth, creators have asked for the availability of Bluetooth Low Energy (BLE) to create low-cost, power efficient Echo companion devices. Today, we are excited to announce that the Alexa Gadgets Toolkit supports BLE as an option for products to connect to Echo devices. The availability of BLE enables creators to source lower cost modules and chipsets, and consolidate hardware investments they may already have with BLE chipsets.

Once creators connect their product or prototype over BLE, they can build unique voice experiences with Alexa using custom and defined interfaces from the Alexa Gadgets Toolkit. This is exciting news for creators to build a variety of Echo companion devices for customers worldwide — from smart toys and smart clocks, to gizmos and novelties.
The Alexa Gadgets Toolkit is currently available in all locales where Alexa-enabled devices are sold. Reference our BLE technical documentation and Alexa Gadgets Raspberry Pi Samples to get started today. We can’t wait to see what you build!";https://developer.amazon.com/en-US/blogs/alexa/device-makers/2020/01/alexa-gadgets-toolkit-now-supports-bluetooth-low-energy;
Explore Alexa, Amazon Devices, and More at CES 2020;Thu Dec 19 08:00:00 UTC 2019;Morgan Edelman;"We’re three weeks away from the Consumer Electronics Show (CES) in Las Vegas (January 7-10)! The Amazon devices and Alexa teams are excited to bring a range of technologies for attendees to engage with during the show. We invite you to visit our public exhibits – spanning The Venetian, Las Vegas Convention Center, and the Sands Expo – to explore the latest innovations across Alexa, Alexa Auto, Fire TV, Dash Replenishment, Ring, and more. Throughout the show, you’ll also see how other companies are building unique Alexa experiences, and get a first look at new voice-forward products announced at the show. Developers and device makers help make Alexa smarter, more useful, and more accessible to customers around the world, and we’re excited to showcase what they’ve built during CES 2020.
Visit our public exhibit at The Venetian (Ballroom C-D) to explore the growing family of Amazon devices, including Fire TV and Dash Replenishment Service, and Alexa devices from other companies, including iRobot, Bose, LG, Lenovo, and more. Learn how brands are building voice-driven experiences for customers at home, in the car, at work, and on the go. Click here to explore the devices featured in our exhibit at CES 2020.
Follow @alexadevs and @amazonnews on Twitter for CES updates, behind-the-scenes footage, and details on a CES-exclusive social giveaway. Participate in the conversation at #AmazonCES.
Stop by the Alexa Auto exhibit at the Las Vegas Convention Center (North Hall – 5616) to see how Alexa Auto is teaming up with AWS, Amazon Pay, Fire TV, and Amazon Home Services to showcase Amazon’s breadth of automotive solutions as well as vehicles with Alexa built-in. Engage with experts and experience demos for connected vehicles, smart home, and other use cases with customers and partners from across the automotive industry. Follow Alexa Auto on Facebook, Twitter, and LinkedIn.
Visit the signature Ring House at the Sands Expo Convention Center (Halls A-D, Booth #42319) to see how all of Ring's devices and services work together to connect customers to their homes anytime, anywhere. Learn about Ring’s mission to make neighborhoods safer via accessible, affordable, and smart security. See how Ring works with Amazon Alexa and smart locks from Schlage, Yale, and Kwikset. You can also learn about our ever-growing Works with Ring program. Follow Ring on Facebook and Instagram for live updates from the Ring CES booth. We’ll share product news and customer stories showing how the Ring ecosystem works to provide peace of mind and make neighborhoods safer.
During CES, Yellow Cab riders in Las Vegas can test their trivia knowledge and win prizes by playing the Ride to Win trivia Alexa skill. Players at home can join in on the fun during CES by enabling the Ride to Win skill by saying: “Alexa, open Ride to Win.” You can also create your own trivia skill using a Skill Blueprint.
We have a lot in store for CES this year. Follow our social media accounts for real-time show updates and for opportunities to participate in social giveaways throughout the week.
We can’t wait to see you in Las Vegas!";https://developer.amazon.com/en-US/blogs/alexa/device-makers/2019/12/explore-alexa-amazon-devices-and-more-at-ces-2020;
